ffff8ca190c48b40 2024814254 C Ii:1:066:1 0:4 18 = 2000880e 00000000 0000a901 00000000 43f2
ffff8ca190c48b40 2024814264 S Ii:1:066:1 -115:4 64 <
ffff8ca190c48b40 2024826252 C Ii:1:066:1 0:4 18 = 2000890e 00000000 00001c02 00000000 6af2
ffff8ca190c48b40 2024826257 S Ii:1:066:1 -115:4 64 <
ffff8ca190c48b40 2024834253 C Ii:1:066:1 0:4 18 = 20008a0e 00000000 0000f601 00000000 1df2
ffff8ca190c48b40 2024834259 S Ii:1:066:1 -115:4 64 <
ffff8ca190c48b40 2024846252 C Ii:1:066:1 0:4 18 = 20008b0e 00000000 0000a901 00000000 6af2
ffff8ca190c48b40 2024846257 S Ii:1:066:1 -115:4 64 <
ffff8ca1aa7de900 2024847249 C Ii:1:063:3 0:1 30 = 01000000 00000000 00000000 00000000 00000000 00000000 00000000 0000
ffff8ca1aa7de900 2024847273 S Ii:1:063:3 -115:1 30 <
ffff8ca190c48b40 2024854292 C Ii:1:066:1 0:4 18 = 20008c0e 00000000 0000f601 00000000 43f2
ffff8ca190c48b40 2024854296 S Ii:1:066:1 -115:4 64 <
ffff8ca190c48b40 2024866396 C Ii:1:066:1 0:4 18 = 20008d0e 00000000 0000f601 00000000 1df2
ffff8ca190c48b40 2024866400 S Ii:1:066:1 -115:4 64 <
ffff8ca190c48b40 2024874253 C Ii:1:066:1 0:4 18 = 20008e0e 00000000 0000cf01 00000000 1df2
ffff8ca190c48b40 2024874258 S Ii:1:066:1 -115:4 64 <
ffff8ca190c48b40 2024886252 C Ii:1:066:1 0:4 18 = 20008f0e 00000000 0000cf01 00000000 43f2
ffff8ca190c48b40 2024886256 S Ii:1:066:1 -115:4 64 <
ffff8ca190c48b40 2024906257 C Ii:1:066:1 0:4 18 = 2000900e 00000000 0000cf01 00000000 6af2
ffff8ca190c48b40 2024906265 S Ii:1:066:1 -115:4 64 <
ffff8ca190c48b40 2024914254 C Ii:1:066:1 0:4 18 = 2000910e 00000000 0000cf01 00000000 43f2
ffff8ca190c48b40 2024914258 S Ii:1:066:1 -115:4 64 <
ffff8ca190c48b40 2024926255 C Ii:1:066:1 0:4 18 = 2000920e 00000000 0000f601 00000000 6af2
ffff8ca190c48b40 2024926260 S Ii:1:066:1 -115:4 64 <
ffff8ca190c48b40 2024934255 C Ii:1:066:1 0:4 18 = 2000930e 00000000 0000cf01 00000000 1df2
ffff8ca190c48b40 2024934260 S Ii:1:066:1 -115:4 64 <
ffff8ca190c48b40 2024946255 C Ii:1:066:1 0:4 18 = 2000940e 00000000 00001c02 00000000 1df2
ffff8ca190c48b40 2024946259 S Ii:1:066:1 -115:4 64 <
ffff8ca190c48b40 2024954299 C Ii:1:066:1 0:4 18 = 2000950e 00000000 0000cf01 00000000 43f2
ffff8ca190c48b40 2024954303 S Ii:1:066:1 -115:4 64 <
ffff8ca190c48b40 2024974257 C Ii:1:066:1 0:4 18 = 2000960e 00000000 0000f601 00000000 6af2
ffff8ca190c48b40 2024974262 S Ii:1:066:1 -115:4 64 <
ffff8ca190c48b40 2024986257 C Ii:1:066:1 0:4 18 = 2000970e 00000000 00001c02 00000000 43f2
ffff8ca190c48b40 2024986263 S Ii:1:066:1 -115:4 64 <
ffff8ca190c48b40 2024994257 C Ii:1:066:1 0:4 18 = 2000980e 00000000 0000a901 00000000 1df2
ffff8ca190c48b40 2024994261 S Ii:1:066:1 -115:4 64 <
ffff8ca190c48b40 2025006257 C Ii:1:066:1 0:4 18 = 2000990e 00000000 0000f601 00000000 f6f1
ffff8ca190c48b40 2025006262 S Ii:1:066:1 -115:4 64 <
ffff8ca190c48b40 2025014261 C Ii:1:066:1 0:4 18 = 20009a0e 00000000 0000cf01 00000000 f6f1
ffff8ca190c48b40 2025014271 S Ii:1:066:1 -115:4 64 <
ffff8ca190c48b40 2025026258 C Ii:1:066:1 0:4 18 = 20009b0e 00000000 0000cf01 00000000 43f2
ffff8ca190c48b40 2025026264 S Ii:1:066:1 -115:4 64 <
ffff8ca190c48b40 2025034258 C Ii:1:066:1 0:4 18 = 20009c0e 00000000 0000f601 00000000 43f2
ffff8ca190c48b40 2025034264 S Ii:1:066:1 -115:4 64 <
ffff8ca190c48b40 2025046258 C Ii:1:066:1 0:4 18 = 20009d0e 00000000 0000a901 00000000 6af2
ffff8ca190c48b40 2025046266 S Ii:1:066:1 -115:4 64 <
ffff8ca190c48b40 2025054302 C Ii:1:066:1 0:4 18 = 20009e0e 00000000 00001c02 00000000 43f2
ffff8ca190c48b40 2025054307 S Ii:1:066:1 -115:4 64 <
ffff8ca190c48b40 2025066382 C Ii:1:066:1 0:4 18 = 20009f0e 00000000 0000f601 00000000 43f2
ffff8ca190c48b40 2025066387 S Ii:1:066:1 -115:4 64 <
ffff8ca190c48b40 2025074259 C Ii:1:066:1 0:4 18 = 2000a00e 00000000 0000a901 00000000 43f2
ffff8ca190c48b40 2025074264 S Ii:1:066:1 -115:4 64 <
ffff8ca190c48b40 2025086259 C Ii:1:066:1 0:4 18 = 2000a10e 00000000 00001c02 00000000 1df2
ffff8ca190c48b40 2025086264 S Ii:1:066:1 -115:4 64 <
ffff8ca190c48b40 2025094259 C Ii:1:066:1 0:4 18 = 2000a20e 00000000 0000f601 00000000 6af2
ffff8ca190c48b40 2025094264 S Ii:1:066:1 -115:4 64 <
ffff8ca190c48b40 2025106261 C Ii:1:066:1 0:4 18 = 2000a30e 00000000 00004302 00000000 1df2
ffff8ca190c48b40 2025106265 S Ii:1:066:1 -115:4 64 <
ffff8ca190c48b40 2025114260 C Ii:1:066:1 0:4 18 = 2000a40e 00000000 00001c02 00000000 1df2
ffff8ca190c48b40 2025114264 S Ii:1:066:1 -115:4 64 <
ffff8ca190c48b40 2025126261 C Ii:1:066:1 0:4 18 = 2000a50e 00000000 0000f601 00000000 43f2
ffff8ca190c48b40 2025126265 S Ii:1:066:1 -115:4 64 <
ffff8ca190c48b40 2025134261 C Ii:1:066:1 0:4 18 = 2000a60e 00000000 00001c02 00000000 1df2
ffff8ca190c48b40 2025134265 S Ii:1:066:1 -115:4 64 <
ffff8ca190c48b40 2025146261 C Ii:1:066:1 0:4 18 = 2000a70e 00000000 0000f601 00000000 6af2
ffff8ca190c48b40 2025146264 S Ii:1:066:1 -115:4 64 <
ffff8ca190c48b40 2025154310 C Ii:1:066:1 0:4 18 = 2000a80e 00000000 0000f601 00000000 43f2
ffff8ca190c48b40 2025154313 S Ii:1:066:1 -115:4 64 <
ffff8ca190c48b40 2025166261 C Ii:1:066:1 0:4 18 = 2000a90e 00000000 00004302 00000000 43f2
ffff8ca190c48b40 2025166264 S Ii:1:066:1 -115:4 64 <
ffff8ca190c48b40 2025174262 C Ii:1:066:1 0:4 18 = 2000aa0e 00000000 0000f601 00000000 6af2
ffff8ca190c48b40 2025174266 S Ii:1:066:1 -115:4 64 <
ffff8ca190c48b40 2025186264 C Ii:1:066:1 0:4 18 = 2000ab0e 00000000 0000f601 00000000 1df2
ffff8ca190c48b40 2025186268 S Ii:1:066:1 -115:4 64 <
ffff8ca190c48b40 2025206265 C Ii:1:066:1 0:4 18 = 2000ac0e 00000000 00001c02 00000000 1df2
ffff8ca190c48b40 2025206269 S Ii:1:066:1 -115:4 64 <
ffff8ca190c48b40 2025214264 C Ii:1:066:1 0:4 18 = 2000ad0e 00000000 00004302 00000000 6af2
ffff8ca190c48b40 2025214270 S Ii:1:066:1 -115:4 64 <
ffff8ca190c48b40 2025226264 C Ii:1:066:1 0:4 18 = 2000ae0e 00000000 00001c02 00000000 6af2
ffff8ca190c48b40 2025226269 S Ii:1:066:1 -115:4 64 <
ffff8ca190c48b40 2025234264 C Ii:1:066:1 0:4 18 = 2000af0e 00000000 0000f601 00000000 6af2
ffff8ca190c48b40 2025234269 S Ii:1:066:1 -115:4 64 <
ffff8ca190c48b40 2025246265 C Ii:1:066:1 0:4 18 = 2000b00e 00000000 0000f601 00000000 43f2
ffff8ca190c48b40 2025246270 S Ii:1:066:1 -115:4 64 <
ffff8ca190c48b40 2025254317 C Ii:1:066:1 0:4 18 = 2000b10e 00000000 0000cf01 00000000 6af2
ffff8ca190c48b40 2025254321 S Ii:1:066:1 -115:4 64 <
ffff8ca190c48b40 2025266265 C Ii:1:066:1 0:4 18 = 2000b20e 00000000 0000cf01 00000000 91f2
ffff8ca190c48b40 2025266269 S Ii:1:066:1 -115:4 64 <
ffff8ca190c48b40 2025274265 C Ii:1:066:1 0:4 18 = 2000b30e 00000000 0000f601 00000000 43f2
ffff8ca190c48b40 2025274272 S Ii:1:066:1 -115:4 64 <
ffff8ca190c48b40 2025286266 C Ii:1:066:1 0:4 18 = 2000b40e 00000000 0000cf01 00000000 43f2
ffff8ca190c48b40 2025286272 S Ii:1:066:1 -115:4 64 <
ffff8ca190c48b40 2025294434 C Ii:1:066:1 0:4 18 = 2000b50e 00000000 00004302 00000000 43f2
ffff8ca190c48b40 2025294437 S Ii:1:066:1 -115:4 64 <
ffff8ca190c48b40 2025306267 C Ii:1:066:1 0:4 18 = 2000b60e 00000000 0000cf01 00000000 1df2
ffff8ca190c48b40 2025306273 S Ii:1:066:1 -115:4 64 <
ffff8ca190c48b40 2025314268 C Ii:1:066:1 0:4 18 = 2000b70e 00000000 00001c02 00000000 6af2
ffff8ca190c48b40 2025314274 S Ii:1:066:1 -115:4 64 <
ffff8ca190c48b40 2025326267 C Ii:1:066:1 0:4 18 = 2000b80e 00000000 0000f601 00000000 6af2
ffff8ca190c48b40 2025326274 S Ii:1:066:1 -115:4 64 <
ffff8ca190c48b40 2025334267 C Ii:1:066:1 0:4 18 = 2000b90e 00000000 0000cf01 00000000 6af2
ffff8ca190c48b40 2025334272 S Ii:1:066:1 -115:4 64 <
ffff8ca190c48b40 2025346267 C Ii:1:066:1 0:4 18 = 2000ba0e 00000000 00001c02 00000000 43f2
ffff8ca190c48b40 2025346272 S Ii:1:066:1 -115:4 64 <
ffff8ca190c48b40 2025354319 C Ii:1:066:1 0:4 18 = 2000bb0e 00000000 00001c02 00000000 91f2
ffff8ca190c48b40 2025354324 S Ii:1:066:1 -115:4 64 <
ffff8ca190c48b40 2025366270 C Ii:1:066:1 0:4 18 = 2000bc0e 00000000 00004302 00000000 6af2
ffff8ca190c48b40 2025366275 S Ii:1:066:1 -115:4 64 <
ffff8ca190c48b40 2025374268 C Ii:1:066:1 0:4 18 = 2000bd0e 00000000 0000f601 00000000 6af2
ffff8ca190c48b40 2025374274 S Ii:1:066:1 -115:4 64 <
ffff8ca190c48b40 2025394465 C Ii:1:066:1 0:4 18 = 2000be0e 00000000 0000f601 00000000 43f2
ffff8ca190c48b40 2025394470 S Ii:1:066:1 -115:4 64 <
ffff8ca190c48b40 2025406270 C Ii:1:066:1 0:4 18 = 2000bf0e 00000000 0000f601 00000000 b7f2
ffff8ca190c48b40 2025406274 S Ii:1:066:1 -115:4 64 <
ffff8ca190c48b40 2025414270 C Ii:1:066:1 0:4 18 = 2000c00e 00000000 0000f601 00000000 91f2
ffff8ca190c48b40 2025414274 S Ii:1:066:1 -115:4 64 <
ffff8ca190c48b40 2025426270 C Ii:1:066:1 0:4 18 = 2000c10e 00000000 0000f601 00000000 1df2
ffff8ca190c48b40 2025426274 S Ii:1:066:1 -115:4 64 <
ffff8ca190c48b40 2025434270 C Ii:1:066:1 0:4 18 = 2000c20e 00000000 0000cf01 00000000 6af2
ffff8ca190c48b40 2025434274 S Ii:1:066:1 -115:4 64 <
ffff8ca190c48b40 2025446270 C Ii:1:066:1 0:4 18 = 2000c30e 00000000 00001c02 00000000 43f2
ffff8ca190c48b40 2025446274 S Ii:1:066:1 -115:4 64 <
ffff8ca190c48b40 2025454326 C Ii:1:066:1 0:4 18 = 2000c40e 00000000 0000f601 00000000 1df2
ffff8ca190c48b40 2025454330 S Ii:1:066:1 -115:4 64 <
ffff8ca190c48b40 2025466272 C Ii:1:066:1 0:4 18 = 2000c50e 00000000 0000cf01 00000000 1df2
ffff8ca190c48b40 2025466276 S Ii:1:066:1 -115:4 64 <
ffff8ca190c48b40 2025474271 C Ii:1:066:1 0:4 18 = 2000c60e 00000000 00001c02 00000000 43f2
ffff8ca190c48b40 2025474275 S Ii:1:066:1 -115:4 64 <
ffff8ca190c48b40 2025486273 C Ii:1:066:1 0:4 18 = 2000c70e 00000000 00001c02 00000000 1df2
ffff8ca190c48b40 2025486278 S Ii:1:066:1 -115:4 64 <
ffff8ca190c48b40 2025494474 C Ii:1:066:1 0:4 18 = 2000c80e 00000000 0000cf01 00000000 6af2
ffff8ca190c48b40 2025494478 S Ii:1:066:1 -115:4 64 <
ffff8ca190c48b40 2025506273 C Ii:1:066:1 0:4 18 = 2000c90e 00000000 00001c02 00000000 43f2
ffff8ca190c48b40 2025506276 S Ii:1:066:1 -115:4 64 <
ffff8ca190c48b40 2025514273 C Ii:1:066:1 0:4 18 = 2000ca0e 00000000 0000f601 00000000 43f2
ffff8ca190c48b40 2025514277 S Ii:1:066:1 -115:4 64 <
ffff8ca190c48b40 2025526273 C Ii:1:066:1 0:4 18 = 2000cb0e 00000000 0000a901 00000000 43f2
ffff8ca190c48b40 2025526278 S Ii:1:066:1 -115:4 64 <
ffff8ca190c48b40 2025534273 C Ii:1:066:1 0:4 18 = 2000cc0e 00000000 0000f601 00000000 6af2
ffff8ca190c48b40 2025534278 S Ii:1:066:1 -115:4 64 <
ffff8ca190c48b40 2025546274 C Ii:1:066:1 0:4 18 = 2000cd0e 00000000 0000cf01 00000000 6af2
ffff8ca190c48b40 2025546277 S Ii:1:066:1 -115:4 64 <
ffff8ca190c48b40 2025554327 C Ii:1:066:1 0:4 18 = 2000ce0e 00000000 0000f601 00000000 1df2
ffff8ca190c48b40 2025554330 S Ii:1:066:1 -115:4 64 <
ffff8ca190c48b40 2025566307 C Ii:1:066:1 0:4 18 = 2000cf0e 00000000 00001c02 00000000 1df2
ffff8ca190c48b40 2025566311 S Ii:1:066:1 -115:4 64 <
ffff8ca190c48b40 2025574275 C Ii:1:066:1 0:4 18 = 2000d00e 00000000 0000f601 00000000 43f2
ffff8ca190c48b40 2025574279 S Ii:1:066:1 -115:4 64 <
ffff8ca190c48b40 2025594656 C Ii:1:066:1 0:4 18 = 2000d10e 00000000 0000f601 00000000 6af2
ffff8ca190c48b40 2025594662 S Ii:1:066:1 -115:4 64 <
ffff8ca190c48b40 2025606277 C Ii:1:066:1 0:4 18 = 2000d20e 00000000 0000a901 00000000 1df2
ffff8ca190c48b40 2025606281 S Ii:1:066:1 -115:4 64 <
ffff8ca190c48b40 2025614278 C Ii:1:066:1 0:4 18 = 2000d30e 00000000 0000f601 00000000 1df2
ffff8ca190c48b40 2025614283 S Ii:1:066:1 -115:4 64 <
ffff8ca190c48b40 2025626281 C Ii:1:066:1 0:4 18 = 2000d40e 00000000 0000f601 00000000 6af2
ffff8ca190c48b40 2025626289 S Ii:1:066:1 -115:4 64 <
ffff8ca190c48b40 2025634277 C Ii:1:066:1 0:4 18 = 2000d50e 00000000 0000f601 00000000 43f2
ffff8ca190c48b40 2025634283 S Ii:1:066:1 -115:4 64 <
ffff8ca190c48b40 2025654341 C Ii:1:066:1 0:4 18 = 2000d60e 00000000 0000cf01 00000000 6af2
ffff8ca190c48b40 2025654349 S Ii:1:066:1 -115:4 64 <
ffff8ca190c48b40 2025666279 C Ii:1:066:1 0:4 18 = 2000d70e 00000000 0000cf01 00000000 43f2
ffff8ca190c48b40 2025666284 S Ii:1:066:1 -115:4 64 <
ffff8ca190c48b40 2025674279 C Ii:1:066:1 0:4 18 = 2000d80e 00000000 0000f601 00000000 43f2
ffff8ca190c48b40 2025674286 S Ii:1:066:1 -115:4 64 <
ffff8ca190c48b40 2025686284 C Ii:1:066:1 0:4 18 = 2000d90e 00000000 0000cf01 00000000 43f2
ffff8ca190c48b40 2025686291 S Ii:1:066:1 -115:4 64 <
ffff8ca190c48b40 2025694508 C Ii:1:066:1 0:4 18 = 2000da0e 00000000 0000a901 00000000 1df2
ffff8ca190c48b40 2025694515 S Ii:1:066:1 -115:4 64 <
ffff8ca190c48b40 2025706280 C Ii:1:066:1 0:4 18 = 2000db0e 00000000 00001c02 00000000 f6f1
ffff8ca190c48b40 2025706286 S Ii:1:066:1 -115:4 64 <
ffff8ca190c48b40 2025714280 C Ii:1:066:1 0:4 18 = 2000dc0e 00000000 0000a901 00000000 1df2
ffff8ca190c48b40 2025714284 S Ii:1:066:1 -115:4 64 <
ffff8ca190c48b40 2025726279 C Ii:1:066:1 0:4 18 = 2000dd0e 00000000 0000f601 00000000 6af2
ffff8ca190c48b40 2025726283 S Ii:1:066:1 -115:4 64 <
ffff8ca190c48b40 2025754341 C Ii:1:066:1 0:4 18 = 2000de0e 00000000 0000cf01 00000000 6af2
ffff8ca190c48b40 2025754346 S Ii:1:066:1 -115:4 64 <
ffff8ca190c48b40 2025766283 C Ii:1:066:1 0:4 18 = 2000df0e 00000000 00004302 00000000 1df2
ffff8ca190c48b40 2025766288 S Ii:1:066:1 -115:4 64 <
ffff8ca190c48b40 2025774282 C Ii:1:066:1 0:4 18 = 2000e00e 00000000 0000f601 00000000 1df2
ffff8ca190c48b40 2025774287 S Ii:1:066:1 -115:4 64 <
ffff8ca190c48b40 2025786283 C Ii:1:066:1 0:4 18 = 2000e10e 00000000 0000a901 00000000 43f2
ffff8ca190c48b40 2025786287 S Ii:1:066:1 -115:4 64 <
ffff8ca190c48b40 2025794485 C Ii:1:066:1 0:4 18 = 2000e20e 00000000 0000f601 00000000 43f2
ffff8ca190c48b40 2025794490 S Ii:1:066:1 -115:4 64 <
ffff8ca190c48b40 2025806285 C Ii:1:066:1 0:4 18 = 2000e30e 00000000 00001c02 00000000 1df2
ffff8ca190c48b40 2025806293 S Ii:1:066:1 -115:4 64 <
ffff8ca190c48b40 2025814284 C Ii:1:066:1 0:4 18 = 2000e40e 00000000 0000f601 00000000 1df2
ffff8ca190c48b40 2025814290 S Ii:1:066:1 -115:4 64 <
ffff8ca190c48b40 2025826284 C Ii:1:066:1 0:4 18 = 2000e50e 00000000 0000cf01 00000000 6af2
ffff8ca190c48b40 2025826290 S Ii:1:066:1 -115:4 64 <
ffff8ca190c48b40 2025834284 C Ii:1:066:1 0:4 18 = 2000e60e 00000000 0000f601 00000000 6af2
ffff8ca190c48b40 2025834288 S Ii:1:066:1 -115:4 64 <
ffff8ca190c48b40 2025866454 C Ii:1:066:1 0:4 18 = 2000e70e 00000000 0000f601 00000000 1df2
ffff8ca190c48b40 2025866463 S Ii:1:066:1 -115:4 64 <
ffff8ca190c48b40 2025874285 C Ii:1:066:1 0:4 18 = 2000e80e 00000000 00001c02 00000000 43f2
ffff8ca190c48b40 2025874293 S Ii:1:066:1 -115:4 64 <
ffff8ca190c48b40 2025886285 C Ii:1:066:1 0:4 18 = 2000e90e 00000000 0000cf01 00000000 43f2
ffff8ca190c48b40 2025886291 S Ii:1:066:1 -115:4 64 <
ffff8ca190c48b40 2025894297 C Ii:1:066:1 0:4 18 = 2000ea0e 00000000 0000f601 00000000 6af2
ffff8ca190c48b40 2025894302 S Ii:1:066:1 -115:4 64 <
ffff8ca190c48b40 2025906286 C Ii:1:066:1 0:4 18 = 2000eb0e 00000000 00001c02 00000000 1df2
ffff8ca190c48b40 2025906290 S Ii:1:066:1 -115:4 64 <
ffff8ca190c48b40 2025926288 C Ii:1:066:1 0:4 18 = 2000ec0e 00000000 0000f601 00000000 43f2
ffff8ca190c48b40 2025926292 S Ii:1:066:1 -115:4 64 <
ffff8ca190c48b40 2025946286 C Ii:1:066:1 0:4 18 = 2000ed0e 00000000 0000cf01 00000000 43f2
ffff8ca190c48b40 2025946291 S Ii:1:066:1 -115:4 64 <
ffff8ca190c48b40 2025954287 C Ii:1:066:1 0:4 18 = 2000ee0e 00000000 0000f601 00000000 6af2
ffff8ca190c48b40 2025954290 S Ii:1:066:1 -115:4 64 <
ffff8ca190c48b40 2025966287 C Ii:1:066:1 0:4 18 = 2000ef0e 00000000 0000cf01 00000000 43f2
ffff8ca190c48b40 2025966291 S Ii:1:066:1 -115:4 64 <
ffff8ca190c48b40 2025974287 C Ii:1:066:1 0:4 18 = 2000f00e 00000000 0000f601 00000000 43f2
ffff8ca190c48b40 2025974292 S Ii:1:066:1 -115:4 64 <
ffff8ca190c48b40 2025986290 C Ii:1:066:1 0:4 18 = 2000f10e 00000000 0000f601 00000000 1df2
ffff8ca190c48b40 2025986295 S Ii:1:066:1 -115:4 64 <
ffff8ca190c48b40 2026014290 C Ii:1:066:1 0:4 18 = 2000f20e 00000000 0000cf01 00000000 43f2
ffff8ca190c48b40 2026014294 S Ii:1:066:1 -115:4 64 <
ffff8ca190c48b40 2026026293 C Ii:1:066:1 0:4 18 = 2000f30e 00000000 00001c02 00000000 6af2
ffff8ca190c48b40 2026026301 S Ii:1:066:1 -115:4 64 <
ffff8ca190c48b40 2026046292 C Ii:1:066:1 0:4 18 = 2000f40e 00000000 00008201 00000000 6af2
ffff8ca190c48b40 2026046297 S Ii:1:066:1 -115:4 64 <
ffff8ca190c48b40 2026054292 C Ii:1:066:1 0:4 18 = 2000f50e 00000000 0000f601 00000000 43f2
ffff8ca190c48b40 2026054296 S Ii:1:066:1 -115:4 64 <
ffff8ca190c48b40 2026066292 C Ii:1:066:1 0:4 18 = 2000f60e 00000000 0000a901 00000000 6af2
ffff8ca190c48b40 2026066296 S Ii:1:066:1 -115:4 64 <
ffff8ca190c48b40 2026074291 C Ii:1:066:1 0:4 18 = 2000f70e 00000000 0000f601 00000000 1df2
ffff8ca190c48b40 2026074296 S Ii:1:066:1 -115:4 64 <
ffff8ca190c48b40 2026086294 C Ii:1:066:1 0:4 18 = 2000f80e 00000000 00001c02 00000000 1df2
ffff8ca190c48b40 2026086299 S Ii:1:066:1 -115:4 64 <
ffff8ca190c48b40 2026094292 C Ii:1:066:1 0:4 18 = 2000f90e 00000000 0000f601 00000000 91f2
ffff8ca190c48b40 2026094295 S Ii:1:066:1 -115:4 64 <
ffff8ca190c48b40 2026106292 C Ii:1:066:1 0:4 18 = 2000fa0e 00000000 0000a901 00000000 f6f1
ffff8ca190c48b40 2026106298 S Ii:1:066:1 -115:4 64 <
ffff8ca190c48b40 2026114292 C Ii:1:066:1 0:4 18 = 2000fb0e 00000000 0000f601 00000000 6af2
ffff8ca190c48b40 2026114296 S Ii:1:066:1 -115:4 64 <
ffff8ca190c48b40 2026126293 C Ii:1:066:1 0:4 18 = 2000fc0e 00000000 0000cf01 00000000 43f2
ffff8ca190c48b40 2026126298 S Ii:1:066:1 -115:4 64 <
ffff8ca190c48b40 2026146293 C Ii:1:066:1 0:4 18 = 2000fd0e 00000000 00001c02 00000000 1df2
ffff8ca190c48b40 2026146298 S Ii:1:066:1 -115:4 64 <
ffff8ca190c48b40 2026154294 C Ii:1:066:1 0:4 18 = 2000fe0e 00000000 0000f601 00000000 43f2
ffff8ca190c48b40 2026154298 S Ii:1:066:1 -115:4 64 <
ffff8ca190c48b40 2026166299 C Ii:1:066:1 0:4 18 = 2000ff0e 00000000 0000f601 00000000 6af2
ffff8ca190c48b40 2026166304 S Ii:1:066:1 -115:4 64 <
ffff8ca190c48b40 2026174294 C Ii:1:066:1 0:4 18 = 2000010e 00000000 0000cf01 00000000 6af2
ffff8ca190c48b40 2026174300 S Ii:1:066:1 -115:4 64 <
ffff8ca190c48b40 2026194298 C Ii:1:066:1 0:4 18 = 2000020e 00000000 0000a901 00000000 43f2
ffff8ca190c48b40 2026194304 S Ii:1:066:1 -115:4 64 <
ffff8ca190c48b40 2026206296 C Ii:1:066:1 0:4 18 = 2000030e 00000000 0000f601 00000000 43f2
ffff8ca190c48b40 2026206300 S Ii:1:066:1 -115:4 64 <
ffff8ca190c48b40 2026214295 C Ii:1:066:1 0:4 18 = 2000040e 00000000 00001c02 00000000 1df2
ffff8ca190c48b40 2026214299 S Ii:1:066:1 -115:4 64 <
ffff8ca190c48b40 2026226296 C Ii:1:066:1 0:4 18 = 2000050e 00000000 00001c02 00000000 43f2
ffff8ca190c48b40 2026226300 S Ii:1:066:1 -115:4 64 <
ffff8ca190c48b40 2026234299 C Ii:1:066:1 0:4 18 = 2000060e 00000000 0000cf01 00000000 6af2
ffff8ca190c48b40 2026234306 S Ii:1:066:1 -115:4 64 <
ffff8ca190c48b40 2026246296 C Ii:1:066:1 0:4 18 = 2000070e 00000000 0000f601 00000000 6af2
ffff8ca190c48b40 2026246300 S Ii:1:066:1 -115:4 64 <
ffff8ca190c48b40 2026254296 C Ii:1:066:1 0:4 18 = 2000080e 00000000 0000f601 00000000 1df2
ffff8ca190c48b40 2026254301 S Ii:1:066:1 -115:4 64 <
ffff8ca190c48b40 2026266299 C Ii:1:066:1 0:4 18 = 2000090e 00000000 00001c02 00000000 1df2
ffff8ca190c48b40 2026266304 S Ii:1:066:1 -115:4 64 <
ffff8ca190c48b40 2026274300 C Ii:1:066:1 0:4 18 = 20000a0e 00000000 0000f601 00000000 1df2
ffff8ca190c48b40 2026274306 S Ii:1:066:1 -115:4 64 <
ffff8ca190c48b40 2026286301 C Ii:1:066:1 0:4 18 = 20000b0e 00000000 0000a901 00000000 1df2
ffff8ca190c48b40 2026286307 S Ii:1:066:1 -115:4 64 <
ffff8ca190c48b40 2026294298 C Ii:1:066:1 0:4 18 = 20000c0e 00000000 0000f601 00000000 1df2
ffff8ca190c48b40 2026294305 S Ii:1:066:1 -115:4 64 <
ffff8ca190c48b40 2026314299 C Ii:1:066:1 0:4 18 = 20000d0e 00000000 0000f601 00000000 43f2
ffff8ca190c48b40 2026314304 S Ii:1:066:1 -115:4 64 <
ffff8ca190c48b40 2026326300 C Ii:1:066:1 0:4 18 = 20000e0e 00000000 0000cf01 00000000 1df2
ffff8ca190c48b40 2026326305 S Ii:1:066:1 -115:4 64 <
ffff8ca190c48b40 2026334301 C Ii:1:066:1 0:4 18 = 20000f0e 00000000 0000f601 00000000 43f2
ffff8ca190c48b40 2026334306 S Ii:1:066:1 -115:4 64 <
ffff8ca190c48b40 2026346299 C Ii:1:066:1 0:4 18 = 2000100e 00000000 0000a901 00000000 43f2
ffff8ca190c48b40 2026346303 S Ii:1:066:1 -115:4 64 <
ffff8ca190c48b40 2026354300 C Ii:1:066:1 0:4 18 = 2000110e 00000000 0000cf01 00000000 43f2
ffff8ca190c48b40 2026354304 S Ii:1:066:1 -115:4 64 <
ffff8ca190c48b40 2026366300 C Ii:1:066:1 0:4 18 = 2000120e 00000000 0000f601 00000000 1df2
ffff8ca190c48b40 2026366305 S Ii:1:066:1 -115:4 64 <
ffff8ca190c48b40 2026374301 C Ii:1:066:1 0:4 18 = 2000130e 00000000 0000a901 00000000 43f2
ffff8ca190c48b40 2026374306 S Ii:1:066:1 -115:4 64 <
ffff8ca190c48b40 2026386304 C Ii:1:066:1 0:4 18 = 2000140e 00000000 00008201 00000000 1df2
ffff8ca190c48b40 2026386309 S Ii:1:066:1 -115:4 64 <
ffff8ca190c48b40 2026394301 C Ii:1:066:1 0:4 18 = 2000150e 00000000 0000cf01 00000000 1df2
ffff8ca190c48b40 2026394305 S Ii:1:066:1 -115:4 64 <
ffff8ca190c48b40 2026414303 C Ii:1:066:1 0:4 18 = 2000160e 00000000 0000f601 00000000 43f2
ffff8ca190c48b40 2026414310 S Ii:1:066:1 -115:4 64 <
ffff8ca190c48b40 2026426302 C Ii:1:066:1 0:4 18 = 2000170e 00000000 0000a901 00000000 1df2
ffff8ca190c48b40 2026426307 S Ii:1:066:1 -115:4 64 <
ffff8ca190c48b40 2026434302 C Ii:1:066:1 0:4 18 = 2000180e 00000000 00001c02 00000000 1df2
ffff8ca190c48b40 2026434307 S Ii:1:066:1 -115:4 64 <
ffff8ca190c48b40 2026446303 C Ii:1:066:1 0:4 18 = 2000190e 00000000 0000f601 00000000 6af2
ffff8ca190c48b40 2026446307 S Ii:1:066:1 -115:4 64 <
ffff8ca190c48b40 2026454303 C Ii:1:066:1 0:4 18 = 20001a0e 00000000 0000cf01 00000000 43f2
ffff8ca190c48b40 2026454307 S Ii:1:066:1 -115:4 64 <
ffff8ca190c48b40 2026466446 C Ii:1:066:1 0:4 18 = 20001b0e 00000000 0000a901 00000000 43f2
ffff8ca190c48b40 2026466450 S Ii:1:066:1 -115:4 64 <
ffff8ca190c48b40 2026474304 C Ii:1:066:1 0:4 18 = 20001c0e 00000000 0000f601 00000000 43f2
ffff8ca190c48b40 2026474310 S Ii:1:066:1 -115:4 64 <
ffff8ca190c48b40 2026486305 C Ii:1:066:1 0:4 18 = 20001d0e 00000000 0000f601 00000000 6af2
ffff8ca190c48b40 2026486309 S Ii:1:066:1 -115:4 64 <
ffff8ca190c48b40 2026494305 C Ii:1:066:1 0:4 18 = 20001e0e 00000000 0000f601 00000000 43f2
ffff8ca190c48b40 2026494309 S Ii:1:066:1 -115:4 64 <
ffff8ca190c48b40 2026506305 C Ii:1:066:1 0:4 18 = 20001f0e 00000000 0000cf01 00000000 1df2
ffff8ca190c48b40 2026506311 S Ii:1:066:1 -115:4 64 <
ffff8ca190c48b40 2026514306 C Ii:1:066:1 0:4 18 = 2000200e 00000000 00004302 00000000 43f2
ffff8ca190c48b40 2026514310 S Ii:1:066:1 -115:4 64 <
ffff8ca190c48b40 2026526307 C Ii:1:066:1 0:4 18 = 2000210e 00000000 0000cf01 00000000 43f2
ffff8ca190c48b40 2026526312 S Ii:1:066:1 -115:4 64 <
ffff8ca190c48b40 2026534307 C Ii:1:066:1 0:4 18 = 2000220e 00000000 0000f601 00000000 6af2
ffff8ca190c48b40 2026534311 S Ii:1:066:1 -115:4 64 <
ffff8ca190c48b40 2026546306 C Ii:1:066:1 0:4 18 = 2000230e 00000000 00001c02 00000000 43f2
ffff8ca190c48b40 2026546311 S Ii:1:066:1 -115:4 64 <
ffff8ca190c48b40 2026554307 C Ii:1:066:1 0:4 18 = 2000240e 00000000 0000f601 00000000 6af2
ffff8ca190c48b40 2026554311 S Ii:1:066:1 -115:4 64 <
ffff8ca190c48b40 2026566558 C Ii:1:066:1 0:4 18 = 2000250e 00000000 0000f601 00000000 43f2
ffff8ca190c48b40 2026566566 S Ii:1:066:1 -115:4 64 <
ffff8ca190c48b40 2026574308 C Ii:1:066:1 0:4 18 = 2000260e 00000000 0000cf01 00000000 6af2
ffff8ca190c48b40 2026574314 S Ii:1:066:1 -115:4 64 <
ffff8ca190c48b40 2026586313 C Ii:1:066:1 0:4 18 = 2000270e 00000000 0000cf01 00000000 1df2
ffff8ca190c48b40 2026586323 S Ii:1:066:1 -115:4 64 <
ffff8ca190c48b40 2026594309 C Ii:1:066:1 0:4 18 = 2000280e 00000000 0000f601 00000000 6af2
ffff8ca190c48b40 2026594316 S Ii:1:066:1 -115:4 64 <
ffff8ca190c48b40 2026606312 C Ii:1:066:1 0:4 18 = 2000290e 00000000 0000f601 00000000 f6f1
ffff8ca190c48b40 2026606318 S Ii:1:066:1 -115:4 64 <
ffff8ca190c48b40 2026614309 C Ii:1:066:1 0:4 18 = 20002a0e 00000000 0000f601 00000000 1df2
ffff8ca190c48b40 2026614314 S Ii:1:066:1 -115:4 64 <
ffff8ca190c48b40 2026626311 C Ii:1:066:1 0:4 18 = 20002b0e 00000000 0000cf01 00000000 1df2
ffff8ca190c48b40 2026626318 S Ii:1:066:1 -115:4 64 <
ffff8ca190c48b40 2026634312 C Ii:1:066:1 0:4 18 = 20002c0e 00000000 00001c02 00000000 6af2
ffff8ca190c48b40 2026634318 S Ii:1:066:1 -115:4 64 <
ffff8ca190c48b40 2026646311 C Ii:1:066:1 0:4 18 = 20002d0e 00000000 00001c02 00000000 f6f1
ffff8ca190c48b40 2026646315 S Ii:1:066:1 -115:4 64 <
ffff8ca190c48b40 2026654313 C Ii:1:066:1 0:4 18 = 20002e0e 00000000 0000f601 00000000 1df2
ffff8ca190c48b40 2026654319 S Ii:1:066:1 -115:4 64 <
ffff8ca190c48b40 2026666311 C Ii:1:066:1 0:4 18 = 20002f0e 00000000 0000f601 00000000 6af2
ffff8ca190c48b40 2026666317 S Ii:1:066:1 -115:4 64 <
ffff8ca190c48b40 2026686315 C Ii:1:066:1 0:4 18 = 2000300e 00000000 00001c02 00000000 6af2
ffff8ca190c48b40 2026686320 S Ii:1:066:1 -115:4 64 <
ffff8ca190c48b40 2026694313 C Ii:1:066:1 0:4 18 = 2000310e 00000000 00001c02 00000000 f6f1
ffff8ca190c48b40 2026694319 S Ii:1:066:1 -115:4 64 <
ffff8ca190c48b40 2026706313 C Ii:1:066:1 0:4 18 = 2000320e 00000000 0000cf01 00000000 6af2
ffff8ca190c48b40 2026706319 S Ii:1:066:1 -115:4 64 <
ffff8ca190c48b40 2026714313 C Ii:1:066:1 0:4 18 = 2000330e 00000000 0000f601 00000000 1df2
ffff8ca190c48b40 2026714319 S Ii:1:066:1 -115:4 64 <
ffff8ca190c48b40 2026726313 C Ii:1:066:1 0:4 18 = 2000340e 00000000 0000cf01 00000000 43f2
ffff8ca190c48b40 2026726320 S Ii:1:066:1 -115:4 64 <
ffff8ca190c48b40 2026734314 C Ii:1:066:1 0:4 18 = 2000350e 00000000 00001c02 00000000 1df2
ffff8ca190c48b40 2026734319 S Ii:1:066:1 -115:4 64 <
ffff8ca190c48b40 2026746314 C Ii:1:066:1 0:4 18 = 2000360e 00000000 0000f601 00000000 f6f1
ffff8ca190c48b40 2026746319 S Ii:1:066:1 -115:4 64 <
ffff8ca190c48b40 2026754315 C Ii:1:066:1 0:4 18 = 2000370e 00000000 0000f601 00000000 43f2
ffff8ca190c48b40 2026754320 S Ii:1:066:1 -115:4 64 <
ffff8ca190c48b40 2026766476 C Ii:1:066:1 0:4 18 = 2000380e 00000000 0000cf01 00000000 1df2
ffff8ca190c48b40 2026766482 S Ii:1:066:1 -115:4 64 <
ffff8ca190c48b40 2026786318 C Ii:1:066:1 0:4 18 = 2000390e 00000000 0000f601 00000000 43f2
ffff8ca190c48b40 2026786326 S Ii:1:066:1 -115:4 64 <
ffff8ca190c48b40 2026794315 C Ii:1:066:1 0:4 18 = 20003a0e 00000000 0000f601 00000000 1df2
ffff8ca190c48b40 2026794320 S Ii:1:066:1 -115:4 64 <
ffff8ca190c48b40 2026806317 C Ii:1:066:1 0:4 18 = 20003b0e 00000000 0000cf01 00000000 43f2
ffff8ca190c48b40 2026806324 S Ii:1:066:1 -115:4 64 <
ffff8ca190c48b40 2026814317 C Ii:1:066:1 0:4 18 = 20003c0e 00000000 0000cf01 00000000 1df2
ffff8ca190c48b40 2026814322 S Ii:1:066:1 -115:4 64 <
ffff8ca190c48b40 2026826318 C Ii:1:066:1 0:4 18 = 20003d0e 00000000 0000cf01 00000000 43f2
ffff8ca190c48b40 2026826323 S Ii:1:066:1 -115:4 64 <
ffff8ca190c48b40 2026834316 C Ii:1:066:1 0:4 18 = 20003e0e 00000000 00001c02 00000000 6af2
ffff8ca190c48b40 2026834322 S Ii:1:066:1 -115:4 64 <
ffff8ca190c48b40 2026846340 C Ii:1:066:1 0:4 18 = 20003f0e 00000000 0000cf01 00000000 43f2
ffff8ca190c48b40 2026846345 S Ii:1:066:1 -115:4 64 <
ffff8ca190c48b40 2026854316 C Ii:1:066:1 0:4 18 = 2000400e 00000000 0000cf01 00000000 f6f1
ffff8ca190c48b40 2026854321 S Ii:1:066:1 -115:4 64 <
ffff8ca190c48b40 2026866552 C Ii:1:066:1 0:4 18 = 2000410e 00000000 00001c02 00000000 6af2
ffff8ca190c48b40 2026866561 S Ii:1:066:1 -115:4 64 <
ffff8ca190c48b40 2026874318 C Ii:1:066:1 0:4 18 = 2000420e 00000000 0000f601 00000000 6af2
ffff8ca190c48b40 2026874326 S Ii:1:066:1 -115:4 64 <
ffff8ca190c48b40 2026886319 C Ii:1:066:1 0:4 18 = 2000430e 00000000 00004302 00000000 43f2
ffff8ca190c48b40 2026886324 S Ii:1:066:1 -115:4 64 <
ffff8ca190c48b40 2026894320 C Ii:1:066:1 0:4 18 = 2000440e 00000000 0000cf01 00000000 6af2
ffff8ca190c48b40 2026894326 S Ii:1:066:1 -115:4 64 <
ffff8ca190c48b40 2026906319 C Ii:1:066:1 0:4 18 = 2000450e 00000000 0000f601 00000000 1df2
ffff8ca190c48b40 2026906325 S Ii:1:066:1 -115:4 64 <
ffff8ca190c48b40 2026914319 C Ii:1:066:1 0:4 18 = 2000460e 00000000 0000f601 00000000 43f2
ffff8ca190c48b40 2026914322 S Ii:1:066:1 -115:4 64 <
ffff8ca190c48b40 2026926319 C Ii:1:066:1 0:4 18 = 2000470e 00000000 0000f601 00000000 f6f1
ffff8ca190c48b40 2026926326 S Ii:1:066:1 -115:4 64 <
ffff8ca190c48b40 2026934319 C Ii:1:066:1 0:4 18 = 2000480e 00000000 00001c02 00000000 6af2
ffff8ca190c48b40 2026934324 S Ii:1:066:1 -115:4 64 <
ffff8ca190c48b40 2026946319 C Ii:1:066:1 0:4 18 = 2000490e 00000000 0000f601 00000000 6af2
ffff8ca190c48b40 2026946324 S Ii:1:066:1 -115:4 64 <
ffff8ca190c48b40 2026954320 C Ii:1:066:1 0:4 18 = 20004a0e 00000000 0000f601 00000000 43f2
ffff8ca190c48b40 2026954326 S Ii:1:066:1 -115:4 64 <
ffff8ca190c48b40 2026966486 C Ii:1:066:1 0:4 18 = 20004b0e 00000000 0000a901 00000000 43f2
ffff8ca190c48b40 2026966491 S Ii:1:066:1 -115:4 64 <
ffff8ca190c48b40 2026974320 C Ii:1:066:1 0:4 18 = 20004c0e 00000000 00004302 00000000 91f2
ffff8ca190c48b40 2026974325 S Ii:1:066:1 -115:4 64 <
ffff8ca190c48b40 2026986321 C Ii:1:066:1 0:4 18 = 20004d0e 00000000 0000f601 00000000 43f2
ffff8ca190c48b40 2026986327 S Ii:1:066:1 -115:4 64 <
ffff8ca190c48b40 2026994321 C Ii:1:066:1 0:4 18 = 20004e0e 00000000 0000f601 00000000 6af2
ffff8ca190c48b40 2026994326 S Ii:1:066:1 -115:4 64 <
ffff8ca190c48b40 2027006321 C Ii:1:066:1 0:4 18 = 20004f0e 00000000 0000cf01 00000000 1df2
ffff8ca190c48b40 2027006327 S Ii:1:066:1 -115:4 64 <
ffff8ca190c48b40 2027014322 C Ii:1:066:1 0:4 18 = 2000500e 00000000 00001c02 00000000 43f2
ffff8ca190c48b40 2027014327 S Ii:1:066:1 -115:4 64 <
ffff8ca190c48b40 2027026324 C Ii:1:066:1 0:4 18 = 2000510e 00000000 0000cf01 00000000 1df2
ffff8ca190c48b40 2027026329 S Ii:1:066:1 -115:4 64 <
ffff8ca190c48b40 2027034322 C Ii:1:066:1 0:4 18 = 2000520e 00000000 0000cf01 00000000 43f2
ffff8ca190c48b40 2027034326 S Ii:1:066:1 -115:4 64 <
ffff8ca190c48b40 2027054323 C Ii:1:066:1 0:4 18 = 2000530e 00000000 0000f601 00000000 43f2
ffff8ca190c48b40 2027054326 S Ii:1:066:1 -115:4 64 <
ffff8ca190c48b40 2027066401 C Ii:1:066:1 0:4 18 = 2000540e 00000000 0000f601 00000000 1df2
ffff8ca190c48b40 2027066405 S Ii:1:066:1 -115:4 64 <
ffff8ca190c48b40 2027074325 C Ii:1:066:1 0:4 18 = 2000550e 00000000 0000cf01 00000000 43f2
ffff8ca190c48b40 2027074330 S Ii:1:066:1 -115:4 64 <
ffff8ca190c48b40 2027086324 C Ii:1:066:1 0:4 18 = 2000560e 00000000 0000f601 00000000 6af2
ffff8ca190c48b40 2027086328 S Ii:1:066:1 -115:4 64 <
ffff8ca190c48b40 2027094324 C Ii:1:066:1 0:4 18 = 2000570e 00000000 00001c02 00000000 43f2
ffff8ca190c48b40 2027094328 S Ii:1:066:1 -115:4 64 <
ffff8ca190c48b40 2027106324 C Ii:1:066:1 0:4 18 = 2000580e 00000000 0000cf01 00000000 91f2
ffff8ca190c48b40 2027106327 S Ii:1:066:1 -115:4 64 <
ffff8ca190c48b40 2027114325 C Ii:1:066:1 0:4 18 = 2000590e 00000000 0000f601 00000000 1df2
ffff8ca190c48b40 2027114328 S Ii:1:066:1 -115:4 64 <
ffff8ca190c48b40 2027126325 C Ii:1:066:1 0:4 18 = 20005a0e 00000000 0000f601 00000000 cff1
ffff8ca190c48b40 2027126330 S Ii:1:066:1 -115:4 64 <
ffff8ca190c48b40 2027134325 C Ii:1:066:1 0:4 18 = 20005b0e 00000000 0000f601 00000000 43f2
ffff8ca190c48b40 2027134329 S Ii:1:066:1 -115:4 64 <
ffff8ca190c48b40 2027146325 C Ii:1:066:1 0:4 18 = 20005c0e 00000000 00001c02 00000000 1df2
ffff8ca190c48b40 2027146329 S Ii:1:066:1 -115:4 64 <
ffff8ca190c48b40 2027154329 C Ii:1:066:1 0:4 18 = 20005d0e 00000000 0000cf01 00000000 91f2
ffff8ca190c48b40 2027154335 S Ii:1:066:1 -115:4 64 <
ffff8ca190c48b40 2027166329 C Ii:1:066:1 0:4 18 = 20005e0e 00000000 0000cf01 00000000 43f2
ffff8ca190c48b40 2027166336 S Ii:1:066:1 -115:4 64 <
ffff8ca190c48b40 2027186327 C Ii:1:066:1 0:4 18 = 20005f0e 00000000 00001c02 00000000 f6f1
ffff8ca190c48b40 2027186331 S Ii:1:066:1 -115:4 64 <
ffff8ca190c48b40 2027194327 C Ii:1:066:1 0:4 18 = 2000600e 00000000 0000a901 00000000 43f2
ffff8ca190c48b40 2027194332 S Ii:1:066:1 -115:4 64 <
ffff8ca190c48b40 2027206330 C Ii:1:066:1 0:4 18 = 2000610e 00000000 0000f601 00000000 43f2
ffff8ca190c48b40 2027206336 S Ii:1:066:1 -115:4 64 <
ffff8ca190c48b40 2027214328 C Ii:1:066:1 0:4 18 = 2000620e 00000000 00001c02 00000000 6af2
ffff8ca190c48b40 2027214332 S Ii:1:066:1 -115:4 64 <
ffff8ca190c48b40 2027226328 C Ii:1:066:1 0:4 18 = 2000630e 00000000 00001c02 00000000 43f2
ffff8ca190c48b40 2027226333 S Ii:1:066:1 -115:4 64 <
ffff8ca190c48b40 2027234329 C Ii:1:066:1 0:4 18 = 2000640e 00000000 00001c02 00000000 1df2
ffff8ca190c48b40 2027234333 S Ii:1:066:1 -115:4 64 <
ffff8ca190c48b40 2027246329 C Ii:1:066:1 0:4 18 = 2000650e 00000000 00001c02 00000000 43f2
ffff8ca190c48b40 2027246338 S Ii:1:066:1 -115:4 64 <
ffff8ca190c48b40 2027254329 C Ii:1:066:1 0:4 18 = 2000660e 00000000 0000f601 00000000 43f2
ffff8ca190c48b40 2027254332 S Ii:1:066:1 -115:4 64 <
ffff8ca190c48b40 2027266500 C Ii:1:066:1 0:4 18 = 2000670e 00000000 0000f601 00000000 1df2
ffff8ca190c48b40 2027266505 S Ii:1:066:1 -115:4 64 <
ffff8ca190c48b40 2027274330 C Ii:1:066:1 0:4 18 = 2000680e 00000000 0000cf01 00000000 6af2
ffff8ca190c48b40 2027274336 S Ii:1:066:1 -115:4 64 <
ffff8ca190c48b40 2027286330 C Ii:1:066:1 0:4 18 = 2000690e 00000000 00004302 00000000 91f2
ffff8ca190c48b40 2027286335 S Ii:1:066:1 -115:4 64 <
ffff8ca190c48b40 2027294331 C Ii:1:066:1 0:4 18 = 20006a0e 00000000 0000f601 00000000 43f2
ffff8ca190c48b40 2027294336 S Ii:1:066:1 -115:4 64 <
ffff8ca190c48b40 2027306332 C Ii:1:066:1 0:4 18 = 20006b0e 00000000 0000cf01 00000000 1df2
ffff8ca190c48b40 2027306336 S Ii:1:066:1 -115:4 64 <
ffff8ca190c48b40 2027314330 C Ii:1:066:1 0:4 18 = 20006c0e 00000000 0000a901 00000000 f6f1
ffff8ca190c48b40 2027314333 S Ii:1:066:1 -115:4 64 <
ffff8ca190c48b40 2027326332 C Ii:1:066:1 0:4 18 = 20006d0e 00000000 0000f601 00000000 43f2
ffff8ca190c48b40 2027326336 S Ii:1:066:1 -115:4 64 <
ffff8ca190c48b40 2027334331 C Ii:1:066:1 0:4 18 = 20006e0e 00000000 00001c02 00000000 6af2
ffff8ca190c48b40 2027334337 S Ii:1:066:1 -115:4 64 <
ffff8ca190c48b40 2027346332 C Ii:1:066:1 0:4 18 = 20006f0e 00000000 0000cf01 00000000 6af2
ffff8ca190c48b40 2027346336 S Ii:1:066:1 -115:4 64 <
ffff8ca190c48b40 2027354332 C Ii:1:066:1 0:4 18 = 2000700e 00000000 0000f601 00000000 1df2
ffff8ca190c48b40 2027354336 S Ii:1:066:1 -115:4 64 <
ffff8ca190c48b40 2027366334 C Ii:1:066:1 0:4 18 = 2000710e 00000000 0000f601 00000000 43f2
ffff8ca190c48b40 2027366338 S Ii:1:066:1 -115:4 64 <
ffff8ca190c48b40 2027374333 C Ii:1:066:1 0:4 18 = 2000720e 00000000 00001c02 00000000 43f2
ffff8ca190c48b40 2027374336 S Ii:1:066:1 -115:4 64 <
ffff8ca190c48b40 2027386333 C Ii:1:066:1 0:4 18 = 2000730e 00000000 0000cf01 00000000 f6f1
ffff8ca190c48b40 2027386337 S Ii:1:066:1 -115:4 64 <
ffff8ca190c48b40 2027394333 C Ii:1:066:1 0:4 18 = 2000740e 00000000 0000cf01 00000000 6af2
ffff8ca190c48b40 2027394337 S Ii:1:066:1 -115:4 64 <
ffff8ca190c48b40 2027406335 C Ii:1:066:1 0:4 18 = 2000750e 00000000 0000f601 00000000 43f2
ffff8ca190c48b40 2027406341 S Ii:1:066:1 -115:4 64 <
ffff8ca190c48b40 2027434335 C Ii:1:066:1 0:4 18 = 2000760e 00000000 0000f601 00000000 6af2
ffff8ca190c48b40 2027434341 S Ii:1:066:1 -115:4 64 <
ffff8ca190c48b40 2027446716 C Ii:1:066:1 0:4 18 = 2000770e 00000000 0000f601 00000000 43f2
ffff8ca190c48b40 2027446724 S Ii:1:066:1 -115:4 64 <
ffff8ca190c48b40 2027454336 C Ii:1:066:1 0:4 18 = 2000780e 00000000 0000f601 00000000 1df2
ffff8ca190c48b40 2027454343 S Ii:1:066:1 -115:4 64 <
ffff8ca190c48b40 2027466498 C Ii:1:066:1 0:4 18 = 2000790e 00000000 0000cf01 00000000 6af2
ffff8ca190c48b40 2027466504 S Ii:1:066:1 -115:4 64 <
ffff8ca190c48b40 2027474338 C Ii:1:066:1 0:4 18 = 20007a0e 00000000 00004302 00000000 6af2
ffff8ca190c48b40 2027474343 S Ii:1:066:1 -115:4 64 <
ffff8ca190c48b40 2027486337 C Ii:1:066:1 0:4 18 = 20007b0e 00000000 0000cf01 00000000 1df2
ffff8ca190c48b40 2027486342 S Ii:1:066:1 -115:4 64 <
ffff8ca190c48b40 2027494340 C Ii:1:066:1 0:4 18 = 20007c0e 00000000 0000f601 00000000 1df2
ffff8ca190c48b40 2027494345 S Ii:1:066:1 -115:4 64 <
ffff8ca190c48b40 2027506337 C Ii:1:066:1 0:4 18 = 20007d0e 00000000 0000a901 00000000 43f2
ffff8ca190c48b40 2027506341 S Ii:1:066:1 -115:4 64 <
ffff8ca190c48b40 2027514337 C Ii:1:066:1 0:4 18 = 20007e0e 00000000 0000f601 00000000 f6f1
ffff8ca190c48b40 2027514342 S Ii:1:066:1 -115:4 64 <
ffff8ca190c48b40 2027526337 C Ii:1:066:1 0:4 18 = 20007f0e 00000000 00001c02 00000000 1df2
ffff8ca190c48b40 2027526344 S Ii:1:066:1 -115:4 64 <
ffff8ca190c48b40 2027546338 C Ii:1:066:1 0:4 18 = 2000800e 00000000 00001c02 00000000 43f2
ffff8ca190c48b40 2027546343 S Ii:1:066:1 -115:4 64 <
ffff8ca190c48b40 2027554338 C Ii:1:066:1 0:4 18 = 2000810e 00000000 0000a901 00000000 1df2
ffff8ca190c48b40 2027554342 S Ii:1:066:1 -115:4 64 <
ffff8ca190c48b40 2027566378 C Ii:1:066:1 0:4 18 = 2000820e 00000000 0000f601 00000000 6af2
ffff8ca190c48b40 2027566382 S Ii:1:066:1 -115:4 64 <
ffff8ca190c48b40 2027574339 C Ii:1:066:1 0:4 18 = 2000830e 00000000 00001c02 00000000 1df2
ffff8ca190c48b40 2027574343 S Ii:1:066:1 -115:4 64 <
ffff8ca190c48b40 2027586340 C Ii:1:066:1 0:4 18 = 2000840e 00000000 0000cf01 00000000 43f2
ffff8ca190c48b40 2027586345 S Ii:1:066:1 -115:4 64 <
ffff8ca190c48b40 2027594341 C Ii:1:066:1 0:4 18 = 2000850e 00000000 0000f601 00000000 1df2
ffff8ca190c48b40 2027594346 S Ii:1:066:1 -115:4 64 <
ffff8ca190c48b40 2027606340 C Ii:1:066:1 0:4 18 = 2000860e 00000000 0000cf01 00000000 43f2
ffff8ca190c48b40 2027606344 S Ii:1:066:1 -115:4 64 <
ffff8ca190c48b40 2027614341 C Ii:1:066:1 0:4 18 = 2000870e 00000000 0000a901 00000000 f6f1
ffff8ca190c48b40 2027614345 S Ii:1:066:1 -115:4 64 <
ffff8ca190c48b40 2027626341 C Ii:1:066:1 0:4 18 = 2000880e 00000000 0000f601 00000000 f6f1
ffff8ca190c48b40 2027626346 S Ii:1:066:1 -115:4 64 <
ffff8ca190c48b40 2027634341 C Ii:1:066:1 0:4 18 = 2000890e 00000000 0000f601 00000000 43f2
ffff8ca190c48b40 2027634345 S Ii:1:066:1 -115:4 64 <
ffff8ca190c48b40 2027646341 C Ii:1:066:1 0:4 18 = 20008a0e 00000000 0000f601 00000000 6af2
ffff8ca190c48b40 2027646345 S Ii:1:066:1 -115:4 64 <
ffff8ca190c48b40 2027654342 C Ii:1:066:1 0:4 18 = 20008b0e 00000000 00008201 00000000 43f2
ffff8ca190c48b40 2027654346 S Ii:1:066:1 -115:4 64 <
ffff8ca190c48b40 2027666342 C Ii:1:066:1 0:4 18 = 20008c0e 00000000 0000cf01 00000000 1df2
ffff8ca190c48b40 2027666347 S Ii:1:066:1 -115:4 64 <
ffff8ca190c48b40 2027674342 C Ii:1:066:1 0:4 18 = 20008d0e 00000000 00001c02 00000000 1df2
ffff8ca190c48b40 2027674345 S Ii:1:066:1 -115:4 64 <
ffff8ca190c48b40 2027694344 C Ii:1:066:1 0:4 18 = 20008e0e 00000000 0000f601 00000000 6af2
ffff8ca190c48b40 2027694351 S Ii:1:066:1 -115:4 64 <
ffff8ca190c48b40 2027706344 C Ii:1:066:1 0:4 18 = 20008f0e 00000000 0000f601 00000000 1df2
ffff8ca190c48b40 2027706349 S Ii:1:066:1 -115:4 64 <
ffff8ca190c48b40 2027714344 C Ii:1:066:1 0:4 18 = 2000900e 00000000 0000f601 00000000 43f2
ffff8ca190c48b40 2027714348 S Ii:1:066:1 -115:4 64 <
ffff8ca190c48b40 2027726345 C Ii:1:066:1 0:4 18 = 2000910e 00000000 0000cf01 00000000 43f2
ffff8ca190c48b40 2027726353 S Ii:1:066:1 -115:4 64 <
ffff8ca190c48b40 2027734349 C Ii:1:066:1 0:4 18 = 2000920e 00000000 0000cf01 00000000 1df2
ffff8ca190c48b40 2027734354 S Ii:1:066:1 -115:4 64 <
ffff8ca190c48b40 2027746345 C Ii:1:066:1 0:4 18 = 2000930e 00000000 0000f601 00000000 1df2
ffff8ca190c48b40 2027746349 S Ii:1:066:1 -115:4 64 <
ffff8ca190c48b40 2027754345 C Ii:1:066:1 0:4 18 = 2000940e 00000000 0000cf01 00000000 f6f1
ffff8ca190c48b40 2027754351 S Ii:1:066:1 -115:4 64 <
ffff8ca190c48b40 2027766346 C Ii:1:066:1 0:4 18 = 2000950e 00000000 0000f601 00000000 1df2
ffff8ca190c48b40 2027766350 S Ii:1:066:1 -115:4 64 <
ffff8ca190c48b40 2027774345 C Ii:1:066:1 0:4 18 = 2000960e 00000000 0000cf01 00000000 43f2
ffff8ca190c48b40 2027774350 S Ii:1:066:1 -115:4 64 <
ffff8ca190c48b40 2027786349 C Ii:1:066:1 0:4 18 = 2000970e 00000000 0000f601 00000000 91f2
ffff8ca190c48b40 2027786356 S Ii:1:066:1 -115:4 64 <
ffff8ca190c48b40 2027794348 C Ii:1:066:1 0:4 18 = 2000980e 00000000 0000a901 00000000 f6f1
ffff8ca190c48b40 2027794353 S Ii:1:066:1 -115:4 64 <
ffff8ca190c48b40 2027806349 C Ii:1:066:1 0:4 18 = 2000990e 00000000 00001c02 00000000 43f2
ffff8ca190c48b40 2027806355 S Ii:1:066:1 -115:4 64 <
ffff8ca190c48b40 2027826351 C Ii:1:066:1 0:4 18 = 20009a0e 00000000 0000f601 00000000 1df2
ffff8ca190c48b40 2027826358 S Ii:1:066:1 -115:4 64 <
ffff8ca190c48b40 2027834348 C Ii:1:066:1 0:4 18 = 20009b0e 00000000 0000cf01 00000000 1df2
ffff8ca190c48b40 2027834355 S Ii:1:066:1 -115:4 64 <
ffff8ca190c48b40 2027846351 C Ii:1:066:1 0:4 18 = 20009c0e 00000000 0000f601 00000000 6af2
ffff8ca190c48b40 2027846356 S Ii:1:066:1 -115:4 64 <
ffff8ca190c48b40 2027854350 C Ii:1:066:1 0:4 18 = 20009d0e 00000000 0000cf01 00000000 1df2
ffff8ca190c48b40 2027854356 S Ii:1:066:1 -115:4 64 <
ffff8ca190c48b40 2027866730 C Ii:1:066:1 0:4 18 = 20009e0e 00000000 0000f601 00000000 43f2
ffff8ca190c48b40 2027866737 S Ii:1:066:1 -115:4 64 <
ffff8ca190c48b40 2027874349 C Ii:1:066:1 0:4 18 = 20009f0e 00000000 00001c02 00000000 1df2
ffff8ca190c48b40 2027874354 S Ii:1:066:1 -115:4 64 <
ffff8ca190c48b40 2027886350 C Ii:1:066:1 0:4 18 = 2000a00e 00000000 00001c02 00000000 6af2
ffff8ca190c48b40 2027886356 S Ii:1:066:1 -115:4 64 <
ffff8ca190c48b40 2027894351 C Ii:1:066:1 0:4 18 = 2000a10e 00000000 00001c02 00000000 43f2
ffff8ca190c48b40 2027894356 S Ii:1:066:1 -115:4 64 <
ffff8ca190c48b40 2027906351 C Ii:1:066:1 0:4 18 = 2000a20e 00000000 00001c02 00000000 6af2
ffff8ca190c48b40 2027906356 S Ii:1:066:1 -115:4 64 <
ffff8ca190c48b40 2027914350 C Ii:1:066:1 0:4 18 = 2000a30e 00000000 00001c02 00000000 1df2
ffff8ca190c48b40 2027914355 S Ii:1:066:1 -115:4 64 <
ffff8ca190c48b40 2027926351 C Ii:1:066:1 0:4 18 = 2000a40e 00000000 0000f601 00000000 f6f1
ffff8ca190c48b40 2027926359 S Ii:1:066:1 -115:4 64 <
ffff8ca190c48b40 2027934351 C Ii:1:066:1 0:4 18 = 2000a50e 00000000 0000cf01 00000000 1df2
ffff8ca190c48b40 2027934357 S Ii:1:066:1 -115:4 64 <
ffff8ca190c48b40 2027946352 C Ii:1:066:1 0:4 18 = 2000a60e 00000000 00001c02 00000000 43f2
ffff8ca190c48b40 2027946358 S Ii:1:066:1 -115:4 64 <
ffff8ca190c48b40 2027954352 C Ii:1:066:1 0:4 18 = 2000a70e 00000000 0000a901 00000000 91f2
ffff8ca190c48b40 2027954359 S Ii:1:066:1 -115:4 64 <
ffff8ca190c48b40 2027966547 C Ii:1:066:1 0:4 18 = 2000a80e 00000000 0000f601 00000000 1df2
ffff8ca190c48b40 2027966552 S Ii:1:066:1 -115:4 64 <
ffff8ca190c48b40 2027974354 C Ii:1:066:1 0:4 18 = 2000a90e 00000000 0000f601 00000000 6af2
ffff8ca190c48b40 2027974359 S Ii:1:066:1 -115:4 64 <
ffff8ca190c48b40 2027986356 C Ii:1:066:1 0:4 18 = 2000aa0e 00000000 0000cf01 00000000 1df2
ffff8ca190c48b40 2027986363 S Ii:1:066:1 -115:4 64 <
ffff8ca190c48b40 2027994355 C Ii:1:066:1 0:4 18 = 2000ab0e 00000000 0000a901 00000000 1df2
ffff8ca190c48b40 2027994365 S Ii:1:066:1 -115:4 64 <
ffff8ca190c48b40 2028006359 C Ii:1:066:1 0:4 18 = 2000ac0e 00000000 0000f601 00000000 6af2
ffff8ca190c48b40 2028006373 S Ii:1:066:1 -115:4 64 <
ffff8ca190c48b40 2028014601 C Ii:1:066:1 0:4 18 = 2000ad0e 00000000 00001c02 00000000 43f2
ffff8ca190c48b40 2028014609 S Ii:1:066:1 -115:4 64 <
ffff8ca190c48b40 2028026355 C Ii:1:066:1 0:4 18 = 2000ae0e 00000000 0000cf01 00000000 f6f1
ffff8ca190c48b40 2028026363 S Ii:1:066:1 -115:4 64 <
ffff8ca190c48b40 2028034358 C Ii:1:066:1 0:4 18 = 2000af0e 00000000 0000cf01 00000000 6af2
ffff8ca190c48b40 2028034364 S Ii:1:066:1 -115:4 64 <
ffff8ca190c48b40 2028046356 C Ii:1:066:1 0:4 18 = 2000b00e 00000000 0000cf01 00000000 43f2
ffff8ca190c48b40 2028046363 S Ii:1:066:1 -115:4 64 <
ffff8ca190c48b40 2028054356 C Ii:1:066:1 0:4 18 = 2000b10e 00000000 0000f601 00000000 1df2
ffff8ca190c48b40 2028054362 S Ii:1:066:1 -115:4 64 <
ffff8ca190c48b40 2028066356 C Ii:1:066:1 0:4 18 = 2000b20e 00000000 0000f601 00000000 43f2
ffff8ca190c48b40 2028066361 S Ii:1:066:1 -115:4 64 <
ffff8ca190c48b40 2028074357 C Ii:1:066:1 0:4 18 = 2000b30e 00000000 0000cf01 00000000 43f2
ffff8ca190c48b40 2028074363 S Ii:1:066:1 -115:4 64 <
ffff8ca190c48b40 2028086359 C Ii:1:066:1 0:4 18 = 2000b40e 00000000 0000f601 00000000 f6f1
ffff8ca190c48b40 2028086370 S Ii:1:066:1 -115:4 64 <
ffff8ca190c48b40 2028094357 C Ii:1:066:1 0:4 18 = 2000b50e 00000000 0000f601 00000000 43f2
ffff8ca190c48b40 2028094363 S Ii:1:066:1 -115:4 64 <
ffff8ca190c48b40 2028114356 C Ii:1:066:1 0:4 18 = 2000b60e 00000000 0000f601 00000000 1df2
ffff8ca190c48b40 2028114362 S Ii:1:066:1 -115:4 64 <
ffff8ca190c48b40 2028126357 C Ii:1:066:1 0:4 18 = 2000b70e 00000000 00001c02 00000000 43f2
ffff8ca190c48b40 2028126362 S Ii:1:066:1 -115:4 64 <
ffff8ca190c48b40 2028134357 C Ii:1:066:1 0:4 18 = 2000b80e 00000000 0000f601 00000000 1df2
ffff8ca190c48b40 2028134362 S Ii:1:066:1 -115:4 64 <
ffff8ca190c48b40 2028146359 C Ii:1:066:1 0:4 18 = 2000b90e 00000000 0000f601 00000000 6af2
ffff8ca190c48b40 2028146363 S Ii:1:066:1 -115:4 64 <
ffff8ca190c48b40 2028154358 C Ii:1:066:1 0:4 18 = 2000ba0e 00000000 0000cf01 00000000 43f2
ffff8ca190c48b40 2028154362 S Ii:1:066:1 -115:4 64 <
ffff8ca190c48b40 2028174358 C Ii:1:066:1 0:4 18 = 2000bb0e 00000000 0000f601 00000000 f6f1
ffff8ca190c48b40 2028174363 S Ii:1:066:1 -115:4 64 <
ffff8ca190c48b40 2028186358 C Ii:1:066:1 0:4 18 = 2000bc0e 00000000 00001c02 00000000 91f2
ffff8ca190c48b40 2028186364 S Ii:1:066:1 -115:4 64 <
ffff8ca190c48b40 2028194360 C Ii:1:066:1 0:4 18 = 2000bd0e 00000000 0000f601 00000000 43f2
ffff8ca190c48b40 2028194364 S Ii:1:066:1 -115:4 64 <
ffff8ca190c48b40 2028206359 C Ii:1:066:1 0:4 18 = 2000be0e 00000000 0000f601 00000000 1df2
ffff8ca190c48b40 2028206363 S Ii:1:066:1 -115:4 64 <
ffff8ca190c48b40 2028226360 C Ii:1:066:1 0:4 18 = 2000bf0e 00000000 0000cf01 00000000 f6f1
ffff8ca190c48b40 2028226364 S Ii:1:066:1 -115:4 64 <
ffff8ca190c48b40 2028234360 C Ii:1:066:1 0:4 18 = 2000c00e 00000000 0000cf01 00000000 1df2
ffff8ca190c48b40 2028234364 S Ii:1:066:1 -115:4 64 <
ffff8ca190c48b40 2028246361 C Ii:1:066:1 0:4 18 = 2000c10e 00000000 0000f601 00000000 43f2
ffff8ca190c48b40 2028246365 S Ii:1:066:1 -115:4 64 <
ffff8ca190c48b40 2028254361 C Ii:1:066:1 0:4 18 = 2000c20e 00000000 0000f601 00000000 1df2
ffff8ca190c48b40 2028254364 S Ii:1:066:1 -115:4 64 <
ffff8ca190c48b40 2028266385 C Ii:1:066:1 0:4 18 = 2000c30e 00000000 0000f601 00000000 43f2
ffff8ca190c48b40 2028266388 S Ii:1:066:1 -115:4 64 <
ffff8ca190c48b40 2028274361 C Ii:1:066:1 0:4 18 = 2000c40e 00000000 0000f601 00000000 1df2
ffff8ca190c48b40 2028274364 S Ii:1:066:1 -115:4 64 <
ffff8ca190c48b40 2028306365 C Ii:1:066:1 0:4 18 = 2000c50e 00000000 0000f601 00000000 43f2
ffff8ca190c48b40 2028306372 S Ii:1:066:1 -115:4 64 <
ffff8ca190c48b40 2028314363 C Ii:1:066:1 0:4 18 = 2000c60e 00000000 00001c02 00000000 43f2
ffff8ca190c48b40 2028314367 S Ii:1:066:1 -115:4 64 <
ffff8ca190c48b40 2028326363 C Ii:1:066:1 0:4 18 = 2000c70e 00000000 0000f601 00000000 6af2
ffff8ca190c48b40 2028326368 S Ii:1:066:1 -115:4 64 <
ffff8ca190c48b40 2028334366 C Ii:1:066:1 0:4 18 = 2000c80e 00000000 0000f601 00000000 1df2
ffff8ca190c48b40 2028334370 S Ii:1:066:1 -115:4 64 <
ffff8ca190c48b40 2028346366 C Ii:1:066:1 0:4 18 = 2000c90e 00000000 00004302 00000000 1df2
ffff8ca190c48b40 2028346370 S Ii:1:066:1 -115:4 64 <
ffff8ca190c48b40 2028354364 C Ii:1:066:1 0:4 18 = 2000ca0e 00000000 0000cf01 00000000 43f2
ffff8ca190c48b40 2028354370 S Ii:1:066:1 -115:4 64 <
ffff8ca190c48b40 2028366397 C Ii:1:066:1 0:4 18 = 2000cb0e 00000000 0000cf01 00000000 1df2
ffff8ca190c48b40 2028366402 S Ii:1:066:1 -115:4 64 <
ffff8ca190c48b40 2028374368 C Ii:1:066:1 0:4 18 = 2000cc0e 00000000 0000cf01 00000000 43f2
ffff8ca190c48b40 2028374372 S Ii:1:066:1 -115:4 64 <
ffff8ca190c48b40 2028386369 C Ii:1:066:1 0:4 18 = 2000cd0e 00000000 0000f601 00000000 43f2
ffff8ca190c48b40 2028386375 S Ii:1:066:1 -115:4 64 <
ffff8ca190c48b40 2028394366 C Ii:1:066:1 0:4 18 = 2000ce0e 00000000 0000cf01 00000000 43f2
ffff8ca190c48b40 2028394370 S Ii:1:066:1 -115:4 64 <
ffff8ca190c48b40 2028406366 C Ii:1:066:1 0:4 18 = 2000cf0e 00000000 0000f601 00000000 91f2
ffff8ca190c48b40 2028406372 S Ii:1:066:1 -115:4 64 <
ffff8ca190c48b40 2028414367 C Ii:1:066:1 0:4 18 = 2000d00e 00000000 0000cf01 00000000 6af2
ffff8ca190c48b40 2028414371 S Ii:1:066:1 -115:4 64 <
ffff8ca190c48b40 2028426367 C Ii:1:066:1 0:4 18 = 2000d10e 00000000 0000a901 00000000 6af2
ffff8ca190c48b40 2028426373 S Ii:1:066:1 -115:4 64 <
ffff8ca190c48b40 2028434366 C Ii:1:066:1 0:4 18 = 2000d20e 00000000 0000f601 00000000 6af2
ffff8ca190c48b40 2028434370 S Ii:1:066:1 -115:4 64 <
ffff8ca190c48b40 2028446367 C Ii:1:066:1 0:4 18 = 2000d30e 00000000 00001c02 00000000 43f2
ffff8ca190c48b40 2028446371 S Ii:1:066:1 -115:4 64 <
ffff8ca190c48b40 2028454366 C Ii:1:066:1 0:4 18 = 2000d40e 00000000 0000cf01 00000000 1df2
ffff8ca190c48b40 2028454370 S Ii:1:066:1 -115:4 64 <
ffff8ca190c48b40 2028466422 C Ii:1:066:1 0:4 18 = 2000d50e 00000000 0000f601 00000000 43f2
ffff8ca190c48b40 2028466428 S Ii:1:066:1 -115:4 64 <
ffff8ca190c48b40 2028474368 C Ii:1:066:1 0:4 18 = 2000d60e 00000000 0000cf01 00000000 1df2
ffff8ca190c48b40 2028474373 S Ii:1:066:1 -115:4 64 <
ffff8ca190c48b40 2028486370 C Ii:1:066:1 0:4 18 = 2000d70e 00000000 0000f601 00000000 43f2
ffff8ca190c48b40 2028486376 S Ii:1:066:1 -115:4 64 <
ffff8ca190c48b40 2028494370 C Ii:1:066:1 0:4 18 = 2000d80e 00000000 0000a901 00000000 6af2
ffff8ca190c48b40 2028494376 S Ii:1:066:1 -115:4 64 <
ffff8ca190c48b40 2028506370 C Ii:1:066:1 0:4 18 = 2000d90e 00000000 0000f601 00000000 6af2
ffff8ca190c48b40 2028506374 S Ii:1:066:1 -115:4 64 <
ffff8ca190c48b40 2028514369 C Ii:1:066:1 0:4 18 = 2000da0e 00000000 0000f601 00000000 43f2
ffff8ca190c48b40 2028514372 S Ii:1:066:1 -115:4 64 <
ffff8ca190c48b40 2028526370 C Ii:1:066:1 0:4 18 = 2000db0e 00000000 0000cf01 00000000 91f2
ffff8ca190c48b40 2028526375 S Ii:1:066:1 -115:4 64 <
ffff8ca190c48b40 2028534387 C Ii:1:066:1 0:4 18 = 2000dc0e 00000000 00001c02 00000000 43f2
ffff8ca190c48b40 2028534391 S Ii:1:066:1 -115:4 64 <
ffff8ca190c48b40 2028546370 C Ii:1:066:1 0:4 18 = 2000dd0e 00000000 0000f601 00000000 43f2
ffff8ca190c48b40 2028546373 S Ii:1:066:1 -115:4 64 <
ffff8ca190c48b40 2028554370 C Ii:1:066:1 0:4 18 = 2000de0e 00000000 0000cf01 00000000 6af2
ffff8ca190c48b40 2028554374 S Ii:1:066:1 -115:4 64 <
ffff8ca190c48b40 2028566376 C Ii:1:066:1 0:4 18 = 2000df0e 00000000 0000f601 00000000 6af2
ffff8ca190c48b40 2028566380 S Ii:1:066:1 -115:4 64 <
ffff8ca190c48b40 2028574372 C Ii:1:066:1 0:4 18 = 2000e00e 00000000 0000cf01 00000000 6af2
ffff8ca190c48b40 2028574378 S Ii:1:066:1 -115:4 64 <
ffff8ca190c48b40 2028586375 C Ii:1:066:1 0:4 18 = 2000e10e 00000000 0000cf01 00000000 1df2
ffff8ca190c48b40 2028586379 S Ii:1:066:1 -115:4 64 <
ffff8ca18bf35d80 2028590083 C Ii:1:001:1 0:2048 2 = 0800
ffff8ca18bf35d80 2028590090 S Ii:1:001:1 -115:2048 4 <
ffff8ca19382db40 2028590099 S Ci:1:001:0 s a3 00 0000 0003 0004 4 <
ffff8ca19382db40 2028590109 C Ci:1:001:0 0 4 = 01010100
ffff8ca19382db40 2028590113 S Co:1:001:0 s 23 01 0010 0003 0000 0
ffff8ca19382db40 2028590119 C Co:1:001:0 0 0
ffff8ca19382db40 2028590124 S Ci:1:001:0 s a3 00 0000 0003 0004 4 <
ffff8ca19382db40 2028590128 C Ci:1:001:0 0 4 = 01010000
ffff8ca190c48b40 2028606373 C Ii:1:066:1 0:4 18 = 2000e20e 00000000 0000f601 00000000 f6f1
ffff8ca190c48b40 2028606378 S Ii:1:066:1 -115:4 64 <
ffff8ca190c48b40 2028614372 C Ii:1:066:1 0:4 18 = 2000e30e 00000000 0000f601 00000000 43f2
ffff8ca190c48b40 2028614376 S Ii:1:066:1 -115:4 64 <
ffff8ca19382db40 2028616007 S Ci:1:001:0 s a3 00 0000 0003 0004 4 <
ffff8ca19382db40 2028616015 C Ci:1:001:0 0 4 = 01010000
ffff8ca190c48b40 2028626373 C Ii:1:066:1 0:4 18 = 2000e40e 00000000 00001c02 00000000 f6f1
ffff8ca190c48b40 2028626378 S Ii:1:066:1 -115:4 64 <
ffff8ca190c48b40 2028634373 C Ii:1:066:1 0:4 18 = 2000e50e 00000000 00004302 00000000 43f2
ffff8ca190c48b40 2028634378 S Ii:1:066:1 -115:4 64 <
ffff8ca19382db40 2028642009 S Ci:1:001:0 s a3 00 0000 0003 0004 4 <
ffff8ca19382db40 2028642017 C Ci:1:001:0 0 4 = 01010000
ffff8ca190c48b40 2028646374 C Ii:1:066:1 0:4 18 = 2000e60e 00000000 00001c02 00000000 43f2
ffff8ca190c48b40 2028646378 S Ii:1:066:1 -115:4 64 <
ffff8ca190c48b40 2028654375 C Ii:1:066:1 0:4 18 = 2000e70e 00000000 0000f601 00000000 1df2
ffff8ca190c48b40 2028654379 S Ii:1:066:1 -115:4 64 <
ffff8ca190c48b40 2028666398 C Ii:1:066:1 0:4 18 = 2000e80e 00000000 0000cf01 00000000 43f2
ffff8ca190c48b40 2028666401 S Ii:1:066:1 -115:4 64 <
ffff8ca19382db40 2028668011 S Ci:1:001:0 s a3 00 0000 0003 0004 4 <
ffff8ca19382db40 2028668018 C Ci:1:001:0 0 4 = 01010000
ffff8ca190c48b40 2028674375 C Ii:1:066:1 0:4 18 = 2000e90e 00000000 0000cf01 00000000 f6f1
ffff8ca190c48b40 2028674379 S Ii:1:066:1 -115:4 64 <
ffff8ca190c48b40 2028686376 C Ii:1:066:1 0:4 18 = 2000ea0e 00000000 0000f601 00000000 6af2
ffff8ca190c48b40 2028686382 S Ii:1:066:1 -115:4 64 <
ffff8ca19382db40 2028694012 S Ci:1:001:0 s a3 00 0000 0003 0004 4 <
ffff8ca19382db40 2028694021 C Ci:1:001:0 0 4 = 01010000
ffff8ca19382db40 2028694206 S Co:1:001:0 s 23 03 0004 0003 0000 0
ffff8ca19382db40 2028694223 C Co:1:001:0 0 0
ffff8ca190c48b40 2028694375 C Ii:1:066:1 0:4 18 = 2000eb0e 00000000 0000f601 00000000 43f2
ffff8ca190c48b40 2028694380 S Ii:1:066:1 -115:4 64 <
ffff8ca190c48b40 2028706376 C Ii:1:066:1 0:4 18 = 2000ec0e 00000000 0000f601 00000000 cff1
ffff8ca190c48b40 2028706380 S Ii:1:066:1 -115:4 64 <
ffff8ca190c48b40 2028714376 C Ii:1:066:1 0:4 18 = 2000ed0e 00000000 00001c02 00000000 6af2
ffff8ca190c48b40 2028714379 S Ii:1:066:1 -115:4 64 <
ffff8ca190c48b40 2028726379 C Ii:1:066:1 0:4 18 = 2000ee0e 00000000 0000cf01 00000000 f6f1
ffff8ca190c48b40 2028726383 S Ii:1:066:1 -115:4 64 <
ffff8ca190c48b40 2028734376 C Ii:1:066:1 0:4 18 = 2000ef0e 00000000 0000cf01 00000000 43f2
ffff8ca190c48b40 2028734380 S Ii:1:066:1 -115:4 64 <
ffff8ca190c48b40 2028746378 C Ii:1:066:1 0:4 18 = 2000f00e 00000000 0000cf01 00000000 1df2
ffff8ca190c48b40 2028746381 S Ii:1:066:1 -115:4 64 <
ffff8ca190c48b40 2028754377 C Ii:1:066:1 0:4 18 = 2000f10e 00000000 0000cf01 00000000 6af2
ffff8ca190c48b40 2028754381 S Ii:1:066:1 -115:4 64 <
ffff8ca19382db40 2028755009 S Ci:1:001:0 s a3 00 0000 0003 0004 4 <
ffff8ca19382db40 2028755019 C Ci:1:001:0 0 4 = 11010000
ffff8ca190c48b40 2028766446 C Ii:1:066:1 0:4 18 = 2000f20e 00000000 0000a901 00000000 6af2
ffff8ca190c48b40 2028766450 S Ii:1:066:1 -115:4 64 <
ffff8ca190c48b40 2028774377 C Ii:1:066:1 0:4 18 = 2000f30e 00000000 0000cf01 00000000 1df2
ffff8ca190c48b40 2028774382 S Ii:1:066:1 -115:4 64 <
ffff8ca190c48b40 2028786379 C Ii:1:066:1 0:4 18 = 2000f40e 00000000 0000f601 00000000 43f2
ffff8ca190c48b40 2028786384 S Ii:1:066:1 -115:4 64 <
ffff8ca190c48b40 2028794378 C Ii:1:066:1 0:4 18 = 2000f50e 00000000 00004302 00000000 43f2
ffff8ca190c48b40 2028794382 S Ii:1:066:1 -115:4 64 <
ffff8ca190c48b40 2028806380 C Ii:1:066:1 0:4 18 = 2000f60e 00000000 0000cf01 00000000 f6f1
ffff8ca190c48b40 2028806385 S Ii:1:066:1 -115:4 64 <
ffff8ca19382db40 2028816008 S Ci:1:001:0 s a3 00 0000 0003 0004 4 <
ffff8ca19382db40 2028816019 C Ci:1:001:0 0 4 = 03011000
ffff8ca19382db40 2028816024 S Co:1:001:0 s 23 01 0014 0003 0000 0
ffff8ca19382db40 2028816030 C Co:1:001:0 0 0
ffff8ca190c48b40 2028826380 C Ii:1:066:1 0:4 18 = 2000f70e 00000000 00001c02 00000000 43f2
ffff8ca190c48b40 2028826387 S Ii:1:066:1 -115:4 64 <
ffff8ca190c48b40 2028846380 C Ii:1:066:1 0:4 18 = 2000f80e 00000000 0000f601 00000000 43f2
ffff8ca190c48b40 2028846385 S Ii:1:066:1 -115:4 64 <
ffff8ca190c48b40 2028854381 C Ii:1:066:1 0:4 18 = 2000f90e 00000000 0000a901 00000000 1df2
ffff8ca190c48b40 2028854385 S Ii:1:066:1 -115:4 64 <
ffff8ca190c48b40 2028866498 C Ii:1:066:1 0:4 18 = 2000fa0e 00000000 0000f601 00000000 6af2
ffff8ca190c48b40 2028866508 S Ii:1:066:1 -115:4 64 <
ffff8ca190c48b40 2028874381 C Ii:1:066:1 0:4 18 = 2000fb0e 00000000 00001c02 00000000 1df2
ffff8ca190c48b40 2028874386 S Ii:1:066:1 -115:4 64 <
ffff8ca190c48b40 2028886382 C Ii:1:066:1 0:4 18 = 2000fc0e 00000000 0000f601 00000000 43f2
ffff8ca190c48b40 2028886390 S Ii:1:066:1 -115:4 64 <
ffff8ca19382db40 2028894158 S Ci:1:000:0 s 80 06 0100 0000 0040 64 <
ffff8ca19382db40 2028896507 C Ci:1:000:0 0 18 = 12010002 00000040 6f0e4102 00010102 0301
ffff8ca19382db40 2028896512 S Co:1:001:0 s 23 03 0004 0003 0000 0
ffff8ca19382db40 2028896522 C Co:1:001:0 0 0
ffff8ca190c48b40 2028906384 C Ii:1:066:1 0:4 18 = 2000fd0e 00000000 0000f601 00000000 6af2
ffff8ca190c48b40 2028906387 S Ii:1:066:1 -115:4 64 <
ffff8ca190c48b40 2028914382 C Ii:1:066:1 0:4 18 = 2000fe0e 00000000 0000cf01 00000000 6af2
ffff8ca190c48b40 2028914386 S Ii:1:066:1 -115:4 64 <
ffff8ca190c48b40 2028926383 C Ii:1:066:1 0:4 18 = 2000ff0e 00000000 0000cf01 00000000 43f2
ffff8ca190c48b40 2028926387 S Ii:1:066:1 -115:4 64 <
ffff8ca190c48b40 2028946384 C Ii:1:066:1 0:4 18 = 2000010e 00000000 00001c02 00000000 43f2
ffff8ca190c48b40 2028946389 S Ii:1:066:1 -115:4 64 <
ffff8ca190c48b40 2028954384 C Ii:1:066:1 0:4 18 = 2000020e 00000000 0000f601 00000000 43f2
ffff8ca190c48b40 2028954390 S Ii:1:066:1 -115:4 64 <
ffff8ca19382db40 2028957012 S Ci:1:001:0 s a3 00 0000 0003 0004 4 <
ffff8ca19382db40 2028957022 C Ci:1:001:0 0 4 = 11010000
ffff8ca190c48b40 2028966404 C Ii:1:066:1 0:4 18 = 2000030e 00000000 0000cf01 00000000 1df2
ffff8ca190c48b40 2028966408 S Ii:1:066:1 -115:4 64 <
ffff8ca190c48b40 2028974384 C Ii:1:066:1 0:4 18 = 2000040e 00000000 0000f601 00000000 91f2
ffff8ca190c48b40 2028974390 S Ii:1:066:1 -115:4 64 <
ffff8ca190c48b40 2028986385 C Ii:1:066:1 0:4 18 = 2000050e 00000000 0000f601 00000000 f6f1
ffff8ca190c48b40 2028986390 S Ii:1:066:1 -115:4 64 <
ffff8ca190c48b40 2028994385 C Ii:1:066:1 0:4 18 = 2000060e 00000000 0000cf01 00000000 f6f1
ffff8ca190c48b40 2028994392 S Ii:1:066:1 -115:4 64 <
ffff8ca190c48b40 2029006386 C Ii:1:066:1 0:4 18 = 2000070e 00000000 0000f601 00000000 1df2
ffff8ca190c48b40 2029006391 S Ii:1:066:1 -115:4 64 <
ffff8ca190c48b40 2029014385 C Ii:1:066:1 0:4 18 = 2000080e 00000000 0000cf01 00000000 1df2
ffff8ca190c48b40 2029014389 S Ii:1:066:1 -115:4 64 <
ffff8ca19382db40 2029018012 S Ci:1:001:0 s a3 00 0000 0003 0004 4 <
ffff8ca19382db40 2029018023 C Ci:1:001:0 0 4 = 03011000
ffff8ca19382db40 2029018028 S Co:1:001:0 s 23 01 0014 0003 0000 0
ffff8ca19382db40 2029018033 C Co:1:001:0 0 0
ffff8ca190c48b40 2029026386 C Ii:1:066:1 0:4 18 = 2000090e 00000000 0000f601 00000000 1df2
ffff8ca190c48b40 2029026391 S Ii:1:066:1 -115:4 64 <
ffff8ca190c48b40 2029034387 C Ii:1:066:1 0:4 18 = 20000a0e 00000000 0000f601 00000000 43f2
ffff8ca190c48b40 2029034390 S Ii:1:066:1 -115:4 64 <
ffff8ca190c48b40 2029046386 C Ii:1:066:1 0:4 18 = 20000b0e 00000000 0000cf01 00000000 6af2
ffff8ca190c48b40 2029046390 S Ii:1:066:1 -115:4 64 <
ffff8ca190c48b40 2029054387 C Ii:1:066:1 0:4 18 = 20000c0e 00000000 0000cf01 00000000 f6f1
ffff8ca190c48b40 2029054391 S Ii:1:066:1 -115:4 64 <
ffff8ca190c48b40 2029066389 C Ii:1:066:1 0:4 18 = 20000d0e 00000000 0000cf01 00000000 43f2
ffff8ca190c48b40 2029066394 S Ii:1:066:1 -115:4 64 <
ffff8ca190c48b40 2029074387 C Ii:1:066:1 0:4 18 = 20000e0e 00000000 0000f601 00000000 6af2
ffff8ca190c48b40 2029074391 S Ii:1:066:1 -115:4 64 <
ffff8ca190c48b40 2029086387 C Ii:1:066:1 0:4 18 = 20000f0e 00000000 0000cf01 00000000 43f2
ffff8ca190c48b40 2029086391 S Ii:1:066:1 -115:4 64 <
ffff8ca190c48b40 2029094388 C Ii:1:066:1 0:4 18 = 2000100e 00000000 0000a901 00000000 6af2
ffff8ca190c48b40 2029094393 S Ii:1:066:1 -115:4 64 <
ffff8ca190c48b40 2029106388 C Ii:1:066:1 0:4 18 = 2000110e 00000000 00004302 00000000 1df2
ffff8ca190c48b40 2029106392 S Ii:1:066:1 -115:4 64 <
ffff8ca19382db40 2029107008 S Ci:1:101:0 s 80 06 0100 0000 0012 18 <
ffff8ca190c48b40 2029114388 C Ii:1:066:1 0:4 18 = 2000120e 00000000 0000f601 00000000 6af2
ffff8ca190c48b40 2029114393 S Ii:1:066:1 -115:4 64 <
ffff8ca190c48b40 2029126391 C Ii:1:066:1 0:4 18 = 2000130e 00000000 0000cf01 00000000 1df2
ffff8ca190c48b40 2029126396 S Ii:1:066:1 -115:4 64 <
ffff8ca190c48b40 2029134389 C Ii:1:066:1 0:4 18 = 2000140e 00000000 0000f601 00000000 43f2
ffff8ca190c48b40 2029134393 S Ii:1:066:1 -115:4 64 <
ffff8ca19382db40 2029135515 C Ci:1:101:0 0 18 = 12010002 00000040 6f0e4102 00010102 0301
ffff8ca19382db40 2029135522 S Ci:1:101:0 s 80 06 0600 0000 000a 10 <
ffff8ca19382db40 2029137768 C Ci:1:101:0 -32 0
ffff8ca19382db40 2029137772 S Ci:1:101:0 s 80 06 0600 0000 000a 10 <
ffff8ca190c48b40 2029146389 C Ii:1:066:1 0:4 18 = 2000150e 00000000 0000cf01 00000000 43f2
ffff8ca190c48b40 2029146392 S Ii:1:066:1 -115:4 64 <
ffff8ca190c48b40 2029154389 C Ii:1:066:1 0:4 18 = 2000160e 00000000 0000cf01 00000000 1df2
ffff8ca190c48b40 2029154393 S Ii:1:066:1 -115:4 64 <
ffff8ca19382db40 2029164934 C Ci:1:101:0 -32 0
ffff8ca19382db40 2029164944 S Ci:1:101:0 s 80 06 0600 0000 000a 10 <
ffff8ca190c48b40 2029166390 C Ii:1:066:1 0:4 18 = 2000170e 00000000 0000cf01 00000000 cff1
ffff8ca190c48b40 2029166393 S Ii:1:066:1 -115:4 64 <
ffff8ca190c48b40 2029174390 C Ii:1:066:1 0:4 18 = 2000180e 00000000 0000cf01 00000000 1df2
ffff8ca190c48b40 2029174394 S Ii:1:066:1 -115:4 64 <
ffff8ca190c48b40 2029186392 C Ii:1:066:1 0:4 18 = 2000190e 00000000 0000cf01 00000000 43f2
ffff8ca190c48b40 2029186395 S Ii:1:066:1 -115:4 64 <
ffff8ca19382db40 2029191772 C Ci:1:101:0 -32 0
ffff8ca19382db40 2029191781 S Ci:1:101:0 s 80 06 0200 0000 0009 9 <
ffff8ca190c48b40 2029194391 C Ii:1:066:1 0:4 18 = 20001a0e 00000000 0000f601 00000000 1df2
ffff8ca190c48b40 2029194395 S Ii:1:066:1 -115:4 64 <
ffff8ca190c48b40 2029206391 C Ii:1:066:1 0:4 18 = 20001b0e 00000000 00001c02 00000000 1df2
ffff8ca190c48b40 2029206395 S Ii:1:066:1 -115:4 64 <
ffff8ca190c48b40 2029214392 C Ii:1:066:1 0:4 18 = 20001c0e 00000000 0000cf01 00000000 6af2
ffff8ca190c48b40 2029214398 S Ii:1:066:1 -115:4 64 <
ffff8ca19382db40 2029220560 C Ci:1:101:0 0 9 = 09022900 01010080 fa
ffff8ca19382db40 2029220573 S Ci:1:101:0 s 80 06 0200 0000 0029 41 <
ffff8ca19382db40 2029223517 C Ci:1:101:0 0 41 = 09022900 01010080 fa090400 00020300 00000921 00010001 221d0007 05810320
ffff8ca19382db40 2029223527 S Ci:1:101:0 s 80 06 0300 0000 00ff 255 <
ffff8ca190c48b40 2029226392 C Ii:1:066:1 0:4 18 = 20001d0e 00000000 0000cf01 00000000 1df2
ffff8ca190c48b40 2029226397 S Ii:1:066:1 -115:4 64 <
ffff8ca19382db40 2029226516 C Ci:1:101:0 0 4 = 04030904
ffff8ca19382db40 2029226520 S Ci:1:101:0 s 80 06 0302 0409 00ff 255 <
ffff8ca19382db40 2029229516 C Ci:1:101:0 0 36 = 24034c00 45004700 4f002000 52004500 41004400 45005200 20005600 32002e00
ffff8ca19382db40 2029229523 S Ci:1:101:0 s 80 06 0301 0409 00ff 255 <
ffff8ca19382db40 2029232517 C Ci:1:101:0 0 28 = 1c035000 44005000 20004c00 49004d00 49005400 45004400 2e002000
ffff8ca19382db40 2029232522 S Ci:1:101:0 s 80 06 0303 0409 00ff 255 <
ffff8ca190c48b40 2029234392 C Ii:1:066:1 0:4 18 = 20001e0e 00000000 0000f601 00000000 43f2
ffff8ca190c48b40 2029234396 S Ii:1:066:1 -115:4 64 <
ffff8ca19382db40 2029235516 C Ci:1:101:0 0 26 = 1a035000 2e004400 2e005000 2e003000 30003000 30003000 3000
ffff8ca190c48b40 2029246393 C Ii:1:066:1 0:4 18 = 20001f0e 00000000 0000a901 00000000 6af2
ffff8ca190c48b40 2029246398 S Ii:1:066:1 -115:4 64 <
ffff8ca190c48b40 2029254393 C Ii:1:066:1 0:4 18 = 2000200e 00000000 0000f601 00000000 43f2
ffff8ca190c48b40 2029254396 S Ii:1:066:1 -115:4 64 <
ffff8ca19382db40 2029257980 S Co:1:101:0 s 00 09 0001 0000 0000 0
ffff8ca19382db40 2029259518 C Co:1:101:0 0 0
ffff8ca19382db40 2029259597 S Ci:1:101:0 s 80 06 0303 0409 00ff 255 <
ffff8ca19382db40 2029262518 C Ci:1:101:0 0 26 = 1a035000 2e004400 2e005000 2e003000 30003000 30003000 3000
ffff8ca19382db40 2029262529 S Co:1:101:0 s 21 0a 0000 0000 0000 0
ffff8ca19382db40 2029264518 C Co:1:101:0 0 0
ffff8ca19382db40 2029264523 S Ci:1:101:0 s 81 06 2200 0000 001d 29 <
ffff8ca190c48b40 2029266393 C Ii:1:066:1 0:4 18 = 2000210e 00000000 00001c02 00000000 1df2
ffff8ca190c48b40 2029266397 S Ii:1:066:1 -115:4 64 <
ffff8ca19382db40 2029267518 C Ci:1:101:0 0 29 = 0600ff09 01a10119 01292015 0026ff00 75089520 81001901 29209100 c0
ffff8ca190c48b40 2029274394 C Ii:1:066:1 0:4 18 = 2000220e 00000000 0000f601 00000000 91f2
ffff8ca190c48b40 2029274400 S Ii:1:066:1 -115:4 64 <
ffff8ca190c48b40 2029286395 C Ii:1:066:1 0:4 18 = 2000230e 00000000 0000f601 00000000 1df2
ffff8ca190c48b40 2029286401 S Ii:1:066:1 -115:4 64 <
ffff8ca190c48b40 2029294395 C Ii:1:066:1 0:4 18 = 2000240e 00000000 0000f601 00000000 6af2
ffff8ca190c48b40 2029294401 S Ii:1:066:1 -115:4 64 <
ffff8ca190c48b40 2029306397 C Ii:1:066:1 0:4 18 = 2000250e 00000000 0000cf01 00000000 1df2
ffff8ca190c48b40 2029306403 S Ii:1:066:1 -115:4 64 <
ffff8ca190c48b40 2029314395 C Ii:1:066:1 0:4 18 = 2000260e 00000000 0000cf01 00000000 f6f1
ffff8ca190c48b40 2029314401 S Ii:1:066:1 -115:4 64 <
ffff8ca190c48b40 2029326396 C Ii:1:066:1 0:4 18 = 2000270e 00000000 0000cf01 00000000 1df2
ffff8ca190c48b40 2029326400 S Ii:1:066:1 -115:4 64 <
ffff8ca190c48b40 2029334398 C Ii:1:066:1 0:4 18 = 2000280e 00000000 0000cf01 00000000 43f2
ffff8ca190c48b40 2029334402 S Ii:1:066:1 -115:4 64 <
ffff8ca190c48b40 2029346396 C Ii:1:066:1 0:4 18 = 2000290e 00000000 0000f601 00000000 43f2
ffff8ca190c48b40 2029346401 S Ii:1:066:1 -115:4 64 <
ffff8ca190c48b40 2029354396 C Ii:1:066:1 0:4 18 = 20002a0e 00000000 0000a901 00000000 43f2
ffff8ca190c48b40 2029354399 S Ii:1:066:1 -115:4 64 <
ffff8ca190c48b40 2029366397 C Ii:1:066:1 0:4 18 = 20002b0e 00000000 0000f601 00000000 6af2
ffff8ca190c48b40 2029366402 S Ii:1:066:1 -115:4 64 <
ffff8ca190c48b40 2029374397 C Ii:1:066:1 0:4 18 = 20002c0e 00000000 0000cf01 00000000 43f2
ffff8ca190c48b40 2029374401 S Ii:1:066:1 -115:4 64 <
ffff8ca190c48b40 2029386398 C Ii:1:066:1 0:4 18 = 20002d0e 00000000 0000f601 00000000 6af2
ffff8ca190c48b40 2029386403 S Ii:1:066:1 -115:4 64 <
ffff8ca190c48b40 2029406401 C Ii:1:066:1 0:4 18 = 20002e0e 00000000 0000a901 00000000 1df2
ffff8ca190c48b40 2029406407 S Ii:1:066:1 -115:4 64 <
ffff8ca190c48b40 2029414399 C Ii:1:066:1 0:4 18 = 20002f0e 00000000 0000f601 00000000 43f2
ffff8ca190c48b40 2029414404 S Ii:1:066:1 -115:4 64 <
ffff8ca190c48b40 2029426399 C Ii:1:066:1 0:4 18 = 2000300e 00000000 0000cf01 00000000 f6f1
ffff8ca190c48b40 2029426405 S Ii:1:066:1 -115:4 64 <
ffff8ca190c48b40 2029434400 C Ii:1:066:1 0:4 18 = 2000310e 00000000 0000f601 00000000 1df2
ffff8ca190c48b40 2029434405 S Ii:1:066:1 -115:4 64 <
ffff8ca190c48b40 2029454400 C Ii:1:066:1 0:4 18 = 2000320e 00000000 0000cf01 00000000 1df2
ffff8ca190c48b40 2029454404 S Ii:1:066:1 -115:4 64 <
ffff8ca190c48b40 2029474401 C Ii:1:066:1 0:4 18 = 2000330e 00000000 0000cf01 00000000 6af2
ffff8ca190c48b40 2029474405 S Ii:1:066:1 -115:4 64 <
ffff8ca190c48b40 2029486402 C Ii:1:066:1 0:4 18 = 2000340e 00000000 0000f601 00000000 43f2
ffff8ca190c48b40 2029486406 S Ii:1:066:1 -115:4 64 <
ffff8ca190c48b40 2029506401 C Ii:1:066:1 0:4 18 = 2000350e 00000000 0000cf01 00000000 6af2
ffff8ca190c48b40 2029506406 S Ii:1:066:1 -115:4 64 <
ffff8ca190c48b40 2029514402 C Ii:1:066:1 0:4 18 = 2000360e 00000000 0000f601 00000000 6af2
ffff8ca190c48b40 2029514406 S Ii:1:066:1 -115:4 64 <
ffff8ca190c48b40 2029526402 C Ii:1:066:1 0:4 18 = 2000370e 00000000 0000a901 00000000 43f2
ffff8ca190c48b40 2029526406 S Ii:1:066:1 -115:4 64 <
ffff8ca190c48b40 2029534402 C Ii:1:066:1 0:4 18 = 2000380e 00000000 0000f601 00000000 43f2
ffff8ca190c48b40 2029534406 S Ii:1:066:1 -115:4 64 <
ffff8ca190c48b40 2029554403 C Ii:1:066:1 0:4 18 = 2000390e 00000000 0000cf01 00000000 f6f1
ffff8ca190c48b40 2029554408 S Ii:1:066:1 -115:4 64 <
ffff8ca190c48b40 2029566403 C Ii:1:066:1 0:4 18 = 20003a0e 00000000 0000f601 00000000 43f2
ffff8ca190c48b40 2029566406 S Ii:1:066:1 -115:4 64 <
ffff8ca190c48b40 2029574403 C Ii:1:066:1 0:4 18 = 20003b0e 00000000 0000cf01 00000000 43f2
ffff8ca190c48b40 2029574408 S Ii:1:066:1 -115:4 64 <
ffff8ca190c48b40 2029586404 C Ii:1:066:1 0:4 18 = 20003c0e 00000000 00004302 00000000 6af2
ffff8ca190c48b40 2029586409 S Ii:1:066:1 -115:4 64 <
ffff8ca190c48b40 2029594404 C Ii:1:066:1 0:4 18 = 20003d0e 00000000 00001c02 00000000 6af2
ffff8ca190c48b40 2029594409 S Ii:1:066:1 -115:4 64 <
ffff8ca190c48b40 2029606405 C Ii:1:066:1 0:4 18 = 20003e0e 00000000 0000cf01 00000000 6af2
ffff8ca190c48b40 2029606409 S Ii:1:066:1 -115:4 64 <
ffff8ca190c48b40 2029614405 C Ii:1:066:1 0:4 18 = 20003f0e 00000000 0000cf01 00000000 43f2
ffff8ca190c48b40 2029614410 S Ii:1:066:1 -115:4 64 <
ffff8ca190c48b40 2029626405 C Ii:1:066:1 0:4 18 = 2000400e 00000000 00001c02 00000000 43f2
ffff8ca190c48b40 2029626411 S Ii:1:066:1 -115:4 64 <
ffff8ca190c48b40 2029634405 C Ii:1:066:1 0:4 18 = 2000410e 00000000 00001c02 00000000 6af2
ffff8ca190c48b40 2029634408 S Ii:1:066:1 -115:4 64 <
ffff8ca190c48b40 2029646407 C Ii:1:066:1 0:4 18 = 2000420e 00000000 0000f601 00000000 43f2
ffff8ca190c48b40 2029646414 S Ii:1:066:1 -115:4 64 <
ffff8ca190c48b40 2029654406 C Ii:1:066:1 0:4 18 = 2000430e 00000000 0000a901 00000000 6af2
ffff8ca190c48b40 2029654411 S Ii:1:066:1 -115:4 64 <
ffff8ca190c48b40 2029666406 C Ii:1:066:1 0:4 18 = 2000440e 00000000 00001c02 00000000 1df2
ffff8ca190c48b40 2029666410 S Ii:1:066:1 -115:4 64 <
ffff8ca190c48b40 2029674406 C Ii:1:066:1 0:4 18 = 2000450e 00000000 0000f601 00000000 6af2
ffff8ca190c48b40 2029674411 S Ii:1:066:1 -115:4 64 <
ffff8ca190c48b40 2029686409 C Ii:1:066:1 0:4 18 = 2000460e 00000000 00001c02 00000000 6af2
ffff8ca190c48b40 2029686414 S Ii:1:066:1 -115:4 64 <
ffff8ca190c48b40 2029694408 C Ii:1:066:1 0:4 18 = 2000470e 00000000 0000cf01 00000000 43f2
ffff8ca190c48b40 2029694413 S Ii:1:066:1 -115:4 64 <
ffff8ca190c48b40 2029706408 C Ii:1:066:1 0:4 18 = 2000480e 00000000 0000cf01 00000000 1df2
ffff8ca190c48b40 2029706412 S Ii:1:066:1 -115:4 64 <
ffff8ca190c48b40 2029714408 C Ii:1:066:1 0:4 18 = 2000490e 00000000 0000f601 00000000 6af2
ffff8ca190c48b40 2029714412 S Ii:1:066:1 -115:4 64 <
ffff8ca190c48b40 2029726409 C Ii:1:066:1 0:4 18 = 20004a0e 00000000 0000f601 00000000 43f2
ffff8ca190c48b40 2029726413 S Ii:1:066:1 -115:4 64 <
ffff8ca190c48b40 2029734408 C Ii:1:066:1 0:4 18 = 20004b0e 00000000 00004302 00000000 1df2
ffff8ca190c48b40 2029734413 S Ii:1:066:1 -115:4 64 <
ffff8ca190c48b40 2029746409 C Ii:1:066:1 0:4 18 = 20004c0e 00000000 0000cf01 00000000 1df2
ffff8ca190c48b40 2029746412 S Ii:1:066:1 -115:4 64 <
ffff8ca190c48b40 2029754408 C Ii:1:066:1 0:4 18 = 20004d0e 00000000 0000f601 00000000 6af2
ffff8ca190c48b40 2029754414 S Ii:1:066:1 -115:4 64 <
ffff8ca190c48b40 2029766410 C Ii:1:066:1 0:4 18 = 20004e0e 00000000 0000cf01 00000000 1df2
ffff8ca190c48b40 2029766414 S Ii:1:066:1 -115:4 64 <
ffff8ca190c48b40 2029774413 C Ii:1:066:1 0:4 18 = 20004f0e 00000000 0000cf01 00000000 43f2
ffff8ca190c48b40 2029774417 S Ii:1:066:1 -115:4 64 <
ffff8ca190c48b40 2029786410 C Ii:1:066:1 0:4 18 = 2000500e 00000000 00001c02 00000000 6af2
ffff8ca190c48b40 2029786415 S Ii:1:066:1 -115:4 64 <
ffff8ca190c48b40 2029794411 C Ii:1:066:1 0:4 18 = 2000510e 00000000 0000f601 00000000 f6f1
ffff8ca190c48b40 2029794417 S Ii:1:066:1 -115:4 64 <
ffff8ca190c48b40 2029806411 C Ii:1:066:1 0:4 18 = 2000520e 00000000 0000cf01 00000000 6af2
ffff8ca190c48b40 2029806415 S Ii:1:066:1 -115:4 64 <
ffff8ca190c48b40 2029814411 C Ii:1:066:1 0:4 18 = 2000530e 00000000 0000f601 00000000 43f2
ffff8ca190c48b40 2029814415 S Ii:1:066:1 -115:4 64 <
ffff8ca190c48b40 2029834505 C Ii:1:066:1 0:4 18 = 2000540e 00000000 00004302 00000000 91f2
ffff8ca190c48b40 2029834513 S Ii:1:066:1 -115:4 64 <
ffff8ca190c48b40 2029846412 C Ii:1:066:1 0:4 18 = 2000550e 00000000 00001c02 00000000 43f2
ffff8ca190c48b40 2029846417 S Ii:1:066:1 -115:4 64 <
ffff8ca190c48b40 2029854412 C Ii:1:066:1 0:4 18 = 2000560e 00000000 0000f601 00000000 1df2
ffff8ca190c48b40 2029854418 S Ii:1:066:1 -115:4 64 <
ffff8ca190c48b40 2029866413 C Ii:1:066:1 0:4 18 = 2000570e 00000000 00001c02 00000000 43f2
ffff8ca190c48b40 2029866418 S Ii:1:066:1 -115:4 64 <
ffff8ca190c48b40 2029874414 C Ii:1:066:1 0:4 18 = 2000580e 00000000 0000f601 00000000 1df2
ffff8ca190c48b40 2029874418 S Ii:1:066:1 -115:4 64 <
ffff8ca190c48b40 2029886414 C Ii:1:066:1 0:4 18 = 2000590e 00000000 0000cf01 00000000 1df2
ffff8ca190c48b40 2029886419 S Ii:1:066:1 -115:4 64 <
ffff8ca190c48b40 2029894414 C Ii:1:066:1 0:4 18 = 20005a0e 00000000 00001c02 00000000 f6f1
ffff8ca190c48b40 2029894418 S Ii:1:066:1 -115:4 64 <
ffff8ca190c48b40 2029906414 C Ii:1:066:1 0:4 18 = 20005b0e 00000000 00008201 00000000 43f2
ffff8ca190c48b40 2029906418 S Ii:1:066:1 -115:4 64 <
ffff8ca190c48b40 2029914414 C Ii:1:066:1 0:4 18 = 20005c0e 00000000 0000f601 00000000 43f2
ffff8ca190c48b40 2029914417 S Ii:1:066:1 -115:4 64 <
ffff8ca18a773c00 2029924050 S Ci:1:001:0 s a3 00 0000 0009 0004 4 <
ffff8ca18a773c00 2029924064 C Ci:1:001:0 0 4 = 07010000
ffff8ca21d61d600 2029924072 S Co:1:001:0 s 23 01 0002 0009 0000 0
ffff8ca190c48b40 2029934415 C Ii:1:066:1 0:4 18 = 20005d0e 00000000 00001c02 00000000 f6f1
ffff8ca190c48b40 2029934421 S Ii:1:066:1 -115:4 64 <
ffff8ca190c48b40 2029946416 C Ii:1:066:1 0:4 18 = 20005e0e 00000000 00001c02 00000000 43f2
ffff8ca190c48b40 2029946421 S Ii:1:066:1 -115:4 64 <
ffff8ca190c48b40 2029954415 C Ii:1:066:1 0:4 18 = 20005f0e 00000000 0000cf01 00000000 1df2
ffff8ca190c48b40 2029954420 S Ii:1:066:1 -115:4 64 <
ffff8ca21d61d600 2029966028 C Co:1:001:0 0 0
ffff8ca18bf35d80 2029966086 C Ii:1:001:1 0:2048 2 = 0002
ffff8ca18bf35d80 2029966091 S Ii:1:001:1 -115:2048 4 <
ffff8ca190c48b40 2029966416 C Ii:1:066:1 0:4 18 = 2000600e 00000000 00001c02 00000000 43f2
ffff8ca190c48b40 2029966421 S Ii:1:066:1 -115:4 64 <
ffff8ca190c48b40 2029974417 C Ii:1:066:1 0:4 18 = 2000610e 00000000 00001c02 00000000 f6f1
ffff8ca190c48b40 2029974423 S Ii:1:066:1 -115:4 64 <
ffff8ca190c48b40 2029986420 C Ii:1:066:1 0:4 18 = 2000620e 00000000 0000f601 00000000 6af2
ffff8ca190c48b40 2029986424 S Ii:1:066:1 -115:4 64 <
ffff8ca190c48b40 2029994418 C Ii:1:066:1 0:4 18 = 2000630e 00000000 0000cf01 00000000 6af2
ffff8ca190c48b40 2029994422 S Ii:1:066:1 -115:4 64 <
ffff8ca190c48b40 2030006417 C Ii:1:066:1 0:4 18 = 2000640e 00000000 0000f601 00000000 43f2
ffff8ca190c48b40 2030006422 S Ii:1:066:1 -115:4 64 <
ffff8ca18cc0f780 2030007011 S Ci:1:001:0 s a3 00 0000 0009 0004 4 <
ffff8ca18cc0f780 2030007027 C Ci:1:001:0 0 4 = 03010400
ffff8ca18f245600 2030007035 S Co:1:001:0 s 23 01 0012 0009 0000 0
ffff8ca18f245600 2030007046 C Co:1:001:0 0 0
ffff8ca190c48b40 2030014421 C Ii:1:066:1 0:4 18 = 2000650e 00000000 0000cf01 00000000 1df2
ffff8ca190c48b40 2030014426 S Ii:1:066:1 -115:4 64 <
ffff8ca18f245600 2030018013 S Ci:1:007:0 s 80 00 0000 0000 0002 2 <
ffff8ca18f245600 2030020654 C Ci:1:007:0 0 2 = 0100
ffff8ca19382d900 2030021033 S Ci:1:001:0 s a3 00 0000 0009 0004 4 <
ffff8ca19382d900 2030021039 C Ci:1:001:0 0 4 = 03010000
ffff8ca190c48b40 2030026418 C Ii:1:066:1 0:4 18 = 2000660e 00000000 0000f601 00000000 6af2
ffff8ca190c48b40 2030026422 S Ii:1:066:1 -115:4 64 <
ffff8ca190c48b40 2030034501 C Ii:1:066:1 0:4 18 = 2000670e 00000000 0000f601 00000000 43f2
ffff8ca190c48b40 2030034504 S Ii:1:066:1 -115:4 64 <
ffff8ca190c48b40 2030054422 C Ii:1:066:1 0:4 18 = 2000680e 00000000 00001c02 00000000 1df2
ffff8ca190c48b40 2030054428 S Ii:1:066:1 -115:4 64 <
ffff8ca190c48b40 2030066419 C Ii:1:066:1 0:4 18 = 2000690e 00000000 0000f601 00000000 6af2
ffff8ca190c48b40 2030066423 S Ii:1:066:1 -115:4 64 <
ffff8ca190c48b40 2030074420 C Ii:1:066:1 0:4 18 = 20006a0e 00000000 0000f601 00000000 f6f1
ffff8ca190c48b40 2030074427 S Ii:1:066:1 -115:4 64 <
ffff8ca190c48b40 2030086421 C Ii:1:066:1 0:4 18 = 20006b0e 00000000 0000f601 00000000 1df2
ffff8ca190c48b40 2030086427 S Ii:1:066:1 -115:4 64 <
ffff8ca190c48b40 2030094420 C Ii:1:066:1 0:4 18 = 20006c0e 00000000 0000f601 00000000 6af2
ffff8ca190c48b40 2030094425 S Ii:1:066:1 -115:4 64 <
ffff8ca190c48b40 2030106421 C Ii:1:066:1 0:4 18 = 20006d0e 00000000 0000cf01 00000000 6af2
ffff8ca190c48b40 2030106424 S Ii:1:066:1 -115:4 64 <
ffff8ca190c48b40 2030114421 C Ii:1:066:1 0:4 18 = 20006e0e 00000000 0000cf01 00000000 f6f1
ffff8ca190c48b40 2030114425 S Ii:1:066:1 -115:4 64 <
ffff8ca190c48b40 2030126422 C Ii:1:066:1 0:4 18 = 20006f0e 00000000 0000cf01 00000000 6af2
ffff8ca190c48b40 2030126426 S Ii:1:066:1 -115:4 64 <
ffff8ca190c48b40 2030134421 C Ii:1:066:1 0:4 18 = 2000700e 00000000 0000cf01 00000000 1df2
ffff8ca190c48b40 2030134425 S Ii:1:066:1 -115:4 64 <
ffff8ca190c48b40 2030146423 C Ii:1:066:1 0:4 18 = 2000710e 00000000 0000f601 00000000 43f2
ffff8ca190c48b40 2030146427 S Ii:1:066:1 -115:4 64 <
ffff8ca190c48b40 2030166422 C Ii:1:066:1 0:4 18 = 2000720e 00000000 00001c02 00000000 43f2
ffff8ca190c48b40 2030166427 S Ii:1:066:1 -115:4 64 <
ffff8ca190c48b40 2030174423 C Ii:1:066:1 0:4 18 = 2000730e 00000000 0000f601 00000000 1df2
ffff8ca190c48b40 2030174427 S Ii:1:066:1 -115:4 64 <
ffff8ca190c48b40 2030186423 C Ii:1:066:1 0:4 18 = 2000740e 00000000 0000cf01 00000000 43f2
ffff8ca190c48b40 2030186429 S Ii:1:066:1 -115:4 64 <
ffff8ca190c48b40 2030194423 C Ii:1:066:1 0:4 18 = 2000750e 00000000 0000f601 00000000 1df2
ffff8ca190c48b40 2030194427 S Ii:1:066:1 -115:4 64 <
ffff8ca190c48b40 2030206424 C Ii:1:066:1 0:4 18 = 2000760e 00000000 0000cf01 00000000 f6f1
ffff8ca190c48b40 2030206428 S Ii:1:066:1 -115:4 64 <
ffff8ca190c48b40 2030214426 C Ii:1:066:1 0:4 18 = 2000770e 00000000 0000cf01 00000000 1df2
ffff8ca190c48b40 2030214429 S Ii:1:066:1 -115:4 64 <
ffff8ca190c48b40 2030226424 C Ii:1:066:1 0:4 18 = 2000780e 00000000 0000f601 00000000 43f2
ffff8ca190c48b40 2030226428 S Ii:1:066:1 -115:4 64 <
ffff8ca190c48b40 2030234425 C Ii:1:066:1 0:4 18 = 2000790e 00000000 0000a901 00000000 43f2
ffff8ca190c48b40 2030234428 S Ii:1:066:1 -115:4 64 <
ffff8ca18f245600 2030237536 S Ci:1:101:0 s 80 06 0200 0000 03e8 1000 <
ffff8ca18f245600 2030239550 C Ci:1:101:0 0 41 = 09022900 01010080 fa090400 00020300 00000921 00010001 221d0007 05810320
ffff8ca190c48b40 2030246425 C Ii:1:066:1 0:4 18 = 20007a0e 00000000 0000cf01 00000000 1df2
ffff8ca190c48b40 2030246434 S Ii:1:066:1 -115:4 64 <
ffff8ca18168f780 2030246448 S Co:1:101:0 s 00 09 0001 0000 0000 0
ffff8ca18168f780 2030247558 C Co:1:101:0 0 0
ffff8ca19382d900 2030247676 S Ii:1:101:1 -115:1 32 <
ffff8ca180ccaa80 2030254085 S Io:1:101:1 -115:1 32 = 550fb001 28632920 4c45474f 20323031 34f70000 00000000 00000000 00000000
ffff8ca190c48b40 2030254426 C Ii:1:066:1 0:4 18 = 20007b0e 00000000 0000f601 00000000 6af2
ffff8ca190c48b40 2030254432 S Ii:1:066:1 -115:4 64 <
ffff8ca180ccaa80 2030254599 C Io:1:101:1 0:1 32 >
ffff8ca19382d900 2030255572 C Ii:1:101:1 0:1 32 = 55190100 2f020102 020402f5 00198d54 8e2d5bae 4e004217 0100151b 00000000
ffff8ca19382d0c0 2030255910 S Ii:1:101:1 -115:1 32 <
ffff8ca190c48b40 2030266543 C Ii:1:066:1 0:4 18 = 20007c0e 00000000 00001c02 00000000 43f2
ffff8ca190c48b40 2030266548 S Ii:1:066:1 -115:4 64 <
ffff8ca190c48b40 2030274427 C Ii:1:066:1 0:4 18 = 20007d0e 00000000 0000f601 00000000 6af2
ffff8ca190c48b40 2030274431 S Ii:1:066:1 -115:4 64 <
ffff8ca190c48b40 2030286428 C Ii:1:066:1 0:4 18 = 20007e0e 00000000 0000cf01 00000000 43f2
ffff8ca190c48b40 2030286434 S Ii:1:066:1 -115:4 64 <
ffff8ca190c48b40 2030294430 C Ii:1:066:1 0:4 18 = 20007f0e 00000000 0000cf01 00000000 f6f1
ffff8ca190c48b40 2030294434 S Ii:1:066:1 -115:4 64 <
ffff8ca190c48b40 2030306427 C Ii:1:066:1 0:4 18 = 2000800e 00000000 00001c02 00000000 43f2
ffff8ca190c48b40 2030306430 S Ii:1:066:1 -115:4 64 <
ffff8ca190c48b40 2030314428 C Ii:1:066:1 0:4 18 = 2000810e 00000000 0000f601 00000000 91f2
ffff8ca190c48b40 2030314432 S Ii:1:066:1 -115:4 64 <
ffff8ca18cc0f000 2030320408 S Io:1:101:1 -115:1 32 = 5506c002 00ff6e18 a2000000 00000000 00000000 00000000 00000000 00000000
ffff8ca18cc0f000 2030320654 C Io:1:101:1 0:1 32 >
ffff8ca19382d0c0 2030321574 C Ii:1:101:1 0:1 32 = 55010258 00000000 00000000 00000000 00000000 00000000 00000000 00000000
ffff8ca19382d9c0 2030322484 S Ii:1:101:1 -115:1 32 <
ffff8ca190c48b40 2030326428 C Ii:1:066:1 0:4 18 = 2000820e 00000000 0000f601 00000000 43f2
ffff8ca190c48b40 2030326432 S Ii:1:066:1 -115:4 64 <
ffff8ca190c48b40 2030334427 C Ii:1:066:1 0:4 18 = 2000830e 00000000 0000cf01 00000000 43f2
ffff8ca190c48b40 2030334432 S Ii:1:066:1 -115:4 64 <
ffff8ca190c48b40 2030366430 C Ii:1:066:1 0:4 18 = 2000840e 00000000 0000f601 00000000 43f2
ffff8ca190c48b40 2030366435 S Ii:1:066:1 -115:4 64 <
ffff8ca190c48b40 2030374430 C Ii:1:066:1 0:4 18 = 2000850e 00000000 0000cf01 00000000 43f2
ffff8ca190c48b40 2030374435 S Ii:1:066:1 -115:4 64 <
ffff8ca190c48b40 2030386430 C Ii:1:066:1 0:4 18 = 2000860e 00000000 0000a901 00000000 1df2
ffff8ca190c48b40 2030386436 S Ii:1:066:1 -115:4 64 <
ffff8ca21d61dc00 2030387226 S Io:1:101:1 -115:1 32 = 550ab103 e4e49fb8 1873016b 29000000 00000000 00000000 00000000 00000000
ffff8ca21d61dc00 2030387577 C Io:1:101:1 0:1 32 >
ffff8ca19382d9c0 2030389576 C Ii:1:101:1 0:1 32 = 5509031c 772bf0a7 2cca0db9 00000000 00000000 00000000 00000000 00000000
ffff8ca19382d480 2030390047 S Ii:1:101:1 -115:1 32 <
ffff8ca190c48b40 2030406433 C Ii:1:066:1 0:4 18 = 2000870e 00000000 0000cf01 00000000 6af2
ffff8ca190c48b40 2030406438 S Ii:1:066:1 -115:4 64 <
ffff8ca190c48b40 2030414430 C Ii:1:066:1 0:4 18 = 2000880e 00000000 00001c02 00000000 43f2
ffff8ca190c48b40 2030414436 S Ii:1:066:1 -115:4 64 <
ffff8ca190c48b40 2030426430 C Ii:1:066:1 0:4 18 = 2000890e 00000000 0000cf01 00000000 43f2
ffff8ca190c48b40 2030426436 S Ii:1:066:1 -115:4 64 <
ffff8ca190c48b40 2030434431 C Ii:1:066:1 0:4 18 = 20008a0e 00000000 0000f601 00000000 43f2
ffff8ca190c48b40 2030434435 S Ii:1:066:1 -115:4 64 <
ffff8ca190c48b40 2030446432 C Ii:1:066:1 0:4 18 = 20008b0e 00000000 00001c02 00000000 91f2
ffff8ca190c48b40 2030446436 S Ii:1:066:1 -115:4 64 <
ffff8ca193a3d240 2030453827 S Io:1:101:1 -115:1 32 = 550ab304 7de7c46b acf9fb2f 78000000 00000000 00000000 00000000 00000000
ffff8ca190c48b40 2030454432 C Ii:1:066:1 0:4 18 = 20008c0e 00000000 0000f601 00000000 1df2
ffff8ca190c48b40 2030454435 S Ii:1:066:1 -115:4 64 <
ffff8ca193a3d240 2030454605 C Io:1:101:1 0:1 32 >
ffff8ca19382d480 2030465579 C Ii:1:101:1 0:1 32 = 550904db bb41ad5c f75264ef 00000000 00000000 00000000 00000000 00000000
ffff8ca19382d3c0 2030465925 S Ii:1:101:1 -115:1 32 <
ffff8ca190c48b40 2030474434 C Ii:1:066:1 0:4 18 = 20008d0e 00000000 0000f601 00000000 43f2
ffff8ca190c48b40 2030474439 S Ii:1:066:1 -115:4 64 <
ffff8ca190c48b40 2030486434 C Ii:1:066:1 0:4 18 = 20008e0e 00000000 0000cf01 00000000 43f2
ffff8ca190c48b40 2030486439 S Ii:1:066:1 -115:4 64 <
ffff8ca190c48b40 2030494434 C Ii:1:066:1 0:4 18 = 20008f0e 00000000 00001c02 00000000 1df2
ffff8ca190c48b40 2030494440 S Ii:1:066:1 -115:4 64 <
ffff8ca190c48b40 2030506436 C Ii:1:066:1 0:4 18 = 2000900e 00000000 0000f601 00000000 1df2
ffff8ca190c48b40 2030506441 S Ii:1:066:1 -115:4 64 <
ffff8ca190c48b40 2030514434 C Ii:1:066:1 0:4 18 = 2000910e 00000000 00001c02 00000000 43f2
ffff8ca190c48b40 2030514438 S Ii:1:066:1 -115:4 64 <
ffff8ca18168f000 2030520496 S Io:1:101:1 -115:1 32 = 5508c205 031001f4 6916ab00 00000000 00000000 00000000 00000000 00000000
ffff8ca18168f000 2030520581 C Io:1:101:1 0:1 32 >
ffff8ca190c48b40 2030526434 C Ii:1:066:1 0:4 18 = 2000920e 00000000 0000f601 00000000 43f2
ffff8ca190c48b40 2030526440 S Ii:1:066:1 -115:4 64 <
ffff8ca19382d3c0 2030541586 C Ii:1:101:1 0:1 32 = 5501055b 00000000 00000000 00000000 00000000 00000000 00000000 00000000
ffff8ca64c0c83c0 2030541668 S Ii:1:101:1 -115:1 32 <
ffff8ca190c48b40 2030546435 C Ii:1:066:1 0:4 18 = 2000930e 00000000 0000cf01 00000000 1df2
ffff8ca190c48b40 2030546442 S Ii:1:066:1 -115:4 64 <
ffff8ca190c48b40 2030554435 C Ii:1:066:1 0:4 18 = 2000940e 00000000 0000f601 00000000 6af2
ffff8ca190c48b40 2030554441 S Ii:1:066:1 -115:4 64 <
ffff8ca190c48b40 2030566435 C Ii:1:066:1 0:4 18 = 2000950e 00000000 0000cf01 00000000 6af2
ffff8ca190c48b40 2030566439 S Ii:1:066:1 -115:4 64 <
ffff8ca190c48b40 2030574436 C Ii:1:066:1 0:4 18 = 2000960e 00000000 0000a901 00000000 43f2
ffff8ca190c48b40 2030574445 S Ii:1:066:1 -115:4 64 <
ffff8ca190c48b40 2030586437 C Ii:1:066:1 0:4 18 = 2000970e 00000000 00001c02 00000000 43f2
ffff8ca190c48b40 2030586443 S Ii:1:066:1 -115:4 64 <
ffff8ca190c48b40 2030594437 C Ii:1:066:1 0:4 18 = 2000980e 00000000 0000cf01 00000000 43f2
ffff8ca190c48b40 2030594442 S Ii:1:066:1 -115:4 64 <
ffff8ca190c48b40 2030606438 C Ii:1:066:1 0:4 18 = 2000990e 00000000 0000f601 00000000 1df2
ffff8ca190c48b40 2030606443 S Ii:1:066:1 -115:4 64 <
ffff8ca190c48b40 2030614437 C Ii:1:066:1 0:4 18 = 20009a0e 00000000 0000f601 00000000 43f2
ffff8ca190c48b40 2030614445 S Ii:1:066:1 -115:4 64 <
ffff8ca190c48b40 2030626438 C Ii:1:066:1 0:4 18 = 20009b0e 00000000 00001c02 00000000 43f2
ffff8ca190c48b40 2030626443 S Ii:1:066:1 -115:4 64 <
ffff8ca190c48b40 2030634437 C Ii:1:066:1 0:4 18 = 20009c0e 00000000 0000a901 00000000 1df2
ffff8ca190c48b40 2030634442 S Ii:1:066:1 -115:4 64 <
ffff8ca190c48b40 2030646438 C Ii:1:066:1 0:4 18 = 20009d0e 00000000 0000f601 00000000 43f2
ffff8ca190c48b40 2030646442 S Ii:1:066:1 -115:4 64 <
ffff8ca190c48b40 2030654438 C Ii:1:066:1 0:4 18 = 20009e0e 00000000 0000f601 00000000 1df2
ffff8ca190c48b40 2030654443 S Ii:1:066:1 -115:4 64 <
ffff8ca190c48b40 2030666438 C Ii:1:066:1 0:4 18 = 20009f0e 00000000 0000cf01 00000000 43f2
ffff8ca190c48b40 2030666443 S Ii:1:066:1 -115:4 64 <
ffff8ca190c48b40 2030674438 C Ii:1:066:1 0:4 18 = 2000a00e 00000000 0000f601 00000000 6af2
ffff8ca190c48b40 2030674445 S Ii:1:066:1 -115:4 64 <
ffff8ca190c48b40 2030686439 C Ii:1:066:1 0:4 18 = 2000a10e 00000000 0000f601 00000000 43f2
ffff8ca190c48b40 2030686443 S Ii:1:066:1 -115:4 64 <
ffff8ca190c48b40 2030706441 C Ii:1:066:1 0:4 18 = 2000a20e 00000000 0000f601 00000000 f6f1
ffff8ca190c48b40 2030706446 S Ii:1:066:1 -115:4 64 <
ffff8ca190c48b40 2030714440 C Ii:1:066:1 0:4 18 = 2000a30e 00000000 0000cf01 00000000 1df2
ffff8ca190c48b40 2030714445 S Ii:1:066:1 -115:4 64 <
ffff8ca190c48b40 2030726442 C Ii:1:066:1 0:4 18 = 2000a40e 00000000 0000f601 00000000 6af2
ffff8ca190c48b40 2030726449 S Ii:1:066:1 -115:4 64 <
ffff8ca190c48b40 2030746442 C Ii:1:066:1 0:4 18 = 2000a50e 00000000 0000cf01 00000000 43f2
ffff8ca190c48b40 2030746448 S Ii:1:066:1 -115:4 64 <
ffff8ca190c48b40 2030754442 C Ii:1:066:1 0:4 18 = 2000a60e 00000000 0000cf01 00000000 1df2
ffff8ca190c48b40 2030754445 S Ii:1:066:1 -115:4 64 <
ffff8ca190c48b40 2030766442 C Ii:1:066:1 0:4 18 = 2000a70e 00000000 0000f601 00000000 1df2
ffff8ca190c48b40 2030766445 S Ii:1:066:1 -115:4 64 <
ffff8ca190c48b40 2030774442 C Ii:1:066:1 0:4 18 = 2000a80e 00000000 0000a901 00000000 43f2
ffff8ca190c48b40 2030774446 S Ii:1:066:1 -115:4 64 <
ffff8ca190c48b40 2030786446 C Ii:1:066:1 0:4 18 = 2000a90e 00000000 0000cf01 00000000 6af2
ffff8ca190c48b40 2030786450 S Ii:1:066:1 -115:4 64 <
ffff8ca190c48b40 2030794443 C Ii:1:066:1 0:4 18 = 2000aa0e 00000000 0000cf01 00000000 43f2
ffff8ca190c48b40 2030794449 S Ii:1:066:1 -115:4 64 <
ffff8ca190c48b40 2030806445 C Ii:1:066:1 0:4 18 = 2000ab0e 00000000 0000f601 00000000 43f2
ffff8ca190c48b40 2030806449 S Ii:1:066:1 -115:4 64 <
ffff8ca190c48b40 2030814445 C Ii:1:066:1 0:4 18 = 2000ac0e 00000000 0000f601 00000000 6af2
ffff8ca190c48b40 2030814450 S Ii:1:066:1 -115:4 64 <
ffff8ca190c48b40 2030826444 C Ii:1:066:1 0:4 18 = 2000ad0e 00000000 0000f601 00000000 1df2
ffff8ca190c48b40 2030826448 S Ii:1:066:1 -115:4 64 <
ffff8ca190c48b40 2030834827 C Ii:1:066:1 0:4 18 = 2000ae0e 00000000 0000a901 00000000 43f2
ffff8ca190c48b40 2030834831 S Ii:1:066:1 -115:4 64 <
ffff8ca190c48b40 2030846445 C Ii:1:066:1 0:4 18 = 2000af0e 00000000 0000cf01 00000000 6af2
ffff8ca190c48b40 2030846450 S Ii:1:066:1 -115:4 64 <
ffff8ca190c48b40 2030854445 C Ii:1:066:1 0:4 18 = 2000b00e 00000000 0000cf01 00000000 43f2
ffff8ca190c48b40 2030854449 S Ii:1:066:1 -115:4 64 <
ffff8ca190c48b40 2030866445 C Ii:1:066:1 0:4 18 = 2000b10e 00000000 0000f601 00000000 f6f1
ffff8ca190c48b40 2030866449 S Ii:1:066:1 -115:4 64 <
ffff8ca190c48b40 2030874445 C Ii:1:066:1 0:4 18 = 2000b20e 00000000 0000f601 00000000 43f2
ffff8ca190c48b40 2030874454 S Ii:1:066:1 -115:4 64 <
ffff8ca190c48b40 2030886446 C Ii:1:066:1 0:4 18 = 2000b30e 00000000 0000cf01 00000000 43f2
ffff8ca190c48b40 2030886452 S Ii:1:066:1 -115:4 64 <
ffff8ca190c48b40 2030894446 C Ii:1:066:1 0:4 18 = 2000b40e 00000000 0000f601 00000000 43f2
ffff8ca190c48b40 2030894450 S Ii:1:066:1 -115:4 64 <
ffff8ca190c48b40 2030906446 C Ii:1:066:1 0:4 18 = 2000b50e 00000000 0000cf01 00000000 1df2
ffff8ca190c48b40 2030906450 S Ii:1:066:1 -115:4 64 <
ffff8ca190c48b40 2030914446 C Ii:1:066:1 0:4 18 = 2000b60e 00000000 0000f601 00000000 6af2
ffff8ca190c48b40 2030914451 S Ii:1:066:1 -115:4 64 <
ffff8ca190c48b40 2030926447 C Ii:1:066:1 0:4 18 = 2000b70e 00000000 0000cf01 00000000 43f2
ffff8ca190c48b40 2030926452 S Ii:1:066:1 -115:4 64 <
ffff8ca190c48b40 2030934447 C Ii:1:066:1 0:4 18 = 2000b80e 00000000 0000cf01 00000000 6af2
ffff8ca190c48b40 2030934451 S Ii:1:066:1 -115:4 64 <
ffff8ca190c48b40 2030946447 C Ii:1:066:1 0:4 18 = 2000b90e 00000000 0000cf01 00000000 1df2
ffff8ca190c48b40 2030946451 S Ii:1:066:1 -115:4 64 <
ffff8ca190c48b40 2030954448 C Ii:1:066:1 0:4 18 = 2000ba0e 00000000 0000cf01 00000000 6af2
ffff8ca190c48b40 2030954452 S Ii:1:066:1 -115:4 64 <
ffff8ca190c48b40 2030966537 C Ii:1:066:1 0:4 18 = 2000bb0e 00000000 0000f601 00000000 1df2
ffff8ca190c48b40 2030966542 S Ii:1:066:1 -115:4 64 <
ffff8ca190c48b40 2030974449 C Ii:1:066:1 0:4 18 = 2000bc0e 00000000 00001c02 00000000 43f2
ffff8ca190c48b40 2030974454 S Ii:1:066:1 -115:4 64 <
ffff8ca190c48b40 2030986450 C Ii:1:066:1 0:4 18 = 2000bd0e 00000000 00004302 00000000 1df2
ffff8ca190c48b40 2030986455 S Ii:1:066:1 -115:4 64 <
ffff8ca190c48b40 2030994449 C Ii:1:066:1 0:4 18 = 2000be0e 00000000 0000f601 00000000 1df2
ffff8ca190c48b40 2030994452 S Ii:1:066:1 -115:4 64 <
ffff8ca190c48b40 2031006450 C Ii:1:066:1 0:4 18 = 2000bf0e 00000000 0000f601 00000000 43f2
ffff8ca190c48b40 2031006454 S Ii:1:066:1 -115:4 64 <
ffff8ca190c48b40 2031026450 C Ii:1:066:1 0:4 18 = 2000c00e 00000000 0000cf01 00000000 1df2
ffff8ca190c48b40 2031026455 S Ii:1:066:1 -115:4 64 <
ffff8ca190c48b40 2031034493 C Ii:1:066:1 0:4 18 = 2000c10e 00000000 00001c02 00000000 43f2
ffff8ca190c48b40 2031034499 S Ii:1:066:1 -115:4 64 <
ffff8ca190c48b40 2031046450 C Ii:1:066:1 0:4 18 = 2000c20e 00000000 0000cf01 00000000 f6f1
ffff8ca190c48b40 2031046456 S Ii:1:066:1 -115:4 64 <
ffff8ca190c48b40 2031054451 C Ii:1:066:1 0:4 18 = 2000c30e 00000000 0000f601 00000000 43f2
ffff8ca190c48b40 2031054454 S Ii:1:066:1 -115:4 64 <
ffff8ca190c48b40 2031066455 C Ii:1:066:1 0:4 18 = 2000c40e 00000000 00001c02 00000000 1df2
ffff8ca190c48b40 2031066460 S Ii:1:066:1 -115:4 64 <
ffff8ca190c48b40 2031074451 C Ii:1:066:1 0:4 18 = 2000c50e 00000000 0000f601 00000000 f6f1
ffff8ca190c48b40 2031074456 S Ii:1:066:1 -115:4 64 <
ffff8ca190c48b40 2031086453 C Ii:1:066:1 0:4 18 = 2000c60e 00000000 0000f601 00000000 43f2
ffff8ca190c48b40 2031086460 S Ii:1:066:1 -115:4 64 <
ffff8ca190c48b40 2031094455 C Ii:1:066:1 0:4 18 = 2000c70e 00000000 00001c02 00000000 1df2
ffff8ca190c48b40 2031094462 S Ii:1:066:1 -115:4 64 <
ffff8ca190c48b40 2031106453 C Ii:1:066:1 0:4 18 = 2000c80e 00000000 0000cf01 00000000 43f2
ffff8ca190c48b40 2031106457 S Ii:1:066:1 -115:4 64 <
ffff8ca190c48b40 2031114455 C Ii:1:066:1 0:4 18 = 2000c90e 00000000 0000f601 00000000 f6f1
ffff8ca190c48b40 2031114460 S Ii:1:066:1 -115:4 64 <
ffff8ca190c48b40 2031126454 C Ii:1:066:1 0:4 18 = 2000ca0e 00000000 0000cf01 00000000 43f2
ffff8ca190c48b40 2031126459 S Ii:1:066:1 -115:4 64 <
ffff8ca190c48b40 2031134454 C Ii:1:066:1 0:4 18 = 2000cb0e 00000000 0000f601 00000000 43f2
ffff8ca190c48b40 2031134458 S Ii:1:066:1 -115:4 64 <
ffff8ca190c48b40 2031186457 C Ii:1:066:1 0:4 18 = 2000cc0e 00000000 0000f601 00000000 6af2
ffff8ca190c48b40 2031186463 S Ii:1:066:1 -115:4 64 <
ffff8ca190c48b40 2031194456 C Ii:1:066:1 0:4 18 = 2000cd0e 00000000 0000f601 00000000 1df2
ffff8ca190c48b40 2031194461 S Ii:1:066:1 -115:4 64 <
ffff8ca190c48b40 2031206457 C Ii:1:066:1 0:4 18 = 2000ce0e 00000000 0000f601 00000000 43f2
ffff8ca190c48b40 2031206461 S Ii:1:066:1 -115:4 64 <
ffff8ca190c48b40 2031214456 C Ii:1:066:1 0:4 18 = 2000cf0e 00000000 0000cf01 00000000 f6f1
ffff8ca190c48b40 2031214461 S Ii:1:066:1 -115:4 64 <
ffff8ca190c48b40 2031226458 C Ii:1:066:1 0:4 18 = 2000d00e 00000000 0000f601 00000000 1df2
ffff8ca190c48b40 2031226464 S Ii:1:066:1 -115:4 64 <
ffff8ca190c48b40 2031234457 C Ii:1:066:1 0:4 18 = 2000d10e 00000000 0000a901 00000000 43f2
ffff8ca190c48b40 2031234462 S Ii:1:066:1 -115:4 64 <
ffff8ca190c48b40 2031246457 C Ii:1:066:1 0:4 18 = 2000d20e 00000000 0000f601 00000000 6af2
ffff8ca190c48b40 2031246461 S Ii:1:066:1 -115:4 64 <
ffff8ca190c48b40 2031254457 C Ii:1:066:1 0:4 18 = 2000d30e 00000000 0000cf01 00000000 1df2
ffff8ca190c48b40 2031254461 S Ii:1:066:1 -115:4 64 <
ffff8ca190c48b40 2031274460 C Ii:1:066:1 0:4 18 = 2000d40e 00000000 0000cf01 00000000 6af2
ffff8ca190c48b40 2031274463 S Ii:1:066:1 -115:4 64 <
ffff8ca190c48b40 2031286459 C Ii:1:066:1 0:4 18 = 2000d50e 00000000 0000f601 00000000 43f2
ffff8ca190c48b40 2031286464 S Ii:1:066:1 -115:4 64 <
ffff8ca190c48b40 2031294459 C Ii:1:066:1 0:4 18 = 2000d60e 00000000 0000f601 00000000 f6f1
ffff8ca190c48b40 2031294463 S Ii:1:066:1 -115:4 64 <
ffff8ca190c48b40 2031306459 C Ii:1:066:1 0:4 18 = 2000d70e 00000000 0000f601 00000000 43f2
ffff8ca190c48b40 2031306464 S Ii:1:066:1 -115:4 64 <
ffff8ca190c48b40 2031314460 C Ii:1:066:1 0:4 18 = 2000d80e 00000000 0000cf01 00000000 1df2
ffff8ca190c48b40 2031314465 S Ii:1:066:1 -115:4 64 <
ffff8ca190c48b40 2031326460 C Ii:1:066:1 0:4 18 = 2000d90e 00000000 0000f601 00000000 f6f1
ffff8ca190c48b40 2031326465 S Ii:1:066:1 -115:4 64 <
ffff8ca190c48b40 2031334552 C Ii:1:066:1 0:4 18 = 2000da0e 00000000 0000f601 00000000 1df2
ffff8ca190c48b40 2031334557 S Ii:1:066:1 -115:4 64 <
ffff8ca190c48b40 2031346463 C Ii:1:066:1 0:4 18 = 2000db0e 00000000 0000cf01 00000000 43f2
ffff8ca190c48b40 2031346467 S Ii:1:066:1 -115:4 64 <
ffff8ca190c48b40 2031354461 C Ii:1:066:1 0:4 18 = 2000dc0e 00000000 0000a901 00000000 1df2
ffff8ca190c48b40 2031354466 S Ii:1:066:1 -115:4 64 <
ffff8ca190c48b40 2031366510 C Ii:1:066:1 0:4 18 = 2000dd0e 00000000 0000f601 00000000 43f2
ffff8ca190c48b40 2031366514 S Ii:1:066:1 -115:4 64 <
ffff8ca190c48b40 2031374461 C Ii:1:066:1 0:4 18 = 2000de0e 00000000 00004302 00000000 43f2
ffff8ca190c48b40 2031374466 S Ii:1:066:1 -115:4 64 <
ffff8ca190c48b40 2031386463 C Ii:1:066:1 0:4 18 = 2000df0e 00000000 0000a901 00000000 43f2
ffff8ca190c48b40 2031386467 S Ii:1:066:1 -115:4 64 <
ffff8ca190c48b40 2031394463 C Ii:1:066:1 0:4 18 = 2000e00e 00000000 0000f601 00000000 43f2
ffff8ca190c48b40 2031394467 S Ii:1:066:1 -115:4 64 <
ffff8ca190c48b40 2031406465 C Ii:1:066:1 0:4 18 = 2000e10e 00000000 0000cf01 00000000 6af2
ffff8ca190c48b40 2031406468 S Ii:1:066:1 -115:4 64 <
ffff8ca190c48b40 2031414463 C Ii:1:066:1 0:4 18 = 2000e20e 00000000 00001c02 00000000 1df2
ffff8ca190c48b40 2031414467 S Ii:1:066:1 -115:4 64 <
ffff8ca190c48b40 2031426463 C Ii:1:066:1 0:4 18 = 2000e30e 00000000 00004302 00000000 6af2
ffff8ca190c48b40 2031426469 S Ii:1:066:1 -115:4 64 <
ffff8ca190c48b40 2031434463 C Ii:1:066:1 0:4 18 = 2000e40e 00000000 0000cf01 00000000 43f2
ffff8ca190c48b40 2031434467 S Ii:1:066:1 -115:4 64 <
ffff8ca190c48b40 2031446464 C Ii:1:066:1 0:4 18 = 2000e50e 00000000 0000f601 00000000 6af2
ffff8ca190c48b40 2031446469 S Ii:1:066:1 -115:4 64 <
ffff8ca190c48b40 2031454464 C Ii:1:066:1 0:4 18 = 2000e60e 00000000 0000f601 00000000 43f2
ffff8ca190c48b40 2031454470 S Ii:1:066:1 -115:4 64 <
ffff8ca190c48b40 2031466479 C Ii:1:066:1 0:4 18 = 2000e70e 00000000 00001c02 00000000 6af2
ffff8ca190c48b40 2031466484 S Ii:1:066:1 -115:4 64 <
ffff8ca190c48b40 2031474465 C Ii:1:066:1 0:4 18 = 2000e80e 00000000 0000f601 00000000 1df2
ffff8ca190c48b40 2031474470 S Ii:1:066:1 -115:4 64 <
ffff8ca190c48b40 2031486465 C Ii:1:066:1 0:4 18 = 2000e90e 00000000 0000a901 00000000 1df2
ffff8ca190c48b40 2031486470 S Ii:1:066:1 -115:4 64 <
ffff8ca190c48b40 2031494465 C Ii:1:066:1 0:4 18 = 2000ea0e 00000000 0000f601 00000000 1df2
ffff8ca190c48b40 2031494469 S Ii:1:066:1 -115:4 64 <
ffff8ca190c48b40 2031506467 C Ii:1:066:1 0:4 18 = 2000eb0e 00000000 0000f601 00000000 43f2
ffff8ca190c48b40 2031506471 S Ii:1:066:1 -115:4 64 <
ffff8ca190c48b40 2031514466 C Ii:1:066:1 0:4 18 = 2000ec0e 00000000 00001c02 00000000 43f2
ffff8ca190c48b40 2031514470 S Ii:1:066:1 -115:4 64 <
ffff8ca190c48b40 2031526467 C Ii:1:066:1 0:4 18 = 2000ed0e 00000000 0000f601 00000000 43f2
ffff8ca190c48b40 2031526474 S Ii:1:066:1 -115:4 64 <
ffff8ca190c48b40 2031534466 C Ii:1:066:1 0:4 18 = 2000ee0e 00000000 0000f601 00000000 1df2
ffff8ca190c48b40 2031534471 S Ii:1:066:1 -115:4 64 <
ffff8ca190c48b40 2031546467 C Ii:1:066:1 0:4 18 = 2000ef0e 00000000 0000cf01 00000000 6af2
ffff8ca190c48b40 2031546474 S Ii:1:066:1 -115:4 64 <
ffff8ca190c48b40 2031554467 C Ii:1:066:1 0:4 18 = 2000f00e 00000000 0000f601 00000000 1df2
ffff8ca190c48b40 2031554470 S Ii:1:066:1 -115:4 64 <
ffff8ca190c48b40 2031566468 C Ii:1:066:1 0:4 18 = 2000f10e 00000000 0000f601 00000000 43f2
ffff8ca190c48b40 2031566473 S Ii:1:066:1 -115:4 64 <
ffff8ca190c48b40 2031586469 C Ii:1:066:1 0:4 18 = 2000f20e 00000000 0000f601 00000000 6af2
ffff8ca190c48b40 2031586473 S Ii:1:066:1 -115:4 64 <
ffff8ca190c48b40 2031594469 C Ii:1:066:1 0:4 18 = 2000f30e 00000000 0000f601 00000000 43f2
ffff8ca190c48b40 2031594473 S Ii:1:066:1 -115:4 64 <
ffff8ca190c48b40 2031606470 C Ii:1:066:1 0:4 18 = 2000f40e 00000000 0000cf01 00000000 43f2
ffff8ca190c48b40 2031606474 S Ii:1:066:1 -115:4 64 <
ffff8ca190c48b40 2031634472 C Ii:1:066:1 0:4 18 = 2000f50e 00000000 0000f601 00000000 6af2
ffff8ca190c48b40 2031634479 S Ii:1:066:1 -115:4 64 <
ffff8ca190c48b40 2031646471 C Ii:1:066:1 0:4 18 = 2000f60e 00000000 0000f601 00000000 1df2
ffff8ca190c48b40 2031646475 S Ii:1:066:1 -115:4 64 <
ffff8ca190c48b40 2031654563 C Ii:1:066:1 0:4 18 = 2000f70e 00000000 0000a901 00000000 43f2
ffff8ca190c48b40 2031654570 S Ii:1:066:1 -115:4 64 <
ffff8ca190c48b40 2031666473 C Ii:1:066:1 0:4 18 = 2000f80e 00000000 00001c02 00000000 6af2
ffff8ca190c48b40 2031666479 S Ii:1:066:1 -115:4 64 <
ffff8ca190c48b40 2031674471 C Ii:1:066:1 0:4 18 = 2000f90e 00000000 00001c02 00000000 f6f1
ffff8ca190c48b40 2031674475 S Ii:1:066:1 -115:4 64 <
ffff8ca190c48b40 2031686472 C Ii:1:066:1 0:4 18 = 2000fa0e 00000000 0000f601 00000000 43f2
ffff8ca190c48b40 2031686476 S Ii:1:066:1 -115:4 64 <
ffff8ca190c48b40 2031706475 C Ii:1:066:1 0:4 18 = 2000fb0e 00000000 00001c02 00000000 43f2
ffff8ca190c48b40 2031706480 S Ii:1:066:1 -115:4 64 <
ffff8ca190c48b40 2031714475 C Ii:1:066:1 0:4 18 = 2000fc0e 00000000 0000cf01 00000000 6af2
ffff8ca190c48b40 2031714480 S Ii:1:066:1 -115:4 64 <
ffff8ca190c48b40 2031726474 C Ii:1:066:1 0:4 18 = 2000fd0e 00000000 0000f601 00000000 43f2
ffff8ca190c48b40 2031726482 S Ii:1:066:1 -115:4 64 <
ffff8ca190c48b40 2031734474 C Ii:1:066:1 0:4 18 = 2000fe0e 00000000 0000cf01 00000000 1df2
ffff8ca190c48b40 2031734479 S Ii:1:066:1 -115:4 64 <
ffff8ca190c48b40 2031754844 C Ii:1:066:1 0:4 18 = 2000ff0e 00000000 0000cf01 00000000 6af2
ffff8ca190c48b40 2031754850 S Ii:1:066:1 -115:4 64 <
ffff8ca190c48b40 2031766474 C Ii:1:066:1 0:4 18 = 2000010e 00000000 0000cf01 00000000 43f2
ffff8ca190c48b40 2031766477 S Ii:1:066:1 -115:4 64 <
ffff8ca190c48b40 2031774476 C Ii:1:066:1 0:4 18 = 2000020e 00000000 0000f601 00000000 f6f1
ffff8ca190c48b40 2031774482 S Ii:1:066:1 -115:4 64 <
ffff8ca190c48b40 2031786475 C Ii:1:066:1 0:4 18 = 2000030e 00000000 0000a901 00000000 1df2
ffff8ca190c48b40 2031786481 S Ii:1:066:1 -115:4 64 <
ffff8ca190c48b40 2031794475 C Ii:1:066:1 0:4 18 = 2000040e 00000000 0000cf01 00000000 43f2
ffff8ca190c48b40 2031794480 S Ii:1:066:1 -115:4 64 <
ffff8ca190c48b40 2031806475 C Ii:1:066:1 0:4 18 = 2000050e 00000000 0000cf01 00000000 1df2
ffff8ca190c48b40 2031806481 S Ii:1:066:1 -115:4 64 <
ffff8ca190c48b40 2031814475 C Ii:1:066:1 0:4 18 = 2000060e 00000000 0000cf01 00000000 6af2
ffff8ca190c48b40 2031814478 S Ii:1:066:1 -115:4 64 <
ffff8ca190c48b40 2031826478 C Ii:1:066:1 0:4 18 = 2000070e 00000000 0000f601 00000000 43f2
ffff8ca190c48b40 2031826483 S Ii:1:066:1 -115:4 64 <
ffff8ca190c48b40 2031854764 C Ii:1:066:1 0:4 18 = 2000080e 00000000 0000f601 00000000 f6f1
ffff8ca190c48b40 2031854769 S Ii:1:066:1 -115:4 64 <
ffff8ca190c48b40 2031866516 C Ii:1:066:1 0:4 18 = 2000090e 00000000 0000cf01 00000000 43f2
ffff8ca190c48b40 2031866521 S Ii:1:066:1 -115:4 64 <
ffff8ca190c48b40 2031874479 C Ii:1:066:1 0:4 18 = 20000a0e 00000000 0000a901 00000000 43f2
ffff8ca190c48b40 2031874484 S Ii:1:066:1 -115:4 64 <
ffff8ca190c48b40 2031886479 C Ii:1:066:1 0:4 18 = 20000b0e 00000000 0000f601 00000000 f6f1
ffff8ca190c48b40 2031886483 S Ii:1:066:1 -115:4 64 <
ffff8ca190c48b40 2031894479 C Ii:1:066:1 0:4 18 = 20000c0e 00000000 00004302 00000000 43f2
ffff8ca190c48b40 2031894484 S Ii:1:066:1 -115:4 64 <
ffff8ca190c48b40 2031906479 C Ii:1:066:1 0:4 18 = 20000d0e 00000000 0000f601 00000000 6af2
ffff8ca190c48b40 2031906484 S Ii:1:066:1 -115:4 64 <
ffff8ca190c48b40 2031914482 C Ii:1:066:1 0:4 18 = 20000e0e 00000000 0000f601 00000000 1df2
ffff8ca190c48b40 2031914486 S Ii:1:066:1 -115:4 64 <
ffff8ca64c0c8180 2031921716 S Io:1:101:1 -115:1 32 = 5508c206 0310013d 1a059500 00000000 00000000 00000000 00000000 00000000
ffff8ca64c0c8180 2031922628 C Io:1:101:1 0:1 32 >
ffff8ca190c48b40 2031926480 C Ii:1:066:1 0:4 18 = 20000f0e 00000000 0000a901 00000000 6af2
ffff8ca190c48b40 2031926485 S Ii:1:066:1 -115:4 64 <
ffff8ca190c48b40 2031934480 C Ii:1:066:1 0:4 18 = 2000100e 00000000 0000cf01 00000000 1df2
ffff8ca190c48b40 2031934485 S Ii:1:066:1 -115:4 64 <
ffff8ca64c0c83c0 2031944630 C Ii:1:101:1 0:1 32 = 5501065c 00000000 00000000 00000000 00000000 00000000 00000000 00000000
ffff8ca64c0c8840 2031944724 S Ii:1:101:1 -115:1 32 <
ffff8ca190c48b40 2031946479 C Ii:1:066:1 0:4 18 = 2000110e 00000000 0000f601 00000000 6af2
ffff8ca190c48b40 2031946482 S Ii:1:066:1 -115:4 64 <
ffff8ca190c48b40 2031954544 C Ii:1:066:1 0:4 18 = 2000120e 00000000 0000f601 00000000 43f2
ffff8ca190c48b40 2031954550 S Ii:1:066:1 -115:4 64 <
ffff8ca190c48b40 2031966481 C Ii:1:066:1 0:4 18 = 2000130e 00000000 00006a02 00000000 1df2
ffff8ca190c48b40 2031966485 S Ii:1:066:1 -115:4 64 <
ffff8ca190c48b40 2031974480 C Ii:1:066:1 0:4 18 = 2000140e 00000000 00001c02 00000000 43f2
ffff8ca190c48b40 2031974485 S Ii:1:066:1 -115:4 64 <
ffff8ca190c48b40 2031986482 C Ii:1:066:1 0:4 18 = 2000150e 00000000 0000f601 00000000 1df2
ffff8ca190c48b40 2031986487 S Ii:1:066:1 -115:4 64 <
ffff8ca190c48b40 2031994483 C Ii:1:066:1 0:4 18 = 2000160e 00000000 0000cf01 00000000 6af2
ffff8ca190c48b40 2031994489 S Ii:1:066:1 -115:4 64 <
ffff8ca190c48b40 2032006482 C Ii:1:066:1 0:4 18 = 2000170e 00000000 0000cf01 00000000 f6f1
ffff8ca190c48b40 2032006486 S Ii:1:066:1 -115:4 64 <
ffff8ca190c48b40 2032014483 C Ii:1:066:1 0:4 18 = 2000180e 00000000 0000a901 00000000 f6f1
ffff8ca190c48b40 2032014487 S Ii:1:066:1 -115:4 64 <
ffff8ca190c48b40 2032026483 C Ii:1:066:1 0:4 18 = 2000190e 00000000 0000cf01 00000000 43f2
ffff8ca190c48b40 2032026489 S Ii:1:066:1 -115:4 64 <
ffff8ca190c48b40 2032034483 C Ii:1:066:1 0:4 18 = 20001a0e 00000000 00001c02 00000000 43f2
ffff8ca190c48b40 2032034487 S Ii:1:066:1 -115:4 64 <
ffff8ca190c48b40 2032046484 C Ii:1:066:1 0:4 18 = 20001b0e 00000000 0000f601 00000000 1df2
ffff8ca190c48b40 2032046490 S Ii:1:066:1 -115:4 64 <
ffff8ca190c48b40 2032055017 C Ii:1:066:1 0:4 18 = 20001c0e 00000000 0000f601 00000000 43f2
ffff8ca190c48b40 2032055021 S Ii:1:066:1 -115:4 64 <
ffff8ca190c48b40 2032066715 C Ii:1:066:1 0:4 18 = 20001d0e 00000000 0000cf01 00000000 f6f1
ffff8ca190c48b40 2032066719 S Ii:1:066:1 -115:4 64 <
ffff8ca190c48b40 2032074485 C Ii:1:066:1 0:4 18 = 20001e0e 00000000 0000f601 00000000 43f2
ffff8ca190c48b40 2032074489 S Ii:1:066:1 -115:4 64 <
ffff8ca190c48b40 2032086486 C Ii:1:066:1 0:4 18 = 20001f0e 00000000 0000cf01 00000000 43f2
ffff8ca190c48b40 2032086491 S Ii:1:066:1 -115:4 64 <
ffff8ca190c48b40 2032094485 C Ii:1:066:1 0:4 18 = 2000200e 00000000 00008201 00000000 43f2
ffff8ca190c48b40 2032094489 S Ii:1:066:1 -115:4 64 <
ffff8ca190c48b40 2032106485 C Ii:1:066:1 0:4 18 = 2000210e 00000000 0000cf01 00000000 6af2
ffff8ca190c48b40 2032106490 S Ii:1:066:1 -115:4 64 <
ffff8ca190c48b40 2032114487 C Ii:1:066:1 0:4 18 = 2000220e 00000000 0000f601 00000000 6af2
ffff8ca190c48b40 2032114491 S Ii:1:066:1 -115:4 64 <
ffff8ca190c48b40 2032126487 C Ii:1:066:1 0:4 18 = 2000230e 00000000 0000cf01 00000000 6af2
ffff8ca190c48b40 2032126491 S Ii:1:066:1 -115:4 64 <
ffff8ca190c48b40 2032134487 C Ii:1:066:1 0:4 18 = 2000240e 00000000 0000f601 00000000 6af2
ffff8ca190c48b40 2032134492 S Ii:1:066:1 -115:4 64 <
ffff8ca190c48b40 2032146486 C Ii:1:066:1 0:4 18 = 2000250e 00000000 00001c02 00000000 43f2
ffff8ca190c48b40 2032146490 S Ii:1:066:1 -115:4 64 <
ffff8ca190c48b40 2032166628 C Ii:1:066:1 0:4 18 = 2000260e 00000000 0000cf01 00000000 43f2
ffff8ca190c48b40 2032166633 S Ii:1:066:1 -115:4 64 <
ffff8ca190c48b40 2032174491 C Ii:1:066:1 0:4 18 = 2000270e 00000000 0000f601 00000000 6af2
ffff8ca190c48b40 2032174497 S Ii:1:066:1 -115:4 64 <
ffff8ca190c48b40 2032186489 C Ii:1:066:1 0:4 18 = 2000280e 00000000 00004302 00000000 43f2
ffff8ca190c48b40 2032186495 S Ii:1:066:1 -115:4 64 <
ffff8ca190c48b40 2032194490 C Ii:1:066:1 0:4 18 = 2000290e 00000000 00001c02 00000000 1df2
ffff8ca190c48b40 2032194500 S Ii:1:066:1 -115:4 64 <
ffff8ca190c48b40 2032214489 C Ii:1:066:1 0:4 18 = 20002a0e 00000000 0000a901 00000000 91f2
ffff8ca190c48b40 2032214494 S Ii:1:066:1 -115:4 64 <
ffff8ca190c48b40 2032226491 C Ii:1:066:1 0:4 18 = 20002b0e 00000000 0000cf01 00000000 43f2
ffff8ca190c48b40 2032226496 S Ii:1:066:1 -115:4 64 <
ffff8ca190c48b40 2032234490 C Ii:1:066:1 0:4 18 = 20002c0e 00000000 0000cf01 00000000 91f2
ffff8ca190c48b40 2032234494 S Ii:1:066:1 -115:4 64 <
ffff8ca190c48b40 2032246490 C Ii:1:066:1 0:4 18 = 20002d0e 00000000 00001c02 00000000 1df2
ffff8ca190c48b40 2032246494 S Ii:1:066:1 -115:4 64 <
ffff8ca190c48b40 2032266491 C Ii:1:066:1 0:4 18 = 20002e0e 00000000 0000f601 00000000 6af2
ffff8ca190c48b40 2032266496 S Ii:1:066:1 -115:4 64 <
ffff8ca190c48b40 2032274491 C Ii:1:066:1 0:4 18 = 20002f0e 00000000 00001c02 00000000 43f2
ffff8ca190c48b40 2032274495 S Ii:1:066:1 -115:4 64 <
ffff8ca190c48b40 2032286492 C Ii:1:066:1 0:4 18 = 2000300e 00000000 0000f601 00000000 43f2
ffff8ca190c48b40 2032286498 S Ii:1:066:1 -115:4 64 <
ffff8ca190c48b40 2032294492 C Ii:1:066:1 0:4 18 = 2000310e 00000000 0000cf01 00000000 43f2
ffff8ca190c48b40 2032294497 S Ii:1:066:1 -115:4 64 <
ffff8ca190c48b40 2032306491 C Ii:1:066:1 0:4 18 = 2000320e 00000000 0000cf01 00000000 6af2
ffff8ca190c48b40 2032306496 S Ii:1:066:1 -115:4 64 <
ffff8ca190c48b40 2032314491 C Ii:1:066:1 0:4 18 = 2000330e 00000000 0000cf01 00000000 1df2
ffff8ca190c48b40 2032314494 S Ii:1:066:1 -115:4 64 <
ffff8ca190c48b40 2032326494 C Ii:1:066:1 0:4 18 = 2000340e 00000000 0000a901 00000000 1df2
ffff8ca190c48b40 2032326499 S Ii:1:066:1 -115:4 64 <
ffff8ca190c48b40 2032334631 C Ii:1:066:1 0:4 18 = 2000350e 00000000 0000f601 00000000 1df2
ffff8ca190c48b40 2032334635 S Ii:1:066:1 -115:4 64 <
ffff8ca190c48b40 2032346493 C Ii:1:066:1 0:4 18 = 2000360e 00000000 00004302 00000000 43f2
ffff8ca190c48b40 2032346496 S Ii:1:066:1 -115:4 64 <
ffff8ca190c48b40 2032354558 C Ii:1:066:1 0:4 18 = 2000370e 00000000 0000f601 00000000 1df2
ffff8ca190c48b40 2032354564 S Ii:1:066:1 -115:4 64 <
ffff8ca190c48b40 2032366494 C Ii:1:066:1 0:4 18 = 2000380e 00000000 0000f601 00000000 43f2
ffff8ca190c48b40 2032366499 S Ii:1:066:1 -115:4 64 <
ffff8ca190c48b40 2032386495 C Ii:1:066:1 0:4 18 = 2000390e 00000000 00001c02 00000000 6af2
ffff8ca190c48b40 2032386499 S Ii:1:066:1 -115:4 64 <
ffff8ca190c48b40 2032394494 C Ii:1:066:1 0:4 18 = 20003a0e 00000000 0000f601 00000000 43f2
ffff8ca190c48b40 2032394499 S Ii:1:066:1 -115:4 64 <
ffff8ca190c48b40 2032406495 C Ii:1:066:1 0:4 18 = 20003b0e 00000000 0000f601 00000000 1df2
ffff8ca190c48b40 2032406499 S Ii:1:066:1 -115:4 64 <
ffff8ca190c48b40 2032414495 C Ii:1:066:1 0:4 18 = 20003c0e 00000000 0000cf01 00000000 43f2
ffff8ca190c48b40 2032414499 S Ii:1:066:1 -115:4 64 <
ffff8ca190c48b40 2032426497 C Ii:1:066:1 0:4 18 = 20003d0e 00000000 0000f601 00000000 43f2
ffff8ca190c48b40 2032426502 S Ii:1:066:1 -115:4 64 <
ffff8ca190c48b40 2032434496 C Ii:1:066:1 0:4 18 = 20003e0e 00000000 00001c02 00000000 f6f1
ffff8ca190c48b40 2032434500 S Ii:1:066:1 -115:4 64 <
ffff8ca190c48b40 2032446497 C Ii:1:066:1 0:4 18 = 20003f0e 00000000 0000cf01 00000000 f6f1
ffff8ca190c48b40 2032446501 S Ii:1:066:1 -115:4 64 <
ffff8ca21d61de40 2032454643 S Io:1:101:1 -115:1 32 = 5508c207 031001f4 6916ad00 00000000 00000000 00000000 00000000 00000000
ffff8ca190c48b40 2032454712 C Ii:1:066:1 0:4 18 = 2000400e 00000000 0000cf01 00000000 43f2
ffff8ca190c48b40 2032454715 S Ii:1:066:1 -115:4 64 <
ffff8ca21d61de40 2032455642 C Io:1:101:1 0:1 32 >
ffff8ca64c0c8840 2032475645 C Ii:1:101:1 0:1 32 = 5501075d 00000000 00000000 00000000 00000000 00000000 00000000 00000000
ffff8ca19382d780 2032476155 S Ii:1:101:1 -115:1 32 <
ffff8ca190c48b40 2032486499 C Ii:1:066:1 0:4 18 = 2000410e 00000000 0000f601 00000000 43f2
ffff8ca190c48b40 2032486504 S Ii:1:066:1 -115:4 64 <
ffff8ca190c48b40 2032494499 C Ii:1:066:1 0:4 18 = 2000420e 00000000 0000f601 00000000 6af2
ffff8ca190c48b40 2032494505 S Ii:1:066:1 -115:4 64 <
ffff8ca190c48b40 2032506498 C Ii:1:066:1 0:4 18 = 2000430e 00000000 00001c02 00000000 43f2
ffff8ca190c48b40 2032506503 S Ii:1:066:1 -115:4 64 <
ffff8ca190c48b40 2032514499 C Ii:1:066:1 0:4 18 = 2000440e 00000000 0000cf01 00000000 6af2
ffff8ca190c48b40 2032514504 S Ii:1:066:1 -115:4 64 <
ffff8ca18f245600 2032521228 S Co:1:001:0 s 23 03 0002 0009 0000 0
ffff8ca18f245600 2032533018 C Co:1:001:0 0 0
ffff8ca190c48b40 2032534711 C Ii:1:066:1 0:4 18 = 2000450e 00000000 0000f601 00000000 6af2
ffff8ca190c48b40 2032534716 S Ii:1:066:1 -115:4 64 <
ffff8ca190c48b40 2032546500 C Ii:1:066:1 0:4 18 = 2000460e 00000000 0000cf01 00000000 43f2
ffff8ca190c48b40 2032546504 S Ii:1:066:1 -115:4 64 <
ffff8ca190c48b40 2032554764 C Ii:1:066:1 0:4 18 = 2000470e 00000000 0000f601 00000000 f6f1
ffff8ca190c48b40 2032554767 S Ii:1:066:1 -115:4 64 <
ffff8ca190c48b40 2032566500 C Ii:1:066:1 0:4 18 = 2000480e 00000000 0000cf01 00000000 43f2
ffff8ca190c48b40 2032566509 S Ii:1:066:1 -115:4 64 <
ffff8ca190c48b40 2032574501 C Ii:1:066:1 0:4 18 = 2000490e 00000000 0000cf01 00000000 1df2
ffff8ca190c48b40 2032574506 S Ii:1:066:1 -115:4 64 <
ffff8ca190c48b40 2032586500 C Ii:1:066:1 0:4 18 = 20004a0e 00000000 00004302 00000000 43f2
ffff8ca190c48b40 2032586505 S Ii:1:066:1 -115:4 64 <
ffff8ca190c48b40 2032594501 C Ii:1:066:1 0:4 18 = 20004b0e 00000000 0000cf01 00000000 43f2
ffff8ca190c48b40 2032594505 S Ii:1:066:1 -115:4 64 <
ffff8ca190c48b40 2032606501 C Ii:1:066:1 0:4 18 = 20004c0e 00000000 0000f601 00000000 6af2
ffff8ca190c48b40 2032606505 S Ii:1:066:1 -115:4 64 <
ffff8ca190c48b40 2032626503 C Ii:1:066:1 0:4 18 = 20004d0e 00000000 0000f601 00000000 1df2
ffff8ca190c48b40 2032626509 S Ii:1:066:1 -115:4 64 <
ffff8ca190c48b40 2032634502 C Ii:1:066:1 0:4 18 = 20004e0e 00000000 0000f601 00000000 43f2
ffff8ca190c48b40 2032634505 S Ii:1:066:1 -115:4 64 <
ffff8ca190c48b40 2032654635 C Ii:1:066:1 0:4 18 = 20004f0e 00000000 0000cf01 00000000 6af2
ffff8ca190c48b40 2032654639 S Ii:1:066:1 -115:4 64 <
ffff8ca190c48b40 2032662504 C Ii:1:066:1 0:4 18 = 2000500e 00000000 00001c02 00000000 1df2
ffff8ca190c48b40 2032662509 S Ii:1:066:1 -115:4 64 <
ffff8ca190c48b40 2032674508 C Ii:1:066:1 0:4 18 = 2000510e 00000000 0000f601 00000000 43f2
ffff8ca190c48b40 2032674513 S Ii:1:066:1 -115:4 64 <
ffff8ca190c48b40 2032686504 C Ii:1:066:1 0:4 18 = 2000520e 00000000 0000a901 00000000 43f2
ffff8ca190c48b40 2032686507 S Ii:1:066:1 -115:4 64 <
ffff8ca190c48b40 2032694505 C Ii:1:066:1 0:4 18 = 2000530e 00000000 0000f601 00000000 43f2
ffff8ca190c48b40 2032694510 S Ii:1:066:1 -115:4 64 <
ffff8ca190c48b40 2032706505 C Ii:1:066:1 0:4 18 = 2000540e 00000000 0000cf01 00000000 1df2
ffff8ca190c48b40 2032706510 S Ii:1:066:1 -115:4 64 <
ffff8ca190c48b40 2032714505 C Ii:1:066:1 0:4 18 = 2000550e 00000000 0000f601 00000000 6af2
ffff8ca190c48b40 2032714509 S Ii:1:066:1 -115:4 64 <
ffff8ca190c48b40 2032734505 C Ii:1:066:1 0:4 18 = 2000560e 00000000 0000f601 00000000 1df2
ffff8ca190c48b40 2032734510 S Ii:1:066:1 -115:4 64 <
ffff8ca190c48b40 2032746506 C Ii:1:066:1 0:4 18 = 2000570e 00000000 00001c02 00000000 f6f1
ffff8ca190c48b40 2032746511 S Ii:1:066:1 -115:4 64 <
ffff8ca190c48b40 2032754754 C Ii:1:066:1 0:4 18 = 2000580e 00000000 0000f601 00000000 43f2
ffff8ca190c48b40 2032754759 S Ii:1:066:1 -115:4 64 <
ffff8ca190c48b40 2032766514 C Ii:1:066:1 0:4 18 = 2000590e 00000000 00001c02 00000000 f6f1
ffff8ca190c48b40 2032766518 S Ii:1:066:1 -115:4 64 <
ffff8ca190c48b40 2032774508 C Ii:1:066:1 0:4 18 = 20005a0e 00000000 0000f601 00000000 1df2
ffff8ca190c48b40 2032774512 S Ii:1:066:1 -115:4 64 <
ffff8ca190c48b40 2032786508 C Ii:1:066:1 0:4 18 = 20005b0e 00000000 0000f601 00000000 f6f1
ffff8ca190c48b40 2032786512 S Ii:1:066:1 -115:4 64 <
ffff8ca190c48b40 2032794508 C Ii:1:066:1 0:4 18 = 20005c0e 00000000 00001c02 00000000 1df2
ffff8ca190c48b40 2032794513 S Ii:1:066:1 -115:4 64 <
ffff8ca190c48b40 2032806509 C Ii:1:066:1 0:4 18 = 20005d0e 00000000 0000f601 00000000 6af2
ffff8ca190c48b40 2032806513 S Ii:1:066:1 -115:4 64 <
ffff8ca190c48b40 2032814508 C Ii:1:066:1 0:4 18 = 20005e0e 00000000 0000f601 00000000 1df2
ffff8ca190c48b40 2032814512 S Ii:1:066:1 -115:4 64 <
ffff8ca190c48b40 2032826509 C Ii:1:066:1 0:4 18 = 20005f0e 00000000 0000cf01 00000000 43f2
ffff8ca190c48b40 2032826516 S Ii:1:066:1 -115:4 64 <
ffff8ca190c48b40 2032834820 C Ii:1:066:1 0:4 18 = 2000600e 00000000 0000f601 00000000 f6f1
ffff8ca190c48b40 2032834824 S Ii:1:066:1 -115:4 64 <
ffff8ca190c48b40 2032846510 C Ii:1:066:1 0:4 18 = 2000610e 00000000 0000cf01 00000000 f6f1
ffff8ca190c48b40 2032846514 S Ii:1:066:1 -115:4 64 <
ffff8ca190c48b40 2032854746 C Ii:1:066:1 0:4 18 = 2000620e 00000000 0000f601 00000000 43f2
ffff8ca190c48b40 2032854751 S Ii:1:066:1 -115:4 64 <
ffff8ca190c48b40 2032866510 C Ii:1:066:1 0:4 18 = 2000630e 00000000 0000cf01 00000000 43f2
ffff8ca190c48b40 2032866516 S Ii:1:066:1 -115:4 64 <
ffff8ca190c48b40 2032874510 C Ii:1:066:1 0:4 18 = 2000640e 00000000 0000f601 00000000 43f2
ffff8ca190c48b40 2032874516 S Ii:1:066:1 -115:4 64 <
ffff8ca190c48b40 2032886511 C Ii:1:066:1 0:4 18 = 2000650e 00000000 0000f601 00000000 1df2
ffff8ca190c48b40 2032886516 S Ii:1:066:1 -115:4 64 <
ffff8ca190c48b40 2032894511 C Ii:1:066:1 0:4 18 = 2000660e 00000000 00001c02 00000000 43f2
ffff8ca190c48b40 2032894515 S Ii:1:066:1 -115:4 64 <
ffff8ca190c48b40 2032906511 C Ii:1:066:1 0:4 18 = 2000670e 00000000 0000f601 00000000 43f2
ffff8ca190c48b40 2032906515 S Ii:1:066:1 -115:4 64 <
ffff8ca190c48b40 2032914513 C Ii:1:066:1 0:4 18 = 2000680e 00000000 0000cf01 00000000 43f2
ffff8ca190c48b40 2032914516 S Ii:1:066:1 -115:4 64 <
ffff8ca190c48b40 2032926512 C Ii:1:066:1 0:4 18 = 2000690e 00000000 0000f601 00000000 1df2
ffff8ca190c48b40 2032926517 S Ii:1:066:1 -115:4 64 <
ffff8ca190c48b40 2032934839 C Ii:1:066:1 0:4 18 = 20006a0e 00000000 00001c02 00000000 1df2
ffff8ca190c48b40 2032934842 S Ii:1:066:1 -115:4 64 <
ffff8ca190c48b40 2032946512 C Ii:1:066:1 0:4 18 = 20006b0e 00000000 0000cf01 00000000 43f2
ffff8ca190c48b40 2032946515 S Ii:1:066:1 -115:4 64 <
ffff8ca190c48b40 2032954651 C Ii:1:066:1 0:4 18 = 20006c0e 00000000 0000f601 00000000 1df2
ffff8ca190c48b40 2032954656 S Ii:1:066:1 -115:4 64 <
ffff8ca190c48b40 2032974513 C Ii:1:066:1 0:4 18 = 20006d0e 00000000 0000f601 00000000 6af2
ffff8ca190c48b40 2032974518 S Ii:1:066:1 -115:4 64 <
ffff8ca190c48b40 2032986513 C Ii:1:066:1 0:4 18 = 20006e0e 00000000 0000f601 00000000 1df2
ffff8ca190c48b40 2032986517 S Ii:1:066:1 -115:4 64 <
ffff8ca190c48b40 2032994515 C Ii:1:066:1 0:4 18 = 20006f0e 00000000 00001c02 00000000 6af2
ffff8ca190c48b40 2032994520 S Ii:1:066:1 -115:4 64 <
ffff8ca190c48b40 2033006515 C Ii:1:066:1 0:4 18 = 2000700e 00000000 00001c02 00000000 43f2
ffff8ca190c48b40 2033006519 S Ii:1:066:1 -115:4 64 <
ffff8ca190c48b40 2033014515 C Ii:1:066:1 0:4 18 = 2000710e 00000000 0000f601 00000000 6af2
ffff8ca190c48b40 2033014519 S Ii:1:066:1 -115:4 64 <
ffff8ca18a773600 2033021229 S Io:1:101:1 -115:1 32 = 5508c208 0310013d 1a059700 00000000 00000000 00000000 00000000 00000000
ffff8ca18a773600 2033021662 C Io:1:101:1 0:1 32 >
ffff8ca190c48b40 2033026515 C Ii:1:066:1 0:4 18 = 2000720e 00000000 00004302 00000000 1df2
ffff8ca190c48b40 2033026519 S Ii:1:066:1 -115:4 64 <
ffff8ca190c48b40 2033034516 C Ii:1:066:1 0:4 18 = 2000730e 00000000 0000f601 00000000 43f2
ffff8ca190c48b40 2033034522 S Ii:1:066:1 -115:4 64 <
ffff8ca19382d780 2033045664 C Ii:1:101:1 0:1 32 = 5501085e 00000000 00000000 00000000 00000000 00000000 00000000 00000000
ffff8ca19382df00 2033046493 S Ii:1:101:1 -115:1 32 <
ffff8ca190c48b40 2033054749 C Ii:1:066:1 0:4 18 = 2000740e 00000000 00004302 00000000 1df2
ffff8ca190c48b40 2033054753 S Ii:1:066:1 -115:4 64 <
ffff8ca190c48b40 2033066516 C Ii:1:066:1 0:4 18 = 2000750e 00000000 0000cf01 00000000 43f2
ffff8ca190c48b40 2033066522 S Ii:1:066:1 -115:4 64 <
ffff8ca190c48b40 2033074517 C Ii:1:066:1 0:4 18 = 2000760e 00000000 0000f601 00000000 1df2
ffff8ca190c48b40 2033074524 S Ii:1:066:1 -115:4 64 <
ffff8ca190c48b40 2033086517 C Ii:1:066:1 0:4 18 = 2000770e 00000000 0000f601 00000000 6af2
ffff8ca190c48b40 2033086522 S Ii:1:066:1 -115:4 64 <
ffff8ca190c48b40 2033094518 C Ii:1:066:1 0:4 18 = 2000780e 00000000 0000cf01 00000000 1df2
ffff8ca190c48b40 2033094526 S Ii:1:066:1 -115:4 64 <
ffff8ca190c48b40 2033106517 C Ii:1:066:1 0:4 18 = 2000790e 00000000 0000cf01 00000000 6af2
ffff8ca190c48b40 2033106521 S Ii:1:066:1 -115:4 64 <
ffff8ca190c48b40 2033114518 C Ii:1:066:1 0:4 18 = 20007a0e 00000000 0000f601 00000000 f6f1
ffff8ca190c48b40 2033114523 S Ii:1:066:1 -115:4 64 <
ffff8ca190c48b40 2033126519 C Ii:1:066:1 0:4 18 = 20007b0e 00000000 0000f601 00000000 1df2
ffff8ca190c48b40 2033126526 S Ii:1:066:1 -115:4 64 <
ffff8ca190c48b40 2033134658 C Ii:1:066:1 0:4 18 = 20007c0e 00000000 00001c02 00000000 43f2
ffff8ca190c48b40 2033134664 S Ii:1:066:1 -115:4 64 <
ffff8ca190c48b40 2033146519 C Ii:1:066:1 0:4 18 = 20007d0e 00000000 0000cf01 00000000 f6f1
ffff8ca190c48b40 2033146526 S Ii:1:066:1 -115:4 64 <
ffff8ca190c48b40 2033166521 C Ii:1:066:1 0:4 18 = 20007e0e 00000000 0000cf01 00000000 1df2
ffff8ca190c48b40 2033166529 S Ii:1:066:1 -115:4 64 <
ffff8ca190c48b40 2033174520 C Ii:1:066:1 0:4 18 = 20007f0e 00000000 0000f601 00000000 6af2
ffff8ca190c48b40 2033174526 S Ii:1:066:1 -115:4 64 <
ffff8ca190c48b40 2033186521 C Ii:1:066:1 0:4 18 = 2000800e 00000000 0000f601 00000000 1df2
ffff8ca190c48b40 2033186528 S Ii:1:066:1 -115:4 64 <
ffff8ca190c48b40 2033194522 C Ii:1:066:1 0:4 18 = 2000810e 00000000 0000cf01 00000000 6af2
ffff8ca190c48b40 2033194527 S Ii:1:066:1 -115:4 64 <
ffff8ca190c48b40 2033226524 C Ii:1:066:1 0:4 18 = 2000820e 00000000 0000a901 00000000 f6f1
ffff8ca190c48b40 2033226530 S Ii:1:066:1 -115:4 64 <
ffff8ca190c48b40 2033234521 C Ii:1:066:1 0:4 18 = 2000830e 00000000 0000cf01 00000000 1df2
ffff8ca190c48b40 2033234525 S Ii:1:066:1 -115:4 64 <
ffff8ca190c48b40 2033254626 C Ii:1:066:1 0:4 18 = 2000840e 00000000 00001c02 00000000 43f2
ffff8ca190c48b40 2033254635 S Ii:1:066:1 -115:4 64 <
ffff8ca190c48b40 2033266523 C Ii:1:066:1 0:4 18 = 2000850e 00000000 0000cf01 00000000 1df2
ffff8ca190c48b40 2033266527 S Ii:1:066:1 -115:4 64 <
ffff8ca190c48b40 2033274524 C Ii:1:066:1 0:4 18 = 2000860e 00000000 0000cf01 00000000 43f2
ffff8ca190c48b40 2033274529 S Ii:1:066:1 -115:4 64 <
ffff8ca190c48b40 2033286524 C Ii:1:066:1 0:4 18 = 2000870e 00000000 0000f601 00000000 43f2
ffff8ca190c48b40 2033286530 S Ii:1:066:1 -115:4 64 <
ffff8ca190c48b40 2033294524 C Ii:1:066:1 0:4 18 = 2000880e 00000000 0000f601 00000000 6af2
ffff8ca190c48b40 2033294529 S Ii:1:066:1 -115:4 64 <
ffff8ca190c48b40 2033302524 C Ii:1:066:1 0:4 18 = 2000890e 00000000 0000f601 00000000 43f2
ffff8ca190c48b40 2033302528 S Ii:1:066:1 -115:4 64 <
ffff8ca190c48b40 2033314524 C Ii:1:066:1 0:4 18 = 20008a0e 00000000 0000a901 00000000 1df2
ffff8ca190c48b40 2033314528 S Ii:1:066:1 -115:4 64 <
ffff8ca190c48b40 2033326525 C Ii:1:066:1 0:4 18 = 20008b0e 00000000 0000f601 00000000 43f2
ffff8ca190c48b40 2033326531 S Ii:1:066:1 -115:4 64 <
ffff8ca190c48b40 2033334525 C Ii:1:066:1 0:4 18 = 20008c0e 00000000 0000f601 00000000 1df2
ffff8ca190c48b40 2033334528 S Ii:1:066:1 -115:4 64 <
ffff8ca190c48b40 2033346525 C Ii:1:066:1 0:4 18 = 20008d0e 00000000 0000cf01 00000000 6af2
ffff8ca190c48b40 2033346529 S Ii:1:066:1 -115:4 64 <
ffff8ca190c48b40 2033354622 C Ii:1:066:1 0:4 18 = 20008e0e 00000000 0000f601 00000000 43f2
ffff8ca190c48b40 2033354626 S Ii:1:066:1 -115:4 64 <
ffff8ca190c48b40 2033366739 C Ii:1:066:1 0:4 18 = 20008f0e 00000000 0000f601 00000000 f6f1
ffff8ca190c48b40 2033366743 S Ii:1:066:1 -115:4 64 <
ffff8ca190c48b40 2033374525 C Ii:1:066:1 0:4 18 = 2000900e 00000000 0000cf01 00000000 43f2
ffff8ca190c48b40 2033374529 S Ii:1:066:1 -115:4 64 <
ffff8ca190c48b40 2033386527 C Ii:1:066:1 0:4 18 = 2000910e 00000000 0000cf01 00000000 6af2
ffff8ca190c48b40 2033386531 S Ii:1:066:1 -115:4 64 <
ffff8ca190c48b40 2033394528 C Ii:1:066:1 0:4 18 = 2000920e 00000000 0000f601 00000000 1df2
ffff8ca190c48b40 2033394533 S Ii:1:066:1 -115:4 64 <
ffff8ca190c48b40 2033406527 C Ii:1:066:1 0:4 18 = 2000930e 00000000 0000a901 00000000 6af2
ffff8ca190c48b40 2033406531 S Ii:1:066:1 -115:4 64 <
ffff8ca190c48b40 2033414528 C Ii:1:066:1 0:4 18 = 2000940e 00000000 0000f601 00000000 43f2
ffff8ca190c48b40 2033414532 S Ii:1:066:1 -115:4 64 <
ffff8ca190c48b40 2033426529 C Ii:1:066:1 0:4 18 = 2000950e 00000000 0000cf01 00000000 6af2
ffff8ca190c48b40 2033426534 S Ii:1:066:1 -115:4 64 <
ffff8ca190c48b40 2033434528 C Ii:1:066:1 0:4 18 = 2000960e 00000000 0000f601 00000000 43f2
ffff8ca190c48b40 2033434531 S Ii:1:066:1 -115:4 64 <
ffff8ca190c48b40 2033446528 C Ii:1:066:1 0:4 18 = 2000970e 00000000 0000cf01 00000000 6af2
ffff8ca190c48b40 2033446533 S Ii:1:066:1 -115:4 64 <
ffff8ca190c48b40 2033454654 C Ii:1:066:1 0:4 18 = 2000980e 00000000 0000cf01 00000000 1df2
ffff8ca190c48b40 2033454660 S Ii:1:066:1 -115:4 64 <
ffff8ca190c48b40 2033462529 C Ii:1:066:1 0:4 18 = 2000990e 00000000 0000f601 00000000 f6f1
ffff8ca190c48b40 2033462533 S Ii:1:066:1 -115:4 64 <
ffff8ca190c48b40 2033474530 C Ii:1:066:1 0:4 18 = 20009a0e 00000000 0000a901 00000000 43f2
ffff8ca190c48b40 2033474534 S Ii:1:066:1 -115:4 64 <
ffff8ca190c48b40 2033486529 C Ii:1:066:1 0:4 18 = 20009b0e 00000000 00001c02 00000000 1df2
ffff8ca190c48b40 2033486533 S Ii:1:066:1 -115:4 64 <
ffff8ca190c48b40 2033494531 C Ii:1:066:1 0:4 18 = 20009c0e 00000000 0000a901 00000000 6af2
ffff8ca190c48b40 2033494535 S Ii:1:066:1 -115:4 64 <
ffff8ca190c48b40 2033506530 C Ii:1:066:1 0:4 18 = 20009d0e 00000000 0000cf01 00000000 1df2
ffff8ca190c48b40 2033506534 S Ii:1:066:1 -115:4 64 <
ffff8ca190c48b40 2033514534 C Ii:1:066:1 0:4 18 = 20009e0e 00000000 0000cf01 00000000 6af2
ffff8ca190c48b40 2033514537 S Ii:1:066:1 -115:4 64 <
ffff8ca190c48b40 2033522532 C Ii:1:066:1 0:4 18 = 20009f0e 00000000 0000f601 00000000 6af2
ffff8ca190c48b40 2033522536 S Ii:1:066:1 -115:4 64 <
ffff8ca190c48b40 2033534534 C Ii:1:066:1 0:4 18 = 2000a00e 00000000 0000f601 00000000 43f2
ffff8ca190c48b40 2033534538 S Ii:1:066:1 -115:4 64 <
ffff8ca190c48b40 2033554863 C Ii:1:066:1 0:4 18 = 2000a10e 00000000 0000f601 00000000 91f2
ffff8ca190c48b40 2033554867 S Ii:1:066:1 -115:4 64 <
ffff8ca190c48b40 2033562533 C Ii:1:066:1 0:4 18 = 2000a20e 00000000 0000cf01 00000000 1df2
ffff8ca190c48b40 2033562537 S Ii:1:066:1 -115:4 64 <
ffff8ca190c48b40 2033574533 C Ii:1:066:1 0:4 18 = 2000a30e 00000000 00001c02 00000000 6af2
ffff8ca190c48b40 2033574538 S Ii:1:066:1 -115:4 64 <
ffff8ca190c48b40 2033586535 C Ii:1:066:1 0:4 18 = 2000a40e 00000000 0000f601 00000000 91f2
ffff8ca190c48b40 2033586540 S Ii:1:066:1 -115:4 64 <
ffff8ca190c48b40 2033594534 C Ii:1:066:1 0:4 18 = 2000a50e 00000000 0000cf01 00000000 1df2
ffff8ca190c48b40 2033594539 S Ii:1:066:1 -115:4 64 <
ffff8ca190c48b40 2033606535 C Ii:1:066:1 0:4 18 = 2000a60e 00000000 0000f601 00000000 f6f1
ffff8ca190c48b40 2033606539 S Ii:1:066:1 -115:4 64 <
ffff8ca18f245600 2033621422 S Io:1:101:1 -115:1 32 = 5508c209 031001f4 6916af00 00000000 00000000 00000000 00000000 00000000
ffff8ca18f245600 2033621682 C Io:1:101:1 0:1 32 >
ffff8ca190c48b40 2033622536 C Ii:1:066:1 0:4 18 = 2000a70e 00000000 0000f601 00000000 43f2
ffff8ca190c48b40 2033622541 S Ii:1:066:1 -115:4 64 <
ffff8ca190c48b40 2033634696 C Ii:1:066:1 0:4 18 = 2000a80e 00000000 0000f601 00000000 1df2
ffff8ca190c48b40 2033634701 S Ii:1:066:1 -115:4 64 <
ffff8ca19382df00 2033652683 C Ii:1:101:1 0:1 32 = 5501095f 00000000 00000000 00000000 00000000 00000000 00000000 00000000
ffff8ca19382dcc0 2033652752 S Ii:1:101:1 -115:1 32 <
ffff8ca190c48b40 2033654614 C Ii:1:066:1 0:4 18 = 2000a90e 00000000 0000f601 00000000 91f2
ffff8ca190c48b40 2033654619 S Ii:1:066:1 -115:4 64 <
ffff8ca190c48b40 2033662536 C Ii:1:066:1 0:4 18 = 2000aa0e 00000000 0000cf01 00000000 1df2
ffff8ca190c48b40 2033662541 S Ii:1:066:1 -115:4 64 <
ffff8ca190c48b40 2033674537 C Ii:1:066:1 0:4 18 = 2000ab0e 00000000 0000f601 00000000 1df2
ffff8ca190c48b40 2033674541 S Ii:1:066:1 -115:4 64 <
ffff8ca190c48b40 2033686536 C Ii:1:066:1 0:4 18 = 2000ac0e 00000000 0000cf01 00000000 43f2
ffff8ca190c48b40 2033686540 S Ii:1:066:1 -115:4 64 <
ffff8ca190c48b40 2033694536 C Ii:1:066:1 0:4 18 = 2000ad0e 00000000 0000f601 00000000 43f2
ffff8ca190c48b40 2033694541 S Ii:1:066:1 -115:4 64 <
ffff8ca190c48b40 2033706537 C Ii:1:066:1 0:4 18 = 2000ae0e 00000000 0000cf01 00000000 6af2
ffff8ca190c48b40 2033706543 S Ii:1:066:1 -115:4 64 <
ffff8ca190c48b40 2033714537 C Ii:1:066:1 0:4 18 = 2000af0e 00000000 0000cf01 00000000 43f2
ffff8ca190c48b40 2033714541 S Ii:1:066:1 -115:4 64 <
ffff8ca190c48b40 2033734540 C Ii:1:066:1 0:4 18 = 2000b00e 00000000 00001c02 00000000 43f2
ffff8ca190c48b40 2033734546 S Ii:1:066:1 -115:4 64 <
ffff8ca190c48b40 2033746539 C Ii:1:066:1 0:4 18 = 2000b10e 00000000 0000a901 00000000 6af2
ffff8ca190c48b40 2033746543 S Ii:1:066:1 -115:4 64 <
ffff8ca190c48b40 2033754643 C Ii:1:066:1 0:4 18 = 2000b20e 00000000 0000cf01 00000000 f6f1
ffff8ca190c48b40 2033754648 S Ii:1:066:1 -115:4 64 <
ffff8ca190c48b40 2033762539 C Ii:1:066:1 0:4 18 = 2000b30e 00000000 0000a901 00000000 43f2
ffff8ca190c48b40 2033762543 S Ii:1:066:1 -115:4 64 <
ffff8ca190c48b40 2033774540 C Ii:1:066:1 0:4 18 = 2000b40e 00000000 0000cf01 00000000 6af2
ffff8ca190c48b40 2033774545 S Ii:1:066:1 -115:4 64 <
ffff8ca190c48b40 2033786539 C Ii:1:066:1 0:4 18 = 2000b50e 00000000 0000f601 00000000 43f2
ffff8ca190c48b40 2033786546 S Ii:1:066:1 -115:4 64 <
ffff8ca190c48b40 2033814540 C Ii:1:066:1 0:4 18 = 2000b60e 00000000 0000cf01 00000000 43f2
ffff8ca190c48b40 2033814544 S Ii:1:066:1 -115:4 64 <
ffff8ca190c48b40 2033822540 C Ii:1:066:1 0:4 18 = 2000b70e 00000000 0000f601 00000000 1df2
ffff8ca190c48b40 2033822546 S Ii:1:066:1 -115:4 64 <
ffff8ca190c48b40 2033834541 C Ii:1:066:1 0:4 18 = 2000b80e 00000000 00004302 00000000 1df2
ffff8ca190c48b40 2033834546 S Ii:1:066:1 -115:4 64 <
ffff8ca190c48b40 2033842541 C Ii:1:066:1 0:4 18 = 2000b90e 00000000 0000f601 00000000 1df2
ffff8ca190c48b40 2033842546 S Ii:1:066:1 -115:4 64 <
ffff8ca190c48b40 2033854707 C Ii:1:066:1 0:4 18 = 2000ba0e 00000000 0000f601 00000000 6af2
ffff8ca190c48b40 2033854712 S Ii:1:066:1 -115:4 64 <
ffff8ca190c48b40 2033862542 C Ii:1:066:1 0:4 18 = 2000bb0e 00000000 0000cf01 00000000 43f2
ffff8ca190c48b40 2033862546 S Ii:1:066:1 -115:4 64 <
ffff8ca190c48b40 2033874543 C Ii:1:066:1 0:4 18 = 2000bc0e 00000000 0000f601 00000000 1df2
ffff8ca190c48b40 2033874551 S Ii:1:066:1 -115:4 64 <
ffff8ca190c48b40 2033882543 C Ii:1:066:1 0:4 18 = 2000bd0e 00000000 0000cf01 00000000 1df2
ffff8ca190c48b40 2033882549 S Ii:1:066:1 -115:4 64 <
ffff8ca190c48b40 2033894544 C Ii:1:066:1 0:4 18 = 2000be0e 00000000 0000cf01 00000000 43f2
ffff8ca190c48b40 2033894550 S Ii:1:066:1 -115:4 64 <
ffff8ca190c48b40 2033902545 C Ii:1:066:1 0:4 18 = 2000bf0e 00000000 0000f601 00000000 91f2
ffff8ca190c48b40 2033902550 S Ii:1:066:1 -115:4 64 <
ffff8ca190c48b40 2033914544 C Ii:1:066:1 0:4 18 = 2000c00e 00000000 00004302 00000000 1df2
ffff8ca190c48b40 2033914549 S Ii:1:066:1 -115:4 64 <
ffff8ca190c48b40 2033922544 C Ii:1:066:1 0:4 18 = 2000c10e 00000000 0000f601 00000000 f6f1
ffff8ca190c48b40 2033922549 S Ii:1:066:1 -115:4 64 <
ffff8ca190c48b40 2033934589 C Ii:1:066:1 0:4 18 = 2000c20e 00000000 0000cf01 00000000 43f2
ffff8ca190c48b40 2033934595 S Ii:1:066:1 -115:4 64 <
ffff8ca190c48b40 2033942545 C Ii:1:066:1 0:4 18 = 2000c30e 00000000 0000f601 00000000 43f2
ffff8ca190c48b40 2033942550 S Ii:1:066:1 -115:4 64 <
ffff8ca190c48b40 2033954719 C Ii:1:066:1 0:4 18 = 2000c40e 00000000 0000cf01 00000000 43f2
ffff8ca190c48b40 2033954724 S Ii:1:066:1 -115:4 64 <
ffff8ca190c48b40 2033962546 C Ii:1:066:1 0:4 18 = 2000c50e 00000000 0000cf01 00000000 6af2
ffff8ca190c48b40 2033962550 S Ii:1:066:1 -115:4 64 <
ffff8ca190c48b40 2033974545 C Ii:1:066:1 0:4 18 = 2000c60e 00000000 0000f601 00000000 6af2
ffff8ca190c48b40 2033974549 S Ii:1:066:1 -115:4 64 <
ffff8ca190c48b40 2033982545 C Ii:1:066:1 0:4 18 = 2000c70e 00000000 0000f601 00000000 1df2
ffff8ca190c48b40 2033982549 S Ii:1:066:1 -115:4 64 <
ffff8ca190c48b40 2033994547 C Ii:1:066:1 0:4 18 = 2000c80e 00000000 0000cf01 00000000 43f2
ffff8ca190c48b40 2033994554 S Ii:1:066:1 -115:4 64 <
ffff8ca190c48b40 2034002546 C Ii:1:066:1 0:4 18 = 2000c90e 00000000 0000f601 00000000 1df2
ffff8ca190c48b40 2034002550 S Ii:1:066:1 -115:4 64 <
ffff8ca190c48b40 2034014547 C Ii:1:066:1 0:4 18 = 2000ca0e 00000000 0000cf01 00000000 1df2
ffff8ca190c48b40 2034014551 S Ii:1:066:1 -115:4 64 <
ffff8ca190c48b40 2034022548 C Ii:1:066:1 0:4 18 = 2000cb0e 00000000 00004302 00000000 6af2
ffff8ca190c48b40 2034022552 S Ii:1:066:1 -115:4 64 <
ffff8ca190c48b40 2034034549 C Ii:1:066:1 0:4 18 = 2000cc0e 00000000 0000cf01 00000000 43f2
ffff8ca190c48b40 2034034553 S Ii:1:066:1 -115:4 64 <
ffff8ca190c48b40 2034042548 C Ii:1:066:1 0:4 18 = 2000cd0e 00000000 0000cf01 00000000 6af2
ffff8ca190c48b40 2034042552 S Ii:1:066:1 -115:4 64 <
ffff8ca190c48b40 2034054668 C Ii:1:066:1 0:4 18 = 2000ce0e 00000000 0000cf01 00000000 f6f1
ffff8ca190c48b40 2034054671 S Ii:1:066:1 -115:4 64 <
ffff8ca190c48b40 2034062548 C Ii:1:066:1 0:4 18 = 2000cf0e 00000000 0000f601 00000000 1df2
ffff8ca190c48b40 2034062553 S Ii:1:066:1 -115:4 64 <
ffff8ca190c48b40 2034074551 C Ii:1:066:1 0:4 18 = 2000d00e 00000000 00001c02 00000000 6af2
ffff8ca190c48b40 2034074556 S Ii:1:066:1 -115:4 64 <
ffff8ca190c48b40 2034082550 C Ii:1:066:1 0:4 18 = 2000d10e 00000000 0000f601 00000000 43f2
ffff8ca190c48b40 2034082556 S Ii:1:066:1 -115:4 64 <
ffff8ca190c48b40 2034094549 C Ii:1:066:1 0:4 18 = 2000d20e 00000000 0000cf01 00000000 43f2
ffff8ca190c48b40 2034094555 S Ii:1:066:1 -115:4 64 <
ffff8ca190c48b40 2034114550 C Ii:1:066:1 0:4 18 = 2000d30e 00000000 0000cf01 00000000 cff1
ffff8ca190c48b40 2034114555 S Ii:1:066:1 -115:4 64 <
ffff8ca18cc0f000 2034121385 S Io:1:101:1 -115:1 32 = 5508c20a 0310013d 1a059900 00000000 00000000 00000000 00000000 00000000
ffff8ca18cc0f000 2034121698 C Io:1:101:1 0:1 32 >
ffff8ca190c48b40 2034122549 C Ii:1:066:1 0:4 18 = 2000d40e 00000000 0000a901 00000000 6af2
ffff8ca190c48b40 2034122553 S Ii:1:066:1 -115:4 64 <
ffff8ca190c48b40 2034134741 C Ii:1:066:1 0:4 18 = 2000d50e 00000000 0000f601 00000000 43f2
ffff8ca190c48b40 2034134748 S Ii:1:066:1 -115:4 64 <
ffff8ca190c48b40 2034142551 C Ii:1:066:1 0:4 18 = 2000d60e 00000000 0000f601 00000000 6af2
ffff8ca190c48b40 2034142556 S Ii:1:066:1 -115:4 64 <
ffff8ca19382dcc0 2034145698 C Ii:1:101:1 0:1 32 = 55010a60 00000000 00000000 00000000 00000000 00000000 00000000 00000000
ffff8ca64c0c8780 2034145781 S Ii:1:101:1 -115:1 32 <
ffff8ca190c48b40 2034154861 C Ii:1:066:1 0:4 18 = 2000d70e 00000000 0000f601 00000000 1df2
ffff8ca190c48b40 2034154866 S Ii:1:066:1 -115:4 64 <
ffff8ca190c48b40 2034162552 C Ii:1:066:1 0:4 18 = 2000d80e 00000000 0000f601 00000000 6af2
ffff8ca190c48b40 2034162557 S Ii:1:066:1 -115:4 64 <
ffff8ca190c48b40 2034174552 C Ii:1:066:1 0:4 18 = 2000d90e 00000000 0000a901 00000000 1df2
ffff8ca190c48b40 2034174557 S Ii:1:066:1 -115:4 64 <
ffff8ca190c48b40 2034194554 C Ii:1:066:1 0:4 18 = 2000da0e 00000000 0000cf01 00000000 f6f1
ffff8ca190c48b40 2034194560 S Ii:1:066:1 -115:4 64 <
ffff8ca190c48b40 2034202589 C Ii:1:066:1 0:4 18 = 2000db0e 00000000 0000cf01 00000000 1df2
ffff8ca190c48b40 2034202594 S Ii:1:066:1 -115:4 64 <
ffff8ca190c48b40 2034214554 C Ii:1:066:1 0:4 18 = 2000dc0e 00000000 00001c02 00000000 6af2
ffff8ca190c48b40 2034214561 S Ii:1:066:1 -115:4 64 <
ffff8ca190c48b40 2034222553 C Ii:1:066:1 0:4 18 = 2000dd0e 00000000 0000cf01 00000000 1df2
ffff8ca190c48b40 2034222558 S Ii:1:066:1 -115:4 64 <
ffff8ca190c48b40 2034234571 C Ii:1:066:1 0:4 18 = 2000de0e 00000000 0000f601 00000000 1df2
ffff8ca190c48b40 2034234575 S Ii:1:066:1 -115:4 64 <
ffff8ca190c48b40 2034254694 C Ii:1:066:1 0:4 18 = 2000df0e 00000000 0000cf01 00000000 43f2
ffff8ca190c48b40 2034254699 S Ii:1:066:1 -115:4 64 <
ffff8ca190c48b40 2034262555 C Ii:1:066:1 0:4 18 = 2000e00e 00000000 00001c02 00000000 1df2
ffff8ca190c48b40 2034262560 S Ii:1:066:1 -115:4 64 <
ffff8ca190c48b40 2034274555 C Ii:1:066:1 0:4 18 = 2000e10e 00000000 0000f601 00000000 43f2
ffff8ca190c48b40 2034274560 S Ii:1:066:1 -115:4 64 <
ffff8ca190c48b40 2034282555 C Ii:1:066:1 0:4 18 = 2000e20e 00000000 00001c02 00000000 f6f1
ffff8ca190c48b40 2034282560 S Ii:1:066:1 -115:4 64 <
ffff8ca190c48b40 2034294556 C Ii:1:066:1 0:4 18 = 2000e30e 00000000 0000f601 00000000 f6f1
ffff8ca190c48b40 2034294563 S Ii:1:066:1 -115:4 64 <
ffff8ca190c48b40 2034302556 C Ii:1:066:1 0:4 18 = 2000e40e 00000000 0000f601 00000000 43f2
ffff8ca190c48b40 2034302561 S Ii:1:066:1 -115:4 64 <
ffff8ca190c48b40 2034314557 C Ii:1:066:1 0:4 18 = 2000e50e 00000000 0000f601 00000000 1df2
ffff8ca190c48b40 2034314566 S Ii:1:066:1 -115:4 64 <
ffff8ca190c48b40 2034322557 C Ii:1:066:1 0:4 18 = 2000e60e 00000000 00001c02 00000000 43f2
ffff8ca190c48b40 2034322563 S Ii:1:066:1 -115:4 64 <
ffff8ca190c48b40 2034334557 C Ii:1:066:1 0:4 18 = 2000e70e 00000000 0000f601 00000000 1df2
ffff8ca190c48b40 2034334562 S Ii:1:066:1 -115:4 64 <
ffff8ca190c48b40 2034362559 C Ii:1:066:1 0:4 18 = 2000e80e 00000000 0000f601 00000000 43f2
ffff8ca190c48b40 2034362565 S Ii:1:066:1 -115:4 64 <
ffff8ca190c48b40 2034374559 C Ii:1:066:1 0:4 18 = 2000e90e 00000000 0000f601 00000000 f6f1
ffff8ca190c48b40 2034374564 S Ii:1:066:1 -115:4 64 <
ffff8ca190c48b40 2034394561 C Ii:1:066:1 0:4 18 = 2000ea0e 00000000 0000f601 00000000 6af2
ffff8ca190c48b40 2034394566 S Ii:1:066:1 -115:4 64 <
ffff8ca190c48b40 2034402559 C Ii:1:066:1 0:4 18 = 2000eb0e 00000000 0000f601 00000000 43f2
ffff8ca190c48b40 2034402564 S Ii:1:066:1 -115:4 64 <
ffff8ca190c48b40 2034414561 C Ii:1:066:1 0:4 18 = 2000ec0e 00000000 00001c02 00000000 43f2
ffff8ca190c48b40 2034414567 S Ii:1:066:1 -115:4 64 <
ffff8ca190c48b40 2034422561 C Ii:1:066:1 0:4 18 = 2000ed0e 00000000 0000cf01 00000000 6af2
ffff8ca190c48b40 2034422565 S Ii:1:066:1 -115:4 64 <
ffff8ca190c48b40 2034434691 C Ii:1:066:1 0:4 18 = 2000ee0e 00000000 00001c02 00000000 1df2
ffff8ca190c48b40 2034434696 S Ii:1:066:1 -115:4 64 <
ffff8ca190c48b40 2034442561 C Ii:1:066:1 0:4 18 = 2000ef0e 00000000 0000cf01 00000000 1df2
ffff8ca190c48b40 2034442565 S Ii:1:066:1 -115:4 64 <
ffff8ca190c48b40 2034454837 C Ii:1:066:1 0:4 18 = 2000f00e 00000000 00001c02 00000000 1df2
ffff8ca190c48b40 2034454844 S Ii:1:066:1 -115:4 64 <
ffff8ca190c48b40 2034462561 C Ii:1:066:1 0:4 18 = 2000f10e 00000000 0000f601 00000000 6af2
ffff8ca190c48b40 2034462566 S Ii:1:066:1 -115:4 64 <
ffff8ca190c48b40 2034474563 C Ii:1:066:1 0:4 18 = 2000f20e 00000000 0000a901 00000000 43f2
ffff8ca190c48b40 2034474569 S Ii:1:066:1 -115:4 64 <
ffff8ca190c48b40 2034482565 C Ii:1:066:1 0:4 18 = 2000f30e 00000000 0000f601 00000000 6af2
ffff8ca190c48b40 2034482569 S Ii:1:066:1 -115:4 64 <
ffff8ca190c48b40 2034494563 C Ii:1:066:1 0:4 18 = 2000f40e 00000000 00001c02 00000000 1df2
ffff8ca190c48b40 2034494568 S Ii:1:066:1 -115:4 64 <
ffff8ca190c48b40 2034502563 C Ii:1:066:1 0:4 18 = 2000f50e 00000000 0000f601 00000000 43f2
ffff8ca190c48b40 2034502569 S Ii:1:066:1 -115:4 64 <
ffff8ca190c48b40 2034514563 C Ii:1:066:1 0:4 18 = 2000f60e 00000000 0000f601 00000000 f6f1
ffff8ca190c48b40 2034514567 S Ii:1:066:1 -115:4 64 <
ffff8ca190c48b40 2034522563 C Ii:1:066:1 0:4 18 = 2000f70e 00000000 00001c02 00000000 6af2
ffff8ca190c48b40 2034522568 S Ii:1:066:1 -115:4 64 <
ffff8ca190c48b40 2034534622 C Ii:1:066:1 0:4 18 = 2000f80e 00000000 0000f601 00000000 43f2
ffff8ca190c48b40 2034534627 S Ii:1:066:1 -115:4 64 <
ffff8ca190c48b40 2034542564 C Ii:1:066:1 0:4 18 = 2000f90e 00000000 00001c02 00000000 6af2
ffff8ca190c48b40 2034542570 S Ii:1:066:1 -115:4 64 <
ffff8ca190c48b40 2034554683 C Ii:1:066:1 0:4 18 = 2000fa0e 00000000 0000f601 00000000 1df2
ffff8ca190c48b40 2034554687 S Ii:1:066:1 -115:4 64 <
ffff8ca190c48b40 2034562564 C Ii:1:066:1 0:4 18 = 2000fb0e 00000000 0000cf01 00000000 f6f1
ffff8ca190c48b40 2034562570 S Ii:1:066:1 -115:4 64 <
ffff8ca190c48b40 2034574565 C Ii:1:066:1 0:4 18 = 2000fc0e 00000000 0000f601 00000000 43f2
ffff8ca190c48b40 2034574572 S Ii:1:066:1 -115:4 64 <
ffff8ca190c48b40 2034582564 C Ii:1:066:1 0:4 18 = 2000fd0e 00000000 0000f601 00000000 6af2
ffff8ca190c48b40 2034582568 S Ii:1:066:1 -115:4 64 <
ffff8ca190c48b40 2034594567 C Ii:1:066:1 0:4 18 = 2000fe0e 00000000 00001c02 00000000 6af2
ffff8ca190c48b40 2034594572 S Ii:1:066:1 -115:4 64 <
ffff8ca190c48b40 2034602567 C Ii:1:066:1 0:4 18 = 2000ff0e 00000000 0000cf01 00000000 6af2
ffff8ca190c48b40 2034602572 S Ii:1:066:1 -115:4 64 <
ffff8ca190c48b40 2034614567 C Ii:1:066:1 0:4 18 = 2000010e 00000000 00001c02 00000000 91f2
ffff8ca190c48b40 2034614572 S Ii:1:066:1 -115:4 64 <
ffff8ca190c48b40 2034622567 C Ii:1:066:1 0:4 18 = 2000020e 00000000 00008201 00000000 1df2
ffff8ca190c48b40 2034622573 S Ii:1:066:1 -115:4 64 <
ffff8ca190c48b40 2034634567 C Ii:1:066:1 0:4 18 = 2000030e 00000000 0000f601 00000000 43f2
ffff8ca190c48b40 2034634571 S Ii:1:066:1 -115:4 64 <
ffff8ca190c48b40 2034642566 C Ii:1:066:1 0:4 18 = 2000040e 00000000 0000f601 00000000 f6f1
ffff8ca190c48b40 2034642570 S Ii:1:066:1 -115:4 64 <
ffff8ca190c48b40 2034654879 C Ii:1:066:1 0:4 18 = 2000050e 00000000 0000f601 00000000 1df2
ffff8ca190c48b40 2034654883 S Ii:1:066:1 -115:4 64 <
ffff8ca190c48b40 2034662567 C Ii:1:066:1 0:4 18 = 2000060e 00000000 00001c02 00000000 43f2
ffff8ca190c48b40 2034662572 S Ii:1:066:1 -115:4 64 <
ffff8ca190c48b40 2034674568 C Ii:1:066:1 0:4 18 = 2000070e 00000000 0000cf01 00000000 1df2
ffff8ca190c48b40 2034674572 S Ii:1:066:1 -115:4 64 <
ffff8ca190c48b40 2034682568 C Ii:1:066:1 0:4 18 = 2000080e 00000000 0000f601 00000000 1df2
ffff8ca190c48b40 2034682573 S Ii:1:066:1 -115:4 64 <
ffff8ca190c48b40 2034694569 C Ii:1:066:1 0:4 18 = 2000090e 00000000 0000f601 00000000 43f2
ffff8ca190c48b40 2034694575 S Ii:1:066:1 -115:4 64 <
ffff8ca190c48b40 2034702570 C Ii:1:066:1 0:4 18 = 20000a0e 00000000 0000cf01 00000000 f6f1
ffff8ca190c48b40 2034702575 S Ii:1:066:1 -115:4 64 <
ffff8ca190c48b40 2034714569 C Ii:1:066:1 0:4 18 = 20000b0e 00000000 0000f601 00000000 43f2
ffff8ca190c48b40 2034714574 S Ii:1:066:1 -115:4 64 <
ffff8ca18f245000 2034721562 S Io:1:101:1 -115:1 32 = 5508c20b 031001f4 6916b100 00000000 00000000 00000000 00000000 00000000
ffff8ca18f245000 2034721716 C Io:1:101:1 0:1 32 >
ffff8ca190c48b40 2034722569 C Ii:1:066:1 0:4 18 = 20000c0e 00000000 0000f601 00000000 1df2
ffff8ca190c48b40 2034722573 S Ii:1:066:1 -115:4 64 <
ffff8ca190c48b40 2034734652 C Ii:1:066:1 0:4 18 = 20000d0e 00000000 0000a901 00000000 1df2
ffff8ca190c48b40 2034734657 S Ii:1:066:1 -115:4 64 <
ffff8ca190c48b40 2034742571 C Ii:1:066:1 0:4 18 = 20000e0e 00000000 0000f601 00000000 43f2
ffff8ca190c48b40 2034742576 S Ii:1:066:1 -115:4 64 <
ffff8ca64c0c8780 2034753720 C Ii:1:101:1 0:1 32 = 55010b61 00000000 00000000 00000000 00000000 00000000 00000000 00000000
ffff8ca190c48b40 2034754722 C Ii:1:066:1 0:4 18 = 20000f0e 00000000 0000cf01 00000000 1df2
ffff8ca190c48b40 2034754726 S Ii:1:066:1 -115:4 64 <
ffff8ca19382d540 2034754755 S Ii:1:101:1 -115:1 32 <
ffff8ca190c48b40 2034762571 C Ii:1:066:1 0:4 18 = 2000100e 00000000 0000cf01 00000000 91f2
ffff8ca190c48b40 2034762576 S Ii:1:066:1 -115:4 64 <
ffff8ca190c48b40 2034774570 C Ii:1:066:1 0:4 18 = 2000110e 00000000 00001c02 00000000 1df2
ffff8ca190c48b40 2034774575 S Ii:1:066:1 -115:4 64 <
ffff8ca190c48b40 2034782571 C Ii:1:066:1 0:4 18 = 2000120e 00000000 0000cf01 00000000 43f2
ffff8ca190c48b40 2034782574 S Ii:1:066:1 -115:4 64 <
ffff8ca190c48b40 2034794574 C Ii:1:066:1 0:4 18 = 2000130e 00000000 0000cf01 00000000 6af2
ffff8ca190c48b40 2034794582 S Ii:1:066:1 -115:4 64 <
ffff8ca190c48b40 2034802573 C Ii:1:066:1 0:4 18 = 2000140e 00000000 0000f601 00000000 43f2
ffff8ca190c48b40 2034802578 S Ii:1:066:1 -115:4 64 <
ffff8ca190c48b40 2034814573 C Ii:1:066:1 0:4 18 = 2000150e 00000000 00001c02 00000000 43f2
ffff8ca190c48b40 2034814577 S Ii:1:066:1 -115:4 64 <
ffff8ca190c48b40 2034822574 C Ii:1:066:1 0:4 18 = 2000160e 00000000 0000cf01 00000000 f6f1
ffff8ca190c48b40 2034822578 S Ii:1:066:1 -115:4 64 <
ffff8ca190c48b40 2034834575 C Ii:1:066:1 0:4 18 = 2000170e 00000000 0000f601 00000000 f6f1
ffff8ca190c48b40 2034834581 S Ii:1:066:1 -115:4 64 <
ffff8ca190c48b40 2034842573 C Ii:1:066:1 0:4 18 = 2000180e 00000000 0000f601 00000000 6af2
ffff8ca190c48b40 2034842577 S Ii:1:066:1 -115:4 64 <
ffff8ca190c48b40 2034862575 C Ii:1:066:1 0:4 18 = 2000190e 00000000 0000cf01 00000000 6af2
ffff8ca190c48b40 2034862579 S Ii:1:066:1 -115:4 64 <
ffff8ca190c48b40 2034874574 C Ii:1:066:1 0:4 18 = 20001a0e 00000000 0000cf01 00000000 f6f1
ffff8ca190c48b40 2034874579 S Ii:1:066:1 -115:4 64 <
ffff8ca190c48b40 2034882575 C Ii:1:066:1 0:4 18 = 20001b0e 00000000 00001c02 00000000 43f2
ffff8ca190c48b40 2034882581 S Ii:1:066:1 -115:4 64 <
ffff8ca190c48b40 2034902577 C Ii:1:066:1 0:4 18 = 20001c0e 00000000 0000f601 00000000 f6f1
ffff8ca190c48b40 2034902582 S Ii:1:066:1 -115:4 64 <
ffff8ca190c48b40 2034914577 C Ii:1:066:1 0:4 18 = 20001d0e 00000000 0000a901 00000000 6af2
ffff8ca190c48b40 2034914582 S Ii:1:066:1 -115:4 64 <
ffff8ca190c48b40 2034922577 C Ii:1:066:1 0:4 18 = 20001e0e 00000000 0000cf01 00000000 1df2
ffff8ca190c48b40 2034922582 S Ii:1:066:1 -115:4 64 <
ffff8ca190c48b40 2034934893 C Ii:1:066:1 0:4 18 = 20001f0e 00000000 0000a901 00000000 1df2
ffff8ca190c48b40 2034934898 S Ii:1:066:1 -115:4 64 <
ffff8ca190c48b40 2034942577 C Ii:1:066:1 0:4 18 = 2000200e 00000000 0000cf01 00000000 f6f1
ffff8ca190c48b40 2034942582 S Ii:1:066:1 -115:4 64 <
ffff8ca190c48b40 2034954678 C Ii:1:066:1 0:4 18 = 2000210e 00000000 0000f601 00000000 1df2
ffff8ca190c48b40 2034954683 S Ii:1:066:1 -115:4 64 <
ffff8ca190c48b40 2034962577 C Ii:1:066:1 0:4 18 = 2000220e 00000000 0000f601 00000000 6af2
ffff8ca190c48b40 2034962580 S Ii:1:066:1 -115:4 64 <
ffff8ca190c48b40 2034974577 C Ii:1:066:1 0:4 18 = 2000230e 00000000 00001c02 00000000 cff1
ffff8ca190c48b40 2034974581 S Ii:1:066:1 -115:4 64 <
ffff8ca190c48b40 2034982578 C Ii:1:066:1 0:4 18 = 2000240e 00000000 0000f601 00000000 6af2
ffff8ca190c48b40 2034982583 S Ii:1:066:1 -115:4 64 <
ffff8ca190c48b40 2034994581 C Ii:1:066:1 0:4 18 = 2000250e 00000000 0000f601 00000000 1df2
ffff8ca190c48b40 2034994588 S Ii:1:066:1 -115:4 64 <
ffff8ca190c48b40 2035002579 C Ii:1:066:1 0:4 18 = 2000260e 00000000 0000f601 00000000 6af2
ffff8ca190c48b40 2035002584 S Ii:1:066:1 -115:4 64 <
ffff8ca190c48b40 2035014580 C Ii:1:066:1 0:4 18 = 2000270e 00000000 0000f601 00000000 43f2
ffff8ca190c48b40 2035014585 S Ii:1:066:1 -115:4 64 <
ffff8ca190c48b40 2035022579 C Ii:1:066:1 0:4 18 = 2000280e 00000000 0000cf01 00000000 43f2
ffff8ca190c48b40 2035022585 S Ii:1:066:1 -115:4 64 <
ffff8ca190c48b40 2035034806 C Ii:1:066:1 0:4 18 = 2000290e 00000000 0000f601 00000000 43f2
ffff8ca190c48b40 2035034812 S Ii:1:066:1 -115:4 64 <
ffff8ca190c48b40 2035042582 C Ii:1:066:1 0:4 18 = 20002a0e 00000000 0000f601 00000000 6af2
ffff8ca190c48b40 2035042587 S Ii:1:066:1 -115:4 64 <
ffff8ca190c48b40 2035054727 C Ii:1:066:1 0:4 18 = 20002b0e 00000000 0000cf01 00000000 43f2
ffff8ca190c48b40 2035054732 S Ii:1:066:1 -115:4 64 <
ffff8ca190c48b40 2035062581 C Ii:1:066:1 0:4 18 = 20002c0e 00000000 0000f601 00000000 43f2
ffff8ca190c48b40 2035062585 S Ii:1:066:1 -115:4 64 <
ffff8ca190c48b40 2035074582 C Ii:1:066:1 0:4 18 = 20002d0e 00000000 00001c02 00000000 6af2
ffff8ca190c48b40 2035074586 S Ii:1:066:1 -115:4 64 <
ffff8ca190c48b40 2035082582 C Ii:1:066:1 0:4 18 = 20002e0e 00000000 00001c02 00000000 1df2
ffff8ca190c48b40 2035082587 S Ii:1:066:1 -115:4 64 <
ffff8ca190c48b40 2035094582 C Ii:1:066:1 0:4 18 = 20002f0e 00000000 0000f601 00000000 f6f1
ffff8ca190c48b40 2035094587 S Ii:1:066:1 -115:4 64 <
ffff8ca190c48b40 2035102582 C Ii:1:066:1 0:4 18 = 2000300e 00000000 0000f601 00000000 1df2
ffff8ca190c48b40 2035102586 S Ii:1:066:1 -115:4 64 <
ffff8ca190c48b40 2035114582 C Ii:1:066:1 0:4 18 = 2000310e 00000000 0000cf01 00000000 6af2
ffff8ca190c48b40 2035114587 S Ii:1:066:1 -115:4 64 <
ffff8ca190c48b40 2035122583 C Ii:1:066:1 0:4 18 = 2000320e 00000000 00001c02 00000000 6af2
ffff8ca190c48b40 2035122588 S Ii:1:066:1 -115:4 64 <
ffff8ca190c48b40 2035134759 C Ii:1:066:1 0:4 18 = 2000330e 00000000 0000f601 00000000 43f2
ffff8ca190c48b40 2035134764 S Ii:1:066:1 -115:4 64 <
ffff8ca190c48b40 2035142583 C Ii:1:066:1 0:4 18 = 2000340e 00000000 0000f601 00000000 1df2
ffff8ca190c48b40 2035142587 S Ii:1:066:1 -115:4 64 <
ffff8ca190c48b40 2035154705 C Ii:1:066:1 0:4 18 = 2000350e 00000000 0000f601 00000000 43f2
ffff8ca190c48b40 2035154709 S Ii:1:066:1 -115:4 64 <
ffff8ca190c48b40 2035162584 C Ii:1:066:1 0:4 18 = 2000360e 00000000 0000f601 00000000 6af2
ffff8ca190c48b40 2035162589 S Ii:1:066:1 -115:4 64 <
ffff8ca190c48b40 2035174585 C Ii:1:066:1 0:4 18 = 2000370e 00000000 0000f601 00000000 43f2
ffff8ca190c48b40 2035174590 S Ii:1:066:1 -115:4 64 <
ffff8ca190c48b40 2035182583 C Ii:1:066:1 0:4 18 = 2000380e 00000000 0000f601 00000000 1df2
ffff8ca190c48b40 2035182588 S Ii:1:066:1 -115:4 64 <
ffff8ca190c48b40 2035202590 C Ii:1:066:1 0:4 18 = 2000390e 00000000 0000cf01 00000000 43f2
ffff8ca190c48b40 2035202602 S Ii:1:066:1 -115:4 64 <
ffff8ca190c48b40 2035222589 C Ii:1:066:1 0:4 18 = 20003a0e 00000000 00001c02 00000000 6af2
ffff8ca190c48b40 2035222597 S Ii:1:066:1 -115:4 64 <
ffff8ca190c48b40 2035234919 C Ii:1:066:1 0:4 18 = 20003b0e 00000000 0000f601 00000000 6af2
ffff8ca190c48b40 2035234924 S Ii:1:066:1 -115:4 64 <
ffff8ca190c48b40 2035242588 C Ii:1:066:1 0:4 18 = 20003c0e 00000000 0000cf01 00000000 6af2
ffff8ca190c48b40 2035242594 S Ii:1:066:1 -115:4 64 <
ffff8ca190c48b40 2035254709 C Ii:1:066:1 0:4 18 = 20003d0e 00000000 0000f601 00000000 6af2
ffff8ca190c48b40 2035254714 S Ii:1:066:1 -115:4 64 <
ffff8ca18cf01840 2035254795 S Io:1:101:1 -115:1 32 = 5508c20c 0310013d 1a059b00 00000000 00000000 00000000 00000000 00000000
ffff8ca18cf01840 2035255732 C Io:1:101:1 0:1 32 >
ffff8ca190c48b40 2035262586 C Ii:1:066:1 0:4 18 = 20003e0e 00000000 00004302 00000000 43f2
ffff8ca190c48b40 2035262591 S Ii:1:066:1 -115:4 64 <
ffff8ca190c48b40 2035274590 C Ii:1:066:1 0:4 18 = 20003f0e 00000000 0000cf01 00000000 43f2
ffff8ca190c48b40 2035274599 S Ii:1:066:1 -115:4 64 <
ffff8ca190c48b40 2035282588 C Ii:1:066:1 0:4 18 = 2000400e 00000000 0000cf01 00000000 1df2
ffff8ca190c48b40 2035282594 S Ii:1:066:1 -115:4 64 <
ffff8ca19382d540 2035284842 C Ii:1:101:1 0:1 32 = 55010c62 00000000 00000000 00000000 00000000 00000000 00000000 00000000
ffff8ca193a3d180 2035285654 S Ii:1:101:1 -115:1 32 <
ffff8ca190c48b40 2035294590 C Ii:1:066:1 0:4 18 = 2000410e 00000000 0000a901 00000000 43f2
ffff8ca190c48b40 2035294595 S Ii:1:066:1 -115:4 64 <
ffff8ca190c48b40 2035302589 C Ii:1:066:1 0:4 18 = 2000420e 00000000 0000cf01 00000000 1df2
ffff8ca190c48b40 2035302594 S Ii:1:066:1 -115:4 64 <
ffff8ca190c48b40 2035314589 C Ii:1:066:1 0:4 18 = 2000430e 00000000 00001c02 00000000 43f2
ffff8ca190c48b40 2035314592 S Ii:1:066:1 -115:4 64 <
ffff8ca190c48b40 2035322590 C Ii:1:066:1 0:4 18 = 2000440e 00000000 0000f601 00000000 1df2
ffff8ca190c48b40 2035322594 S Ii:1:066:1 -115:4 64 <
ffff8ca190c48b40 2035334590 C Ii:1:066:1 0:4 18 = 2000450e 00000000 00004302 00000000 6af2
ffff8ca190c48b40 2035334594 S Ii:1:066:1 -115:4 64 <
ffff8ca190c48b40 2035342590 C Ii:1:066:1 0:4 18 = 2000460e 00000000 00001c02 00000000 43f2
ffff8ca190c48b40 2035342595 S Ii:1:066:1 -115:4 64 <
ffff8ca190c48b40 2035354876 C Ii:1:066:1 0:4 18 = 2000470e 00000000 0000cf01 00000000 43f2
ffff8ca190c48b40 2035354881 S Ii:1:066:1 -115:4 64 <
ffff8ca190c48b40 2035362590 C Ii:1:066:1 0:4 18 = 2000480e 00000000 0000a901 00000000 1df2
ffff8ca190c48b40 2035362595 S Ii:1:066:1 -115:4 64 <
ffff8ca190c48b40 2035374593 C Ii:1:066:1 0:4 18 = 2000490e 00000000 0000cf01 00000000 43f2
ffff8ca190c48b40 2035374600 S Ii:1:066:1 -115:4 64 <
ffff8ca190c48b40 2035382591 C Ii:1:066:1 0:4 18 = 20004a0e 00000000 0000cf01 00000000 6af2
ffff8ca190c48b40 2035382594 S Ii:1:066:1 -115:4 64 <
ffff8ca190c48b40 2035394592 C Ii:1:066:1 0:4 18 = 20004b0e 00000000 0000cf01 00000000 43f2
ffff8ca190c48b40 2035394597 S Ii:1:066:1 -115:4 64 <
ffff8ca190c48b40 2035402592 C Ii:1:066:1 0:4 18 = 20004c0e 00000000 00001c02 00000000 43f2
ffff8ca190c48b40 2035402596 S Ii:1:066:1 -115:4 64 <
ffff8ca190c48b40 2035414592 C Ii:1:066:1 0:4 18 = 20004d0e 00000000 0000cf01 00000000 f6f1
ffff8ca190c48b40 2035414596 S Ii:1:066:1 -115:4 64 <
ffff8ca190c48b40 2035422592 C Ii:1:066:1 0:4 18 = 20004e0e 00000000 0000cf01 00000000 43f2
ffff8ca190c48b40 2035422596 S Ii:1:066:1 -115:4 64 <
ffff8ca190c48b40 2035454716 C Ii:1:066:1 0:4 18 = 20004f0e 00000000 00001c02 00000000 43f2
ffff8ca190c48b40 2035454723 S Ii:1:066:1 -115:4 64 <
ffff8ca190c48b40 2035462594 C Ii:1:066:1 0:4 18 = 2000500e 00000000 0000f601 00000000 43f2
ffff8ca190c48b40 2035462600 S Ii:1:066:1 -115:4 64 <
ffff8ca190c48b40 2035474595 C Ii:1:066:1 0:4 18 = 2000510e 00000000 0000cf01 00000000 1df2
ffff8ca190c48b40 2035474603 S Ii:1:066:1 -115:4 64 <
ffff8ca190c48b40 2035482594 C Ii:1:066:1 0:4 18 = 2000520e 00000000 0000f601 00000000 f6f1
ffff8ca190c48b40 2035482598 S Ii:1:066:1 -115:4 64 <
ffff8ca190c48b40 2035494595 C Ii:1:066:1 0:4 18 = 2000530e 00000000 0000f601 00000000 43f2
ffff8ca190c48b40 2035494605 S Ii:1:066:1 -115:4 64 <
ffff8ca190c48b40 2035502595 C Ii:1:066:1 0:4 18 = 2000540e 00000000 0000f601 00000000 1df2
ffff8ca190c48b40 2035502600 S Ii:1:066:1 -115:4 64 <
ffff8ca190c48b40 2035514595 C Ii:1:066:1 0:4 18 = 2000550e 00000000 0000f601 00000000 43f2
ffff8ca190c48b40 2035514599 S Ii:1:066:1 -115:4 64 <
ffff8ca190c48b40 2035522595 C Ii:1:066:1 0:4 18 = 2000560e 00000000 00004302 00000000 6af2
ffff8ca190c48b40 2035522600 S Ii:1:066:1 -115:4 64 <
ffff8ca190c48b40 2035534598 C Ii:1:066:1 0:4 18 = 2000570e 00000000 0000f601 00000000 f6f1
ffff8ca190c48b40 2035534602 S Ii:1:066:1 -115:4 64 <
ffff8ca190c48b40 2035542596 C Ii:1:066:1 0:4 18 = 2000580e 00000000 0000a901 00000000 f6f1
ffff8ca190c48b40 2035542602 S Ii:1:066:1 -115:4 64 <
ffff8ca190c48b40 2035554803 C Ii:1:066:1 0:4 18 = 2000590e 00000000 0000a901 00000000 43f2
ffff8ca190c48b40 2035554809 S Ii:1:066:1 -115:4 64 <
ffff8ca190c48b40 2035562597 C Ii:1:066:1 0:4 18 = 20005a0e 00000000 00001c02 00000000 6af2
ffff8ca190c48b40 2035562602 S Ii:1:066:1 -115:4 64 <
ffff8ca190c48b40 2035574597 C Ii:1:066:1 0:4 18 = 20005b0e 00000000 0000a901 00000000 43f2
ffff8ca190c48b40 2035574605 S Ii:1:066:1 -115:4 64 <
ffff8ca190c48b40 2035582598 C Ii:1:066:1 0:4 18 = 20005c0e 00000000 0000f601 00000000 43f2
ffff8ca190c48b40 2035582602 S Ii:1:066:1 -115:4 64 <
ffff8ca190c48b40 2035594599 C Ii:1:066:1 0:4 18 = 20005d0e 00000000 0000f601 00000000 1df2
ffff8ca190c48b40 2035594606 S Ii:1:066:1 -115:4 64 <
ffff8ca190c48b40 2035602598 C Ii:1:066:1 0:4 18 = 20005e0e 00000000 0000cf01 00000000 1df2
ffff8ca190c48b40 2035602603 S Ii:1:066:1 -115:4 64 <
ffff8ca190c48b40 2035614599 C Ii:1:066:1 0:4 18 = 20005f0e 00000000 0000f601 00000000 6af2
ffff8ca190c48b40 2035614605 S Ii:1:066:1 -115:4 64 <
ffff8ca190c48b40 2035622599 C Ii:1:066:1 0:4 18 = 2000600e 00000000 0000cf01 00000000 f6f1
ffff8ca190c48b40 2035622603 S Ii:1:066:1 -115:4 64 <
ffff8ca190c48b40 2035634999 C Ii:1:066:1 0:4 18 = 2000610e 00000000 0000f601 00000000 f6f1
ffff8ca190c48b40 2035635007 S Ii:1:066:1 -115:4 64 <
ffff8ca190c48b40 2035642599 C Ii:1:066:1 0:4 18 = 2000620e 00000000 0000f601 00000000 1df2
ffff8ca190c48b40 2035642605 S Ii:1:066:1 -115:4 64 <
ffff8ca190c48b40 2035662602 C Ii:1:066:1 0:4 18 = 2000630e 00000000 0000f601 00000000 f6f1
ffff8ca190c48b40 2035662609 S Ii:1:066:1 -115:4 64 <
ffff8ca190c48b40 2035674602 C Ii:1:066:1 0:4 18 = 2000640e 00000000 0000cf01 00000000 1df2
ffff8ca190c48b40 2035674607 S Ii:1:066:1 -115:4 64 <
ffff8ca190c48b40 2035682601 C Ii:1:066:1 0:4 18 = 2000650e 00000000 0000f601 00000000 1df2
ffff8ca190c48b40 2035682605 S Ii:1:066:1 -115:4 64 <
ffff8ca190c48b40 2035694602 C Ii:1:066:1 0:4 18 = 2000660e 00000000 0000cf01 00000000 43f2
ffff8ca190c48b40 2035694608 S Ii:1:066:1 -115:4 64 <
ffff8ca190c48b40 2035702601 C Ii:1:066:1 0:4 18 = 2000670e 00000000 0000f601 00000000 6af2
ffff8ca190c48b40 2035702606 S Ii:1:066:1 -115:4 64 <
ffff8ca190c48b40 2035714602 C Ii:1:066:1 0:4 18 = 2000680e 00000000 0000cf01 00000000 6af2
ffff8ca190c48b40 2035714607 S Ii:1:066:1 -115:4 64 <
ffff8ca190c48b40 2035722601 C Ii:1:066:1 0:4 18 = 2000690e 00000000 0000f601 00000000 1df2
ffff8ca190c48b40 2035722605 S Ii:1:066:1 -115:4 64 <
ffff8ca190c48b40 2035734681 C Ii:1:066:1 0:4 18 = 20006a0e 00000000 0000f601 00000000 43f2
ffff8ca190c48b40 2035734685 S Ii:1:066:1 -115:4 64 <
ffff8ca190c48b40 2035742602 C Ii:1:066:1 0:4 18 = 20006b0e 00000000 0000f601 00000000 6af2
ffff8ca190c48b40 2035742607 S Ii:1:066:1 -115:4 64 <
ffff8ca190c48b40 2035754607 C Ii:1:066:1 0:4 18 = 20006c0e 00000000 0000cf01 00000000 43f2
ffff8ca190c48b40 2035754613 S Ii:1:066:1 -115:4 64 <
ffff8ca190c48b40 2035762603 C Ii:1:066:1 0:4 18 = 20006d0e 00000000 0000cf01 00000000 1df2
ffff8ca190c48b40 2035762608 S Ii:1:066:1 -115:4 64 <
ffff8ca190c48b40 2035774603 C Ii:1:066:1 0:4 18 = 20006e0e 00000000 0000a901 00000000 43f2
ffff8ca190c48b40 2035774607 S Ii:1:066:1 -115:4 64 <
ffff8ca190c48b40 2035782603 C Ii:1:066:1 0:4 18 = 20006f0e 00000000 0000f601 00000000 1df2
ffff8ca190c48b40 2035782607 S Ii:1:066:1 -115:4 64 <
ffff8ca190c48b40 2035794606 C Ii:1:066:1 0:4 18 = 2000700e 00000000 0000cf01 00000000 cff1
ffff8ca190c48b40 2035794613 S Ii:1:066:1 -115:4 64 <
ffff8ca190c48b40 2035802604 C Ii:1:066:1 0:4 18 = 2000710e 00000000 00001c02 00000000 43f2
ffff8ca190c48b40 2035802608 S Ii:1:066:1 -115:4 64 <
ffff8ca190c48b40 2035814605 C Ii:1:066:1 0:4 18 = 2000720e 00000000 0000cf01 00000000 43f2
ffff8ca190c48b40 2035814611 S Ii:1:066:1 -115:4 64 <
ffff8ca18a773e40 2035821294 S Io:1:101:1 -115:1 32 = 5508c20d 031001f4 6916b300 00000000 00000000 00000000 00000000 00000000
ffff8ca18a773e40 2035821751 C Io:1:101:1 0:1 32 >
ffff8ca190c48b40 2035822604 C Ii:1:066:1 0:4 18 = 2000730e 00000000 0000f601 00000000 43f2
ffff8ca190c48b40 2035822608 S Ii:1:066:1 -115:4 64 <
ffff8ca190c48b40 2035842608 C Ii:1:066:1 0:4 18 = 2000740e 00000000 0000cf01 00000000 43f2
ffff8ca190c48b40 2035842615 S Ii:1:066:1 -115:4 64 <
ffff8ca190c48b40 2035854753 C Ii:1:066:1 0:4 18 = 2000750e 00000000 00001c02 00000000 6af2
ffff8ca190c48b40 2035854760 S Ii:1:066:1 -115:4 64 <
ffff8ca193a3d180 2035854763 C Ii:1:101:1 0:1 32 = 55010d63 00000000 00000000 00000000 00000000 00000000 00000000 00000000
ffff8ca193a3d180 2035855247 S Ii:1:101:1 -115:1 32 <
ffff8ca190c48b40 2035862606 C Ii:1:066:1 0:4 18 = 2000760e 00000000 0000a901 00000000 1df2
ffff8ca190c48b40 2035862611 S Ii:1:066:1 -115:4 64 <
ffff8ca190c48b40 2035874606 C Ii:1:066:1 0:4 18 = 2000770e 00000000 0000f601 00000000 43f2
ffff8ca190c48b40 2035874610 S Ii:1:066:1 -115:4 64 <
ffff8ca190c48b40 2035882607 C Ii:1:066:1 0:4 18 = 2000780e 00000000 0000cf01 00000000 6af2
ffff8ca190c48b40 2035882611 S Ii:1:066:1 -115:4 64 <
ffff8ca190c48b40 2035894608 C Ii:1:066:1 0:4 18 = 2000790e 00000000 00001c02 00000000 43f2
ffff8ca190c48b40 2035894613 S Ii:1:066:1 -115:4 64 <
ffff8ca190c48b40 2035902608 C Ii:1:066:1 0:4 18 = 20007a0e 00000000 0000f601 00000000 43f2
ffff8ca190c48b40 2035902612 S Ii:1:066:1 -115:4 64 <
ffff8ca190c48b40 2035922608 C Ii:1:066:1 0:4 18 = 20007b0e 00000000 0000cf01 00000000 1df2
ffff8ca190c48b40 2035922614 S Ii:1:066:1 -115:4 64 <
ffff8ca190c48b40 2035934911 C Ii:1:066:1 0:4 18 = 20007c0e 00000000 0000cf01 00000000 6af2
ffff8ca190c48b40 2035934915 S Ii:1:066:1 -115:4 64 <
ffff8ca190c48b40 2035942609 C Ii:1:066:1 0:4 18 = 20007d0e 00000000 0000f601 00000000 43f2
ffff8ca190c48b40 2035942615 S Ii:1:066:1 -115:4 64 <
ffff8ca190c48b40 2035954682 C Ii:1:066:1 0:4 18 = 20007e0e 00000000 0000cf01 00000000 6af2
ffff8ca190c48b40 2035954686 S Ii:1:066:1 -115:4 64 <
ffff8ca190c48b40 2035962609 C Ii:1:066:1 0:4 18 = 20007f0e 00000000 0000f601 00000000 6af2
ffff8ca190c48b40 2035962614 S Ii:1:066:1 -115:4 64 <
ffff8ca190c48b40 2035974610 C Ii:1:066:1 0:4 18 = 2000800e 00000000 0000cf01 00000000 1df2
ffff8ca190c48b40 2035974615 S Ii:1:066:1 -115:4 64 <
ffff8ca190c48b40 2035982610 C Ii:1:066:1 0:4 18 = 2000810e 00000000 0000f601 00000000 1df2
ffff8ca190c48b40 2035982614 S Ii:1:066:1 -115:4 64 <
ffff8ca190c48b40 2035994612 C Ii:1:066:1 0:4 18 = 2000820e 00000000 0000cf01 00000000 1df2
ffff8ca190c48b40 2035994617 S Ii:1:066:1 -115:4 64 <
ffff8ca190c48b40 2036022614 C Ii:1:066:1 0:4 18 = 2000830e 00000000 0000f601 00000000 f6f1
ffff8ca190c48b40 2036022620 S Ii:1:066:1 -115:4 64 <
ffff8ca190c48b40 2036034691 C Ii:1:066:1 0:4 18 = 2000840e 00000000 0000cf01 00000000 43f2
ffff8ca190c48b40 2036034695 S Ii:1:066:1 -115:4 64 <
ffff8ca190c48b40 2036042613 C Ii:1:066:1 0:4 18 = 2000850e 00000000 0000f601 00000000 1df2
ffff8ca190c48b40 2036042617 S Ii:1:066:1 -115:4 64 <
ffff8ca190c48b40 2036054714 C Ii:1:066:1 0:4 18 = 2000860e 00000000 00001c02 00000000 43f2
ffff8ca190c48b40 2036054719 S Ii:1:066:1 -115:4 64 <
ffff8ca190c48b40 2036062613 C Ii:1:066:1 0:4 18 = 2000870e 00000000 0000f601 00000000 91f2
ffff8ca190c48b40 2036062617 S Ii:1:066:1 -115:4 64 <
ffff8ca190c48b40 2036074613 C Ii:1:066:1 0:4 18 = 2000880e 00000000 0000a901 00000000 f6f1
ffff8ca190c48b40 2036074618 S Ii:1:066:1 -115:4 64 <
ffff8ca190c48b40 2036082613 C Ii:1:066:1 0:4 18 = 2000890e 00000000 0000cf01 00000000 f6f1
ffff8ca190c48b40 2036082617 S Ii:1:066:1 -115:4 64 <
ffff8ca190c48b40 2036094614 C Ii:1:066:1 0:4 18 = 20008a0e 00000000 0000f601 00000000 91f2
ffff8ca190c48b40 2036094619 S Ii:1:066:1 -115:4 64 <
ffff8ca190c48b40 2036102614 C Ii:1:066:1 0:4 18 = 20008b0e 00000000 0000f601 00000000 6af2
ffff8ca190c48b40 2036102618 S Ii:1:066:1 -115:4 64 <
ffff8ca190c48b40 2036114615 C Ii:1:066:1 0:4 18 = 20008c0e 00000000 00001c02 00000000 43f2
ffff8ca190c48b40 2036114619 S Ii:1:066:1 -115:4 64 <
ffff8ca190c48b40 2036122617 C Ii:1:066:1 0:4 18 = 20008d0e 00000000 0000cf01 00000000 43f2
ffff8ca190c48b40 2036122625 S Ii:1:066:1 -115:4 64 <
ffff8ca190c48b40 2036134618 C Ii:1:066:1 0:4 18 = 20008e0e 00000000 0000f601 00000000 43f2
ffff8ca190c48b40 2036134623 S Ii:1:066:1 -115:4 64 <
ffff8ca190c48b40 2036154754 C Ii:1:066:1 0:4 18 = 20008f0e 00000000 00001c02 00000000 6af2
ffff8ca190c48b40 2036154759 S Ii:1:066:1 -115:4 64 <
ffff8ca190c48b40 2036162617 C Ii:1:066:1 0:4 18 = 2000900e 00000000 0000f601 00000000 6af2
ffff8ca190c48b40 2036162621 S Ii:1:066:1 -115:4 64 <
ffff8ca190c48b40 2036174617 C Ii:1:066:1 0:4 18 = 2000910e 00000000 00001c02 00000000 1df2
ffff8ca190c48b40 2036174622 S Ii:1:066:1 -115:4 64 <
ffff8ca190c48b40 2036182616 C Ii:1:066:1 0:4 18 = 2000920e 00000000 0000cf01 00000000 43f2
ffff8ca190c48b40 2036182621 S Ii:1:066:1 -115:4 64 <
ffff8ca190c48b40 2036194618 C Ii:1:066:1 0:4 18 = 2000930e 00000000 0000f601 00000000 a9f1
ffff8ca190c48b40 2036194625 S Ii:1:066:1 -115:4 64 <
ffff8ca190c48b40 2036202618 C Ii:1:066:1 0:4 18 = 2000940e 00000000 0000f601 00000000 43f2
ffff8ca190c48b40 2036202623 S Ii:1:066:1 -115:4 64 <
ffff8ca1aa7de900 2036208616 C Ii:1:063:3 0:1 30 = 01010000 00000000 00000000 00000000 00000000 00000000 00000000 0000
ffff8ca1aa7de900 2036208646 S Ii:1:063:3 -115:1 30 <
ffff8ca190c48b40 2036214619 C Ii:1:066:1 0:4 18 = 2000950e 00000000 0000f601 00000000 6af2
ffff8ca190c48b40 2036214624 S Ii:1:066:1 -115:4 64 <
ffff8ca190c48b40 2036222618 C Ii:1:066:1 0:4 18 = 2000960e 00000000 0000cf01 00000000 43f2
ffff8ca190c48b40 2036222623 S Ii:1:066:1 -115:4 64 <
ffff8ca190c48b40 2036234618 C Ii:1:066:1 0:4 18 = 2000970e 00000000 00001c02 00000000 6af2
ffff8ca190c48b40 2036234623 S Ii:1:066:1 -115:4 64 <
ffff8ca190c48b40 2036242619 C Ii:1:066:1 0:4 18 = 2000980e 00000000 00001c02 00000000 1df2
ffff8ca190c48b40 2036242622 S Ii:1:066:1 -115:4 64 <
ffff8ca190c48b40 2036254732 C Ii:1:066:1 0:4 18 = 2000990e 00000000 0000f601 00000000 6af2
ffff8ca190c48b40 2036254737 S Ii:1:066:1 -115:4 64 <
ffff8ca190c48b40 2036262619 C Ii:1:066:1 0:4 18 = 20009a0e 00000000 0000f601 00000000 43f2
ffff8ca190c48b40 2036262623 S Ii:1:066:1 -115:4 64 <
ffff8ca190c48b40 2036274619 C Ii:1:066:1 0:4 18 = 20009b0e 00000000 0000f601 00000000 6af2
ffff8ca190c48b40 2036274623 S Ii:1:066:1 -115:4 64 <
ffff8ca190c48b40 2036282619 C Ii:1:066:1 0:4 18 = 20009c0e 00000000 0000cf01 00000000 1df2
ffff8ca190c48b40 2036282623 S Ii:1:066:1 -115:4 64 <
ffff8ca190c48b40 2036294620 C Ii:1:066:1 0:4 18 = 20009d0e 00000000 0000f601 00000000 43f2
ffff8ca190c48b40 2036294624 S Ii:1:066:1 -115:4 64 <
ffff8ca190c48b40 2036314621 C Ii:1:066:1 0:4 18 = 20009e0e 00000000 0000cf01 00000000 43f2
ffff8ca190c48b40 2036314625 S Ii:1:066:1 -115:4 64 <
ffff8ca190c48b40 2036322621 C Ii:1:066:1 0:4 18 = 20009f0e 00000000 0000cf01 00000000 1df2
ffff8ca190c48b40 2036322624 S Ii:1:066:1 -115:4 64 <
ffff8ca190c48b40 2036334718 C Ii:1:066:1 0:4 18 = 2000a00e 00000000 0000f601 00000000 1df2
ffff8ca190c48b40 2036334723 S Ii:1:066:1 -115:4 64 <
ffff8ca190c48b40 2036354698 C Ii:1:066:1 0:4 18 = 2000a10e 00000000 00001c02 00000000 43f2
ffff8ca190c48b40 2036354702 S Ii:1:066:1 -115:4 64 <
ffff8ca18168fd80 2036354725 S Io:1:101:1 -115:1 32 = 5508c20e 0310013d 1a059d00 00000000 00000000 00000000 00000000 00000000
ffff8ca18168fd80 2036355768 C Io:1:101:1 0:1 32 >
ffff8ca190c48b40 2036362622 C Ii:1:066:1 0:4 18 = 2000a20e 00000000 0000f601 00000000 f6f1
ffff8ca190c48b40 2036362626 S Ii:1:066:1 -115:4 64 <
ffff8ca190c48b40 2036374623 C Ii:1:066:1 0:4 18 = 2000a30e 00000000 0000cf01 00000000 43f2
ffff8ca190c48b40 2036374628 S Ii:1:066:1 -115:4 64 <
ffff8ca190c48b40 2036382623 C Ii:1:066:1 0:4 18 = 2000a40e 00000000 0000a901 00000000 43f2
ffff8ca190c48b40 2036382627 S Ii:1:066:1 -115:4 64 <
ffff8ca193a3d180 2036385772 C Ii:1:101:1 0:1 32 = 55010e64 00000000 00000000 00000000 00000000 00000000 00000000 00000000
ffff8ca180d23600 2036386684 S Ii:1:101:1 -115:1 32 <
ffff8ca190c48b40 2036394624 C Ii:1:066:1 0:4 18 = 2000a50e 00000000 0000f601 00000000 1df2
ffff8ca190c48b40 2036394629 S Ii:1:066:1 -115:4 64 <
ffff8ca190c48b40 2036402624 C Ii:1:066:1 0:4 18 = 2000a60e 00000000 0000cf01 00000000 43f2
ffff8ca190c48b40 2036402628 S Ii:1:066:1 -115:4 64 <
ffff8ca190c48b40 2036422627 C Ii:1:066:1 0:4 18 = 2000a70e 00000000 0000cf01 00000000 6af2
ffff8ca190c48b40 2036422633 S Ii:1:066:1 -115:4 64 <
ffff8ca190c48b40 2036434626 C Ii:1:066:1 0:4 18 = 2000a80e 00000000 00001c02 00000000 43f2
ffff8ca190c48b40 2036434631 S Ii:1:066:1 -115:4 64 <
ffff8ca190c48b40 2036442628 C Ii:1:066:1 0:4 18 = 2000a90e 00000000 0000cf01 00000000 f6f1
ffff8ca190c48b40 2036442633 S Ii:1:066:1 -115:4 64 <
ffff8ca190c48b40 2036454710 C Ii:1:066:1 0:4 18 = 2000aa0e 00000000 0000f601 00000000 1df2
ffff8ca190c48b40 2036454715 S Ii:1:066:1 -115:4 64 <
ffff8ca190c48b40 2036462627 C Ii:1:066:1 0:4 18 = 2000ab0e 00000000 0000f601 00000000 43f2
ffff8ca190c48b40 2036462631 S Ii:1:066:1 -115:4 64 <
ffff8ca190c48b40 2036474626 C Ii:1:066:1 0:4 18 = 2000ac0e 00000000 00004302 00000000 43f2
ffff8ca190c48b40 2036474632 S Ii:1:066:1 -115:4 64 <
ffff8ca190c48b40 2036482627 C Ii:1:066:1 0:4 18 = 2000ad0e 00000000 0000f601 00000000 6af2
ffff8ca190c48b40 2036482631 S Ii:1:066:1 -115:4 64 <
ffff8ca190c48b40 2036494627 C Ii:1:066:1 0:4 18 = 2000ae0e 00000000 00001c02 00000000 43f2
ffff8ca190c48b40 2036494635 S Ii:1:066:1 -115:4 64 <
ffff8ca190c48b40 2036502627 C Ii:1:066:1 0:4 18 = 2000af0e 00000000 0000cf01 00000000 91f2
ffff8ca190c48b40 2036502632 S Ii:1:066:1 -115:4 64 <
ffff8ca190c48b40 2036514627 C Ii:1:066:1 0:4 18 = 2000b00e 00000000 0000cf01 00000000 1df2
ffff8ca190c48b40 2036514633 S Ii:1:066:1 -115:4 64 <
ffff8ca190c48b40 2036522627 C Ii:1:066:1 0:4 18 = 2000b10e 00000000 00001c02 00000000 43f2
ffff8ca190c48b40 2036522633 S Ii:1:066:1 -115:4 64 <
ffff8ca190c48b40 2036534629 C Ii:1:066:1 0:4 18 = 2000b20e 00000000 0000f601 00000000 1df2
ffff8ca190c48b40 2036534633 S Ii:1:066:1 -115:4 64 <
ffff8ca190c48b40 2036542628 C Ii:1:066:1 0:4 18 = 2000b30e 00000000 0000f601 00000000 6af2
ffff8ca190c48b40 2036542634 S Ii:1:066:1 -115:4 64 <
ffff8ca190c48b40 2036554794 C Ii:1:066:1 0:4 18 = 2000b40e 00000000 0000f601 00000000 1df2
ffff8ca190c48b40 2036554799 S Ii:1:066:1 -115:4 64 <
ffff8ca190c48b40 2036574630 C Ii:1:066:1 0:4 18 = 2000b50e 00000000 0000f601 00000000 f6f1
ffff8ca190c48b40 2036574634 S Ii:1:066:1 -115:4 64 <
ffff8ca190c48b40 2036582630 C Ii:1:066:1 0:4 18 = 2000b60e 00000000 0000cf01 00000000 6af2
ffff8ca190c48b40 2036582634 S Ii:1:066:1 -115:4 64 <
ffff8ca190c48b40 2036594634 C Ii:1:066:1 0:4 18 = 2000b70e 00000000 00001c02 00000000 6af2
ffff8ca190c48b40 2036594639 S Ii:1:066:1 -115:4 64 <
ffff8ca190c48b40 2036602801 C Ii:1:066:1 0:4 18 = 2000b80e 00000000 0000cf01 00000000 1df2
ffff8ca190c48b40 2036602804 S Ii:1:066:1 -115:4 64 <
ffff8ca190c48b40 2036614631 C Ii:1:066:1 0:4 18 = 2000b90e 00000000 00004302 00000000 43f2
ffff8ca190c48b40 2036614636 S Ii:1:066:1 -115:4 64 <
ffff8ca190c48b40 2036622631 C Ii:1:066:1 0:4 18 = 2000ba0e 00000000 0000a901 00000000 43f2
ffff8ca190c48b40 2036622635 S Ii:1:066:1 -115:4 64 <
ffff8ca190c48b40 2036634988 C Ii:1:066:1 0:4 18 = 2000bb0e 00000000 0000f601 00000000 43f2
ffff8ca190c48b40 2036634992 S Ii:1:066:1 -115:4 64 <
ffff8ca190c48b40 2036642633 C Ii:1:066:1 0:4 18 = 2000bc0e 00000000 00001c02 00000000 1df2
ffff8ca190c48b40 2036642637 S Ii:1:066:1 -115:4 64 <
ffff8ca190c48b40 2036654658 C Ii:1:066:1 0:4 18 = 2000bd0e 00000000 0000cf01 00000000 1df2
ffff8ca190c48b40 2036654663 S Ii:1:066:1 -115:4 64 <
ffff8ca190c48b40 2036662632 C Ii:1:066:1 0:4 18 = 2000be0e 00000000 0000f601 00000000 6af2
ffff8ca190c48b40 2036662637 S Ii:1:066:1 -115:4 64 <
ffff8ca190c48b40 2036674633 C Ii:1:066:1 0:4 18 = 2000bf0e 00000000 00001c02 00000000 1df2
ffff8ca190c48b40 2036674638 S Ii:1:066:1 -115:4 64 <
ffff8ca190c48b40 2036682632 C Ii:1:066:1 0:4 18 = 2000c00e 00000000 0000cf01 00000000 f6f1
ffff8ca190c48b40 2036682636 S Ii:1:066:1 -115:4 64 <
ffff8ca190c48b40 2036694636 C Ii:1:066:1 0:4 18 = 2000c10e 00000000 0000f601 00000000 6af2
ffff8ca190c48b40 2036694645 S Ii:1:066:1 -115:4 64 <
ffff8ca190c48b40 2036702634 C Ii:1:066:1 0:4 18 = 2000c20e 00000000 0000cf01 00000000 43f2
ffff8ca190c48b40 2036702640 S Ii:1:066:1 -115:4 64 <
ffff8ca190c48b40 2036714635 C Ii:1:066:1 0:4 18 = 2000c30e 00000000 0000f601 00000000 91f2
ffff8ca190c48b40 2036714641 S Ii:1:066:1 -115:4 64 <
ffff8ca190c48b40 2036722633 C Ii:1:066:1 0:4 18 = 2000c40e 00000000 0000f601 00000000 f6f1
ffff8ca190c48b40 2036722639 S Ii:1:066:1 -115:4 64 <
ffff8ca190c48b40 2036734635 C Ii:1:066:1 0:4 18 = 2000c50e 00000000 0000cf01 00000000 43f2
ffff8ca190c48b40 2036734641 S Ii:1:066:1 -115:4 64 <
ffff8ca190c48b40 2036742635 C Ii:1:066:1 0:4 18 = 2000c60e 00000000 0000f601 00000000 1df2
ffff8ca190c48b40 2036742640 S Ii:1:066:1 -115:4 64 <
ffff8ca190c48b40 2036754696 C Ii:1:066:1 0:4 8 = 0320a304 80010000
ffff8ca190c48b40 2036754699 S Ii:1:066:1 -115:4 64 <
ffff8ca190c48b40 2036758635 C Ii:1:066:1 0:4 18 = 2000c70e 00000000 0000f601 00000000 6af2
ffff8ca190c48b40 2036758639 S Ii:1:066:1 -115:4 64 <
ffff8ca190c48b40 2036774635 C Ii:1:066:1 0:4 18 = 2000c80e 00000000 0000cf01 00000000 43f2
ffff8ca190c48b40 2036774640 S Ii:1:066:1 -115:4 64 <
ffff8ca190c48b40 2036782636 C Ii:1:066:1 0:4 18 = 2000c90e 00000000 0000cf01 00000000 6af2
ffff8ca190c48b40 2036782642 S Ii:1:066:1 -115:4 64 <
ffff8ca190c48b40 2036794637 C Ii:1:066:1 0:4 18 = 2000ca0e 00000000 0000f601 00000000 1df2
ffff8ca190c48b40 2036794642 S Ii:1:066:1 -115:4 64 <
ffff8ca190c48b40 2036802637 C Ii:1:066:1 0:4 18 = 2000cb0e 00000000 0000cf01 00000000 f6f1
ffff8ca190c48b40 2036802643 S Ii:1:066:1 -115:4 64 <
ffff8ca190c48b40 2036814637 C Ii:1:066:1 0:4 18 = 2000cc0e 00000000 00001c02 00000000 43f2
ffff8ca190c48b40 2036814643 S Ii:1:066:1 -115:4 64 <
ffff8ca190c48b40 2036822638 C Ii:1:066:1 0:4 18 = 2000cd0e 00000000 0000f601 00000000 1df2
ffff8ca190c48b40 2036822643 S Ii:1:066:1 -115:4 64 <
ffff8ca190c48b40 2036834638 C Ii:1:066:1 0:4 18 = 2000ce0e 00000000 0000cf01 00000000 1df2
ffff8ca190c48b40 2036834644 S Ii:1:066:1 -115:4 64 <
ffff8ca190c48b40 2036842637 C Ii:1:066:1 0:4 18 = 2000cf0e 00000000 0000cf01 00000000 43f2
ffff8ca190c48b40 2036842642 S Ii:1:066:1 -115:4 64 <
ffff8ca190c48b40 2036854648 C Ii:1:066:1 0:4 18 = 2000d00e 00000000 0000f601 00000000 43f2
ffff8ca190c48b40 2036854652 S Ii:1:066:1 -115:4 64 <
ffff8ca190c48b40 2036862639 C Ii:1:066:1 0:4 18 = 2000d10e 00000000 0000f601 00000000 6af2
ffff8ca190c48b40 2036862643 S Ii:1:066:1 -115:4 64 <
ffff8ca190c48b40 2036874638 C Ii:1:066:1 0:4 18 = 2000d20e 00000000 0000f601 00000000 43f2
ffff8ca190c48b40 2036874641 S Ii:1:066:1 -115:4 64 <
ffff8ca190c48b40 2036882639 C Ii:1:066:1 0:4 18 = 2000d30e 00000000 0000cf01 00000000 1df2
ffff8ca190c48b40 2036882642 S Ii:1:066:1 -115:4 64 <
ffff8ca190c48b40 2036894640 C Ii:1:066:1 0:4 18 = 2000d40e 00000000 00004302 00000000 43f2
ffff8ca190c48b40 2036894644 S Ii:1:066:1 -115:4 64 <
ffff8ca190c48b40 2036902639 C Ii:1:066:1 0:4 18 = 2000d50e 00000000 0000f601 00000000 f6f1
ffff8ca190c48b40 2036902642 S Ii:1:066:1 -115:4 64 <
ffff8ca190c48b40 2036914641 C Ii:1:066:1 0:4 18 = 2000d60e 00000000 0000cf01 00000000 43f2
ffff8ca190c48b40 2036914646 S Ii:1:066:1 -115:4 64 <
ffff8ca193a3d240 2036921295 S Io:1:101:1 -115:1 32 = 5508c20f 031001f4 6916b500 00000000 00000000 00000000 00000000 00000000
ffff8ca193a3d240 2036921786 C Io:1:101:1 0:1 32 >
ffff8ca190c48b40 2036922639 C Ii:1:066:1 0:4 18 = 2000d70e 00000000 0000f601 00000000 43f2
ffff8ca190c48b40 2036922642 S Ii:1:066:1 -115:4 64 <
ffff8ca190c48b40 2036934641 C Ii:1:066:1 0:4 18 = 2000d80e 00000000 0000cf01 00000000 6af2
ffff8ca190c48b40 2036934644 S Ii:1:066:1 -115:4 64 <
ffff8ca190c48b40 2036942641 C Ii:1:066:1 0:4 18 = 2000d90e 00000000 0000f601 00000000 6af2
ffff8ca190c48b40 2036942645 S Ii:1:066:1 -115:4 64 <
ffff8ca190c48b40 2036954871 C Ii:1:066:1 0:4 18 = 2000da0e 00000000 0000f601 00000000 43f2
ffff8ca190c48b40 2036954876 S Ii:1:066:1 -115:4 64 <
ffff8ca180d23600 2036955789 C Ii:1:101:1 0:1 32 = 55010f65 00000000 00000000 00000000 00000000 00000000 00000000 00000000
ffff8ca19382d600 2036956317 S Ii:1:101:1 -115:1 32 <
ffff8ca190c48b40 2036962642 C Ii:1:066:1 0:4 18 = 2000db0e 00000000 0000f601 00000000 91f2
ffff8ca190c48b40 2036962646 S Ii:1:066:1 -115:4 64 <
ffff8ca190c48b40 2036974643 C Ii:1:066:1 0:4 18 = 2000dc0e 00000000 00001c02 00000000 1df2
ffff8ca190c48b40 2036974650 S Ii:1:066:1 -115:4 64 <
ffff8ca190c48b40 2036982644 C Ii:1:066:1 0:4 18 = 2000dd0e 00000000 0000cf01 00000000 1df2
ffff8ca190c48b40 2036982650 S Ii:1:066:1 -115:4 64 <
ffff8ca190c48b40 2036994644 C Ii:1:066:1 0:4 18 = 2000de0e 00000000 0000f601 00000000 f6f1
ffff8ca190c48b40 2036994650 S Ii:1:066:1 -115:4 64 <
ffff8ca190c48b40 2037022646 C Ii:1:066:1 0:4 18 = 2000df0e 00000000 0000f601 00000000 43f2
ffff8ca190c48b40 2037022653 S Ii:1:066:1 -115:4 64 <
ffff8ca190c48b40 2037042646 C Ii:1:066:1 0:4 18 = 2000e00e 00000000 0000cf01 00000000 1df2
ffff8ca190c48b40 2037042652 S Ii:1:066:1 -115:4 64 <
ffff8ca190c48b40 2037054649 C Ii:1:066:1 0:4 18 = 2000e10e 00000000 0000cf01 00000000 6af2
ffff8ca190c48b40 2037054654 S Ii:1:066:1 -115:4 64 <
ffff8ca190c48b40 2037062645 C Ii:1:066:1 0:4 18 = 2000e20e 00000000 0000cf01 00000000 f6f1
ffff8ca190c48b40 2037062649 S Ii:1:066:1 -115:4 64 <
ffff8ca190c48b40 2037074646 C Ii:1:066:1 0:4 18 = 2000e30e 00000000 0000f601 00000000 43f2
ffff8ca190c48b40 2037074651 S Ii:1:066:1 -115:4 64 <
ffff8ca190c48b40 2037082647 C Ii:1:066:1 0:4 18 = 2000e40e 00000000 0000cf01 00000000 43f2
ffff8ca190c48b40 2037082652 S Ii:1:066:1 -115:4 64 <
ffff8ca190c48b40 2037094647 C Ii:1:066:1 0:4 18 = 2000e50e 00000000 0000cf01 00000000 1df2
ffff8ca190c48b40 2037094653 S Ii:1:066:1 -115:4 64 <
ffff8ca190c48b40 2037102646 C Ii:1:066:1 0:4 18 = 2000e60e 00000000 0000f601 00000000 6af2
ffff8ca190c48b40 2037102651 S Ii:1:066:1 -115:4 64 <
ffff8ca190c48b40 2037114647 C Ii:1:066:1 0:4 18 = 2000e70e 00000000 0000f601 00000000 1df2
ffff8ca190c48b40 2037114651 S Ii:1:066:1 -115:4 64 <
ffff8ca190c48b40 2037122647 C Ii:1:066:1 0:4 18 = 2000e80e 00000000 00001c02 00000000 6af2
ffff8ca190c48b40 2037122651 S Ii:1:066:1 -115:4 64 <
ffff8ca190c48b40 2037134648 C Ii:1:066:1 0:4 18 = 2000e90e 00000000 0000cf01 00000000 43f2
ffff8ca190c48b40 2037134652 S Ii:1:066:1 -115:4 64 <
ffff8ca190c48b40 2037142648 C Ii:1:066:1 0:4 18 = 2000ea0e 00000000 0000f601 00000000 43f2
ffff8ca190c48b40 2037142652 S Ii:1:066:1 -115:4 64 <
ffff8ca190c48b40 2037154660 C Ii:1:066:1 0:4 18 = 2000eb0e 00000000 0000f601 00000000 6af2
ffff8ca190c48b40 2037154663 S Ii:1:066:1 -115:4 64 <
ffff8ca190c48b40 2037174649 C Ii:1:066:1 0:4 18 = 2000ec0e 00000000 0000f601 00000000 1df2
ffff8ca190c48b40 2037174655 S Ii:1:066:1 -115:4 64 <
ffff8ca190c48b40 2037182649 C Ii:1:066:1 0:4 18 = 2000ed0e 00000000 0000cf01 00000000 43f2
ffff8ca190c48b40 2037182653 S Ii:1:066:1 -115:4 64 <
ffff8ca190c48b40 2037194650 C Ii:1:066:1 0:4 18 = 2000ee0e 00000000 0000f601 00000000 f6f1
ffff8ca190c48b40 2037194656 S Ii:1:066:1 -115:4 64 <
ffff8ca190c48b40 2037202668 C Ii:1:066:1 0:4 18 = 2000ef0e 00000000 0000f601 00000000 43f2
ffff8ca190c48b40 2037202671 S Ii:1:066:1 -115:4 64 <
ffff8ca190c48b40 2037214649 C Ii:1:066:1 0:4 18 = 2000f00e 00000000 00001c02 00000000 43f2
ffff8ca190c48b40 2037214653 S Ii:1:066:1 -115:4 64 <
ffff8ca190c48b40 2037222650 C Ii:1:066:1 0:4 18 = 2000f10e 00000000 0000f601 00000000 cff1
ffff8ca190c48b40 2037222654 S Ii:1:066:1 -115:4 64 <
ffff8ca190c48b40 2037234650 C Ii:1:066:1 0:4 18 = 2000f20e 00000000 0000f601 00000000 43f2
ffff8ca190c48b40 2037234654 S Ii:1:066:1 -115:4 64 <
ffff8ca190c48b40 2037242651 C Ii:1:066:1 0:4 18 = 2000f30e 00000000 0000f601 00000000 1df2
ffff8ca190c48b40 2037242654 S Ii:1:066:1 -115:4 64 <
ffff8ca190c48b40 2037262656 C Ii:1:066:1 0:4 18 = 2000f40e 00000000 0000cf01 00000000 1df2
ffff8ca190c48b40 2037262663 S Ii:1:066:1 -115:4 64 <
ffff8ca190c48b40 2037274652 C Ii:1:066:1 0:4 18 = 2000f50e 00000000 00001c02 00000000 43f2
ffff8ca190c48b40 2037274657 S Ii:1:066:1 -115:4 64 <
ffff8ca190c48b40 2037282656 C Ii:1:066:1 0:4 18 = 2000f60e 00000000 0000cf01 00000000 43f2
ffff8ca190c48b40 2037282659 S Ii:1:066:1 -115:4 64 <
ffff8ca190c48b40 2037294655 C Ii:1:066:1 0:4 18 = 2000f70e 00000000 0000f601 00000000 1df2
ffff8ca190c48b40 2037294662 S Ii:1:066:1 -115:4 64 <
ffff8ca190c48b40 2037322654 C Ii:1:066:1 0:4 18 = 2000f80e 00000000 0000cf01 00000000 1df2
ffff8ca190c48b40 2037322659 S Ii:1:066:1 -115:4 64 <
ffff8ca190c48b40 2037334916 C Ii:1:066:1 0:4 18 = 2000f90e 00000000 0000cf01 00000000 cff1
ffff8ca190c48b40 2037335127 S Ii:1:066:1 -115:4 64 <
ffff8ca190c48b40 2037342653 C Ii:1:066:1 0:4 18 = 2000fa0e 00000000 0000f601 00000000 43f2
ffff8ca190c48b40 2037342658 S Ii:1:066:1 -115:4 64 <
ffff8ca190c48b40 2037354656 C Ii:1:066:1 0:4 18 = 2000fb0e 00000000 0000cf01 00000000 43f2
ffff8ca190c48b40 2037354660 S Ii:1:066:1 -115:4 64 <
ffff8ca190c48b40 2037362655 C Ii:1:066:1 0:4 18 = 2000fc0e 00000000 0000f601 00000000 6af2
ffff8ca190c48b40 2037362659 S Ii:1:066:1 -115:4 64 <
ffff8ca190c48b40 2037374655 C Ii:1:066:1 0:4 18 = 2000fd0e 00000000 0000cf01 00000000 43f2
ffff8ca190c48b40 2037374660 S Ii:1:066:1 -115:4 64 <
ffff8ca190c48b40 2037382656 C Ii:1:066:1 0:4 18 = 2000fe0e 00000000 0000f601 00000000 6af2
ffff8ca190c48b40 2037382660 S Ii:1:066:1 -115:4 64 <
ffff8ca190c48b40 2037394657 C Ii:1:066:1 0:4 18 = 2000ff0e 00000000 0000cf01 00000000 f6f1
ffff8ca190c48b40 2037394662 S Ii:1:066:1 -115:4 64 <
ffff8ca190c48b40 2037402657 C Ii:1:066:1 0:4 18 = 2000010e 00000000 0000f601 00000000 43f2
ffff8ca190c48b40 2037402661 S Ii:1:066:1 -115:4 64 <
ffff8ca190c48b40 2037414656 C Ii:1:066:1 0:4 18 = 2000020e 00000000 0000cf01 00000000 6af2
ffff8ca190c48b40 2037414662 S Ii:1:066:1 -115:4 64 <
ffff8ca190c48b40 2037422656 C Ii:1:066:1 0:4 18 = 2000030e 00000000 0000cf01 00000000 cff1
ffff8ca190c48b40 2037422660 S Ii:1:066:1 -115:4 64 <
ffff8ca190c48b40 2037434657 C Ii:1:066:1 0:4 18 = 2000040e 00000000 0000f601 00000000 43f2
ffff8ca190c48b40 2037434660 S Ii:1:066:1 -115:4 64 <
ffff8ca18168f540 2037454655 S Io:1:101:1 -115:1 32 = 5508c210 0310013d 1a059f00 00000000 00000000 00000000 00000000 00000000
ffff8ca190c48b40 2037454658 C Ii:1:066:1 0:4 18 = 2000050e 00000000 0000cf01 00000000 43f2
ffff8ca190c48b40 2037454663 S Ii:1:066:1 -115:4 64 <
ffff8ca18168f540 2037454806 C Io:1:101:1 0:1 32 >
ffff8ca190c48b40 2037462658 C Ii:1:066:1 0:4 18 = 2000060e 00000000 0000f601 00000000 1df2
ffff8ca190c48b40 2037462663 S Ii:1:066:1 -115:4 64 <
ffff8ca190c48b40 2037474658 C Ii:1:066:1 0:4 18 = 2000070e 00000000 00001c02 00000000 43f2
ffff8ca190c48b40 2037474663 S Ii:1:066:1 -115:4 64 <
ffff8ca190c48b40 2037482660 C Ii:1:066:1 0:4 18 = 2000080e 00000000 00001c02 00000000 1df2
ffff8ca190c48b40 2037482665 S Ii:1:066:1 -115:4 64 <
ffff8ca19382d600 2037486805 C Ii:1:101:1 0:1 32 = 55011066 00000000 00000000 00000000 00000000 00000000 00000000 00000000
ffff8ca180d23a80 2037487910 S Ii:1:101:1 -115:1 32 <
ffff8ca190c48b40 2037494659 C Ii:1:066:1 0:4 18 = 2000090e 00000000 0000f601 00000000 43f2
ffff8ca190c48b40 2037494662 S Ii:1:066:1 -115:4 64 <
ffff8ca190c48b40 2037502659 C Ii:1:066:1 0:4 18 = 20000a0e 00000000 00001c02 00000000 6af2
ffff8ca190c48b40 2037502663 S Ii:1:066:1 -115:4 64 <
ffff8ca190c48b40 2037514659 C Ii:1:066:1 0:4 18 = 20000b0e 00000000 00001c02 00000000 43f2
ffff8ca190c48b40 2037514664 S Ii:1:066:1 -115:4 64 <
ffff8ca190c48b40 2037522659 C Ii:1:066:1 0:4 18 = 20000c0e 00000000 00001c02 00000000 1df2
ffff8ca190c48b40 2037522662 S Ii:1:066:1 -115:4 64 <
ffff8ca190c48b40 2037534660 C Ii:1:066:1 0:4 18 = 20000d0e 00000000 0000cf01 00000000 91f2
ffff8ca190c48b40 2037534665 S Ii:1:066:1 -115:4 64 <
ffff8ca190c48b40 2037542660 C Ii:1:066:1 0:4 18 = 20000e0e 00000000 0000a901 00000000 1df2
ffff8ca190c48b40 2037542664 S Ii:1:066:1 -115:4 64 <
ffff8ca190c48b40 2037554661 C Ii:1:066:1 0:4 18 = 20000f0e 00000000 0000cf01 00000000 1df2
ffff8ca190c48b40 2037554666 S Ii:1:066:1 -115:4 64 <
ffff8ca190c48b40 2037562661 C Ii:1:066:1 0:4 18 = 2000100e 00000000 0000cf01 00000000 43f2
ffff8ca190c48b40 2037562667 S Ii:1:066:1 -115:4 64 <
ffff8ca190c48b40 2037574662 C Ii:1:066:1 0:4 18 = 2000110e 00000000 0000f601 00000000 1df2
ffff8ca190c48b40 2037574668 S Ii:1:066:1 -115:4 64 <
ffff8ca190c48b40 2037582662 C Ii:1:066:1 0:4 18 = 2000120e 00000000 0000cf01 00000000 43f2
ffff8ca190c48b40 2037582666 S Ii:1:066:1 -115:4 64 <
ffff8ca190c48b40 2037594664 C Ii:1:066:1 0:4 18 = 2000130e 00000000 0000cf01 00000000 f6f1
ffff8ca190c48b40 2037594669 S Ii:1:066:1 -115:4 64 <
ffff8ca190c48b40 2037602663 C Ii:1:066:1 0:4 18 = 2000140e 00000000 0000f601 00000000 6af2
ffff8ca190c48b40 2037602667 S Ii:1:066:1 -115:4 64 <
ffff8ca190c48b40 2037614665 C Ii:1:066:1 0:4 18 = 2000150e 00000000 0000cf01 00000000 6af2
ffff8ca190c48b40 2037614669 S Ii:1:066:1 -115:4 64 <
ffff8ca190c48b40 2037622665 C Ii:1:066:1 0:4 18 = 2000160e 00000000 00001c02 00000000 1df2
ffff8ca190c48b40 2037622670 S Ii:1:066:1 -115:4 64 <
ffff8ca190c48b40 2037635169 C Ii:1:066:1 0:4 18 = 2000170e 00000000 0000f601 00000000 43f2
ffff8ca190c48b40 2037635174 S Ii:1:066:1 -115:4 64 <
ffff8ca190c48b40 2037642663 C Ii:1:066:1 0:4 18 = 2000180e 00000000 0000cf01 00000000 91f2
ffff8ca190c48b40 2037642668 S Ii:1:066:1 -115:4 64 <
ffff8ca190c48b40 2037654675 C Ii:1:066:1 0:4 18 = 2000190e 00000000 0000cf01 00000000 1df2
ffff8ca190c48b40 2037654679 S Ii:1:066:1 -115:4 64 <
ffff8ca190c48b40 2037662664 C Ii:1:066:1 0:4 18 = 20001a0e 00000000 0000f601 00000000 1df2
ffff8ca190c48b40 2037662667 S Ii:1:066:1 -115:4 64 <
ffff8ca190c48b40 2037674664 C Ii:1:066:1 0:4 18 = 20001b0e 00000000 0000f601 00000000 6af2
ffff8ca190c48b40 2037674668 S Ii:1:066:1 -115:4 64 <
ffff8ca190c48b40 2037682665 C Ii:1:066:1 0:4 18 = 20001c0e 00000000 0000f601 00000000 f6f1
ffff8ca190c48b40 2037682669 S Ii:1:066:1 -115:4 64 <
ffff8ca190c48b40 2037694666 C Ii:1:066:1 0:4 18 = 20001d0e 00000000 0000f601 00000000 43f2
ffff8ca190c48b40 2037694669 S Ii:1:066:1 -115:4 64 <
ffff8ca190c48b40 2037714666 C Ii:1:066:1 0:4 18 = 20001e0e 00000000 0000cf01 00000000 43f2
ffff8ca190c48b40 2037714670 S Ii:1:066:1 -115:4 64 <
ffff8ca190c48b40 2037722667 C Ii:1:066:1 0:4 18 = 20001f0e 00000000 0000f601 00000000 43f2
ffff8ca190c48b40 2037722671 S Ii:1:066:1 -115:4 64 <
ffff8ca190c48b40 2037734666 C Ii:1:066:1 0:4 18 = 2000200e 00000000 0000cf01 00000000 6af2
ffff8ca190c48b40 2037734670 S Ii:1:066:1 -115:4 64 <
ffff8ca190c48b40 2037742667 C Ii:1:066:1 0:4 18 = 2000210e 00000000 0000a901 00000000 43f2
ffff8ca190c48b40 2037742671 S Ii:1:066:1 -115:4 64 <
ffff8ca190c48b40 2037754686 C Ii:1:066:1 0:4 18 = 2000220e 00000000 00001c02 00000000 1df2
ffff8ca190c48b40 2037754690 S Ii:1:066:1 -115:4 64 <
ffff8ca190c48b40 2037762668 C Ii:1:066:1 0:4 18 = 2000230e 00000000 0000f601 00000000 1df2
ffff8ca190c48b40 2037762673 S Ii:1:066:1 -115:4 64 <
ffff8ca190c48b40 2037774668 C Ii:1:066:1 0:4 18 = 2000240e 00000000 0000cf01 00000000 a9f1
ffff8ca190c48b40 2037774673 S Ii:1:066:1 -115:4 64 <
ffff8ca190c48b40 2037782668 C Ii:1:066:1 0:4 18 = 2000250e 00000000 00001c02 00000000 1df2
ffff8ca190c48b40 2037782672 S Ii:1:066:1 -115:4 64 <
ffff8ca190c48b40 2037794670 C Ii:1:066:1 0:4 18 = 2000260e 00000000 0000f601 00000000 1df2
ffff8ca190c48b40 2037794675 S Ii:1:066:1 -115:4 64 <
ffff8ca190c48b40 2037822672 C Ii:1:066:1 0:4 18 = 2000270e 00000000 0000f601 00000000 43f2
ffff8ca190c48b40 2037822677 S Ii:1:066:1 -115:4 64 <
ffff8ca190c48b40 2037834873 C Ii:1:066:1 0:4 18 = 2000280e 00000000 0000f601 00000000 6af2
ffff8ca190c48b40 2037834877 S Ii:1:066:1 -115:4 64 <
ffff8ca190c48b40 2037842670 C Ii:1:066:1 0:4 18 = 2000290e 00000000 0000cf01 00000000 43f2
ffff8ca190c48b40 2037842674 S Ii:1:066:1 -115:4 64 <
ffff8ca190c48b40 2037854759 C Ii:1:066:1 0:4 18 = 20002a0e 00000000 0000f601 00000000 43f2
ffff8ca190c48b40 2037854763 S Ii:1:066:1 -115:4 64 <
ffff8ca190c48b40 2037862671 C Ii:1:066:1 0:4 18 = 20002b0e 00000000 0000cf01 00000000 1df2
ffff8ca190c48b40 2037862675 S Ii:1:066:1 -115:4 64 <
ffff8ca190c48b40 2037874672 C Ii:1:066:1 0:4 18 = 20002c0e 00000000 0000f601 00000000 1df2
ffff8ca190c48b40 2037874677 S Ii:1:066:1 -115:4 64 <
ffff8ca190c48b40 2037894673 C Ii:1:066:1 0:4 18 = 20002d0e 00000000 0000f601 00000000 43f2
ffff8ca190c48b40 2037894678 S Ii:1:066:1 -115:4 64 <
ffff8ca190c48b40 2037914674 C Ii:1:066:1 0:4 18 = 20002e0e 00000000 00004302 00000000 1df2
ffff8ca190c48b40 2037914678 S Ii:1:066:1 -115:4 64 <
ffff8ca190c48b40 2037922673 C Ii:1:066:1 0:4 18 = 20002f0e 00000000 0000f601 00000000 cff1
ffff8ca190c48b40 2037922678 S Ii:1:066:1 -115:4 64 <
ffff8ca190c48b40 2037934674 C Ii:1:066:1 0:4 18 = 2000300e 00000000 0000cf01 00000000 43f2
ffff8ca190c48b40 2037934678 S Ii:1:066:1 -115:4 64 <
ffff8ca190c48b40 2037942673 C Ii:1:066:1 0:4 18 = 2000310e 00000000 0000cf01 00000000 1df2
ffff8ca190c48b40 2037942676 S Ii:1:066:1 -115:4 64 <
ffff8ca190c48b40 2037962675 C Ii:1:066:1 0:4 18 = 2000320e 00000000 00001c02 00000000 43f2
ffff8ca190c48b40 2037962681 S Ii:1:066:1 -115:4 64 <
ffff8ca190c48b40 2037974677 C Ii:1:066:1 0:4 18 = 2000330e 00000000 0000f601 00000000 43f2
ffff8ca190c48b40 2037974682 S Ii:1:066:1 -115:4 64 <
ffff8ca190c48b40 2037982675 C Ii:1:066:1 0:4 18 = 2000340e 00000000 0000f601 00000000 1df2
ffff8ca190c48b40 2037982680 S Ii:1:066:1 -115:4 64 <
ffff8ca190c48b40 2037994675 C Ii:1:066:1 0:4 18 = 2000350e 00000000 0000f601 00000000 43f2
ffff8ca190c48b40 2037994680 S Ii:1:066:1 -115:4 64 <
ffff8ca18cf01840 2038021496 S Io:1:101:1 -115:1 32 = 5508c211 031001f4 6916b700 00000000 00000000 00000000 00000000 00000000
ffff8ca18cf01840 2038021825 C Io:1:101:1 0:1 32 >
ffff8ca190c48b40 2038022676 C Ii:1:066:1 0:4 18 = 2000360e 00000000 0000f601 00000000 1df2
ffff8ca190c48b40 2038022681 S Ii:1:066:1 -115:4 64 <
ffff8ca190c48b40 2038034676 C Ii:1:066:1 0:4 18 = 2000370e 00000000 0000cf01 00000000 43f2
ffff8ca190c48b40 2038034680 S Ii:1:066:1 -115:4 64 <
ffff8ca190c48b40 2038054677 C Ii:1:066:1 0:4 18 = 2000380e 00000000 0000cf01 00000000 f6f1
ffff8ca190c48b40 2038054681 S Ii:1:066:1 -115:4 64 <
ffff8ca180d23a80 2038056824 C Ii:1:101:1 0:1 32 = 55011167 00000000 00000000 00000000 00000000 00000000 00000000 00000000
ffff8ca180d23480 2038057514 S Ii:1:101:1 -115:1 32 <
ffff8ca190c48b40 2038062677 C Ii:1:066:1 0:4 18 = 2000390e 00000000 0000cf01 00000000 cff1
ffff8ca190c48b40 2038062681 S Ii:1:066:1 -115:4 64 <
ffff8ca190c48b40 2038074680 C Ii:1:066:1 0:4 18 = 20003a0e 00000000 0000a901 00000000 1df2
ffff8ca190c48b40 2038074689 S Ii:1:066:1 -115:4 64 <
ffff8ca190c48b40 2038082678 C Ii:1:066:1 0:4 18 = 20003b0e 00000000 0000f601 00000000 6af2
ffff8ca190c48b40 2038082682 S Ii:1:066:1 -115:4 64 <
ffff8ca190c48b40 2038094680 C Ii:1:066:1 0:4 18 = 20003c0e 00000000 0000a901 00000000 f6f1
ffff8ca190c48b40 2038094686 S Ii:1:066:1 -115:4 64 <
ffff8ca190c48b40 2038102681 C Ii:1:066:1 0:4 18 = 20003d0e 00000000 0000f601 00000000 f6f1
ffff8ca190c48b40 2038102684 S Ii:1:066:1 -115:4 64 <
ffff8ca190c48b40 2038114679 C Ii:1:066:1 0:4 18 = 20003e0e 00000000 0000f601 00000000 43f2
ffff8ca190c48b40 2038114683 S Ii:1:066:1 -115:4 64 <
ffff8ca190c48b40 2038122681 C Ii:1:066:1 0:4 18 = 20003f0e 00000000 0000cf01 00000000 43f2
ffff8ca190c48b40 2038122685 S Ii:1:066:1 -115:4 64 <
ffff8ca190c48b40 2038134681 C Ii:1:066:1 0:4 18 = 2000400e 00000000 0000cf01 00000000 6af2
ffff8ca190c48b40 2038134685 S Ii:1:066:1 -115:4 64 <
ffff8ca190c48b40 2038142679 C Ii:1:066:1 0:4 18 = 2000410e 00000000 00001c02 00000000 1df2
ffff8ca190c48b40 2038142683 S Ii:1:066:1 -115:4 64 <
ffff8ca190c48b40 2038154680 C Ii:1:066:1 0:4 18 = 2000420e 00000000 0000cf01 00000000 43f2
ffff8ca190c48b40 2038154684 S Ii:1:066:1 -115:4 64 <
ffff8ca190c48b40 2038162681 C Ii:1:066:1 0:4 18 = 2000430e 00000000 00004302 00000000 1df2
ffff8ca190c48b40 2038162685 S Ii:1:066:1 -115:4 64 <
ffff8ca190c48b40 2038174680 C Ii:1:066:1 0:4 18 = 2000440e 00000000 0000cf01 00000000 1df2
ffff8ca190c48b40 2038174685 S Ii:1:066:1 -115:4 64 <
ffff8ca190c48b40 2038182681 C Ii:1:066:1 0:4 18 = 2000450e 00000000 0000a901 00000000 6af2
ffff8ca190c48b40 2038182685 S Ii:1:066:1 -115:4 64 <
ffff8ca190c48b40 2038194682 C Ii:1:066:1 0:4 18 = 2000460e 00000000 0000cf01 00000000 43f2
ffff8ca190c48b40 2038194686 S Ii:1:066:1 -115:4 64 <
ffff8ca190c48b40 2038202681 C Ii:1:066:1 0:4 18 = 2000470e 00000000 0000f601 00000000 43f2
ffff8ca190c48b40 2038202685 S Ii:1:066:1 -115:4 64 <
ffff8ca190c48b40 2038222684 C Ii:1:066:1 0:4 18 = 2000480e 00000000 0000f601 00000000 1df2
ffff8ca190c48b40 2038222689 S Ii:1:066:1 -115:4 64 <
ffff8ca190c48b40 2038234682 C Ii:1:066:1 0:4 18 = 2000490e 00000000 00001c02 00000000 43f2
ffff8ca190c48b40 2038234687 S Ii:1:066:1 -115:4 64 <
ffff8ca190c48b40 2038242683 C Ii:1:066:1 0:4 18 = 20004a0e 00000000 0000f601 00000000 43f2
ffff8ca190c48b40 2038242687 S Ii:1:066:1 -115:4 64 <
ffff8ca190c48b40 2038254701 C Ii:1:066:1 0:4 18 = 20004b0e 00000000 0000f601 00000000 1df2
ffff8ca190c48b40 2038254705 S Ii:1:066:1 -115:4 64 <
ffff8ca190c48b40 2038262683 C Ii:1:066:1 0:4 18 = 20004c0e 00000000 0000cf01 00000000 f6f1
ffff8ca190c48b40 2038262687 S Ii:1:066:1 -115:4 64 <
ffff8ca190c48b40 2038274685 C Ii:1:066:1 0:4 18 = 20004d0e 00000000 0000cf01 00000000 6af2
ffff8ca190c48b40 2038274689 S Ii:1:066:1 -115:4 64 <
ffff8ca190c48b40 2038282684 C Ii:1:066:1 0:4 18 = 20004e0e 00000000 0000f601 00000000 43f2
ffff8ca190c48b40 2038282688 S Ii:1:066:1 -115:4 64 <
ffff8ca190c48b40 2038294685 C Ii:1:066:1 0:4 18 = 20004f0e 00000000 00001c02 00000000 1df2
ffff8ca190c48b40 2038294689 S Ii:1:066:1 -115:4 64 <
ffff8ca190c48b40 2038302685 C Ii:1:066:1 0:4 18 = 2000500e 00000000 0000cf01 00000000 1df2
ffff8ca190c48b40 2038302688 S Ii:1:066:1 -115:4 64 <
ffff8ca190c48b40 2038314685 C Ii:1:066:1 0:4 18 = 2000510e 00000000 0000f601 00000000 1df2
ffff8ca190c48b40 2038314688 S Ii:1:066:1 -115:4 64 <
ffff8ca190c48b40 2038322684 C Ii:1:066:1 0:4 18 = 2000520e 00000000 0000cf01 00000000 1df2
ffff8ca190c48b40 2038322688 S Ii:1:066:1 -115:4 64 <
ffff8ca190c48b40 2038334886 C Ii:1:066:1 0:4 18 = 2000530e 00000000 00001c02 00000000 1df2
ffff8ca190c48b40 2038334892 S Ii:1:066:1 -115:4 64 <
ffff8ca190c48b40 2038342687 C Ii:1:066:1 0:4 18 = 2000540e 00000000 00001c02 00000000 43f2
ffff8ca190c48b40 2038342692 S Ii:1:066:1 -115:4 64 <
ffff8ca190c48b40 2038354716 C Ii:1:066:1 0:4 18 = 2000550e 00000000 0000f601 00000000 43f2
ffff8ca190c48b40 2038354723 S Ii:1:066:1 -115:4 64 <
ffff8ca190c48b40 2038362687 C Ii:1:066:1 0:4 18 = 2000560e 00000000 0000cf01 00000000 43f2
ffff8ca190c48b40 2038362692 S Ii:1:066:1 -115:4 64 <
ffff8ca190c48b40 2038374687 C Ii:1:066:1 0:4 18 = 2000570e 00000000 00004302 00000000 43f2
ffff8ca190c48b40 2038374693 S Ii:1:066:1 -115:4 64 <
ffff8ca190c48b40 2038382688 C Ii:1:066:1 0:4 18 = 2000580e 00000000 0000f601 00000000 43f2
ffff8ca190c48b40 2038382692 S Ii:1:066:1 -115:4 64 <
ffff8ca190c48b40 2038394688 C Ii:1:066:1 0:4 18 = 2000590e 00000000 0000f601 00000000 6af2
ffff8ca190c48b40 2038394692 S Ii:1:066:1 -115:4 64 <
ffff8ca190c48b40 2038402688 C Ii:1:066:1 0:4 18 = 20005a0e 00000000 00001c02 00000000 1df2
ffff8ca190c48b40 2038402695 S Ii:1:066:1 -115:4 64 <
ffff8ca190c48b40 2038414688 C Ii:1:066:1 0:4 18 = 20005b0e 00000000 0000f601 00000000 cff1
ffff8ca190c48b40 2038414693 S Ii:1:066:1 -115:4 64 <
ffff8ca190c48b40 2038422689 C Ii:1:066:1 0:4 18 = 20005c0e 00000000 0000f601 00000000 1df2
ffff8ca190c48b40 2038422694 S Ii:1:066:1 -115:4 64 <
ffff8ca190c48b40 2038434808 C Ii:1:066:1 0:4 18 = 20005d0e 00000000 0000f601 00000000 43f2
ffff8ca190c48b40 2038434813 S Ii:1:066:1 -115:4 64 <
ffff8ca190c48b40 2038454691 C Ii:1:066:1 0:4 18 = 20005e0e 00000000 0000f601 00000000 6af2
ffff8ca190c48b40 2038454696 S Ii:1:066:1 -115:4 64 <
ffff8ca190c48b40 2038462691 C Ii:1:066:1 0:4 18 = 20005f0e 00000000 0000a901 00000000 43f2
ffff8ca190c48b40 2038462695 S Ii:1:066:1 -115:4 64 <
ffff8ca190c48b40 2038474692 C Ii:1:066:1 0:4 18 = 2000600e 00000000 0000f601 00000000 43f2
ffff8ca190c48b40 2038474698 S Ii:1:066:1 -115:4 64 <
ffff8ca190c48b40 2038482691 C Ii:1:066:1 0:4 18 = 2000610e 00000000 0000cf01 00000000 6af2
ffff8ca190c48b40 2038482699 S Ii:1:066:1 -115:4 64 <
ffff8ca190c48b40 2038494692 C Ii:1:066:1 0:4 18 = 2000620e 00000000 0000a901 00000000 43f2
ffff8ca190c48b40 2038494696 S Ii:1:066:1 -115:4 64 <
ffff8ca190c48b40 2038502691 C Ii:1:066:1 0:4 18 = 2000630e 00000000 0000cf01 00000000 f6f1
ffff8ca190c48b40 2038502695 S Ii:1:066:1 -115:4 64 <
ffff8ca190c48b40 2038514692 C Ii:1:066:1 0:4 18 = 2000640e 00000000 0000f601 00000000 43f2
ffff8ca190c48b40 2038514695 S Ii:1:066:1 -115:4 64 <
ffff8ca180ccacc0 2038521549 S Io:1:101:1 -115:1 32 = 5508c212 0310013d 1a05a100 00000000 00000000 00000000 00000000 00000000
ffff8ca180ccacc0 2038521839 C Io:1:101:1 0:1 32 >
ffff8ca190c48b40 2038542694 C Ii:1:066:1 0:4 18 = 2000650e 00000000 00001c02 00000000 1df2
ffff8ca190c48b40 2038542700 S Ii:1:066:1 -115:4 64 <
ffff8ca180d23480 2038550226 C Ii:1:101:1 0:1 32 = 55011268 00000000 00000000 00000000 00000000 00000000 00000000 00000000
ffff8ca19382dc00 2038550655 S Ii:1:101:1 -115:1 32 <
ffff8ca190c48b40 2038554696 C Ii:1:066:1 0:4 18 = 2000660e 00000000 0000cf01 00000000 43f2
ffff8ca190c48b40 2038554700 S Ii:1:066:1 -115:4 64 <
ffff8ca190c48b40 2038562693 C Ii:1:066:1 0:4 18 = 2000670e 00000000 0000cf01 00000000 f6f1
ffff8ca190c48b40 2038562698 S Ii:1:066:1 -115:4 64 <
ffff8ca190c48b40 2038574693 C Ii:1:066:1 0:4 18 = 2000680e 00000000 0000f601 00000000 6af2
ffff8ca190c48b40 2038574697 S Ii:1:066:1 -115:4 64 <
ffff8ca190c48b40 2038582693 C Ii:1:066:1 0:4 18 = 2000690e 00000000 0000f601 00000000 1df2
ffff8ca190c48b40 2038582697 S Ii:1:066:1 -115:4 64 <
ffff8ca190c48b40 2038594697 C Ii:1:066:1 0:4 18 = 20006a0e 00000000 0000cf01 00000000 6af2
ffff8ca190c48b40 2038594702 S Ii:1:066:1 -115:4 64 <
ffff8ca190c48b40 2038602696 C Ii:1:066:1 0:4 18 = 20006b0e 00000000 0000f601 00000000 43f2
ffff8ca190c48b40 2038602700 S Ii:1:066:1 -115:4 64 <
ffff8ca190c48b40 2038614695 C Ii:1:066:1 0:4 18 = 20006c0e 00000000 00001c02 00000000 43f2
ffff8ca190c48b40 2038614699 S Ii:1:066:1 -115:4 64 <
ffff8ca190c48b40 2038622695 C Ii:1:066:1 0:4 18 = 20006d0e 00000000 0000f601 00000000 6af2
ffff8ca190c48b40 2038622699 S Ii:1:066:1 -115:4 64 <
ffff8ca190c48b40 2038635128 C Ii:1:066:1 0:4 18 = 20006e0e 00000000 00001c02 00000000 43f2
ffff8ca190c48b40 2038635134 S Ii:1:066:1 -115:4 64 <
ffff8ca190c48b40 2038642696 C Ii:1:066:1 0:4 18 = 20006f0e 00000000 0000f601 00000000 43f2
ffff8ca190c48b40 2038642701 S Ii:1:066:1 -115:4 64 <
ffff8ca190c48b40 2038662697 C Ii:1:066:1 0:4 18 = 2000700e 00000000 0000f601 00000000 1df2
ffff8ca190c48b40 2038662703 S Ii:1:066:1 -115:4 64 <
ffff8ca190c48b40 2038674698 C Ii:1:066:1 0:4 18 = 2000710e 00000000 0000f601 00000000 6af2
ffff8ca190c48b40 2038674702 S Ii:1:066:1 -115:4 64 <
ffff8ca190c48b40 2038682697 C Ii:1:066:1 0:4 18 = 2000720e 00000000 0000f601 00000000 1df2
ffff8ca190c48b40 2038682700 S Ii:1:066:1 -115:4 64 <
ffff8ca190c48b40 2038694698 C Ii:1:066:1 0:4 18 = 2000730e 00000000 0000f601 00000000 6af2
ffff8ca190c48b40 2038694702 S Ii:1:066:1 -115:4 64 <
ffff8ca1aa7de900 2038698696 C Ii:1:063:3 0:1 30 = 01014000 00000000 00000000 00000000 00000000 00000000 00000000 0000
ffff8ca1aa7de900 2038698722 S Ii:1:063:3 -115:1 30 <
